למחיר מיוחד ב NordVPNhttps://nordvpncom/Gariniבבקשה כנסו זה עוזר לערוץ! ,❤️
כל הכבוד תודה אלון אתה הסוקר הכי טוב שאני מכיר ,🎧
הדר מוכתר וגם בן גביר,👍
לא סתם התחלת את הסרטון עם עולם משוגע הכי מתאים לאפליסטים ,🤣
איך ליצור הייפ מאת אפל ,🤦‍♂
אלון סרטון טיל!טעית כשאמרת אפל ווטש 9 במקום 8,😉
אני עם אייפון 13 פרו והוא כבד רצח נופל לי על הפנים בזמן שכיבה במיטה,😂
אחלה סרטוןמתי האשטק???,👑
איבדתי אותך במעבדים,😂
כל הכבוד אלון המלך השגת את הספונסור של היוטיוברים הבינלאומיים יאללה זה רק ההתחלה! ,👏
אלון רק על הפתיחים שלך אתה צריך לקבל פרס…זה קורע אותי כל פעם מחדש…,😂
היי אלון רכשתי את הvpn דרך הקוד שלך והחוסם פרסומות לא עובד לי/לא הבנת איך מפעילים אותו אשמח ממש לעזרה,🙏
תודה רבה על הסרטון אני רק לא מצליח להבין מה יהיו החידושים של האייפון 14 הרגיל ביחס ל13 אם נשאר אותו מעבד ואותה מגרעת ואפילו 120 הרץ לא יהיה אז מה ההבדל בתכלס?,🙏🏼
אלון אני רוצה לקנות את האייפון 14 הרגיל של ה128 גיגה בייט והראתה בסרטון שזה עולה 800 דולר ו800 דולר יוצא 2700 שקל זה זול ברמות אני לא מבין האייפון 13 עולה יותר מזה אשמח לתשובה,😁
יקר לי ,😉
היי אלון אני מת על הסרטונים שלך ותמשיך ככהושאלה: למה אין יותר apple watch s6 לקנייה?,❤️
אני מחכה לראות אותך באייפון 35 ביקורת גם חחחח אחלה אלון ,🤘
על מה אתה מדבר הסאונד של המיקרופון נשמע הכי טוב ששמעתי עד עכשיו!!! יא  אלון תמשיך ככה,👑
סקירה מהממת!! תודה רבה ,🍉
אלון ימלך אוהב אותך תמשיך ככה ,💙
אלון ימלך אוהב אותך תמשיך ככה ,💪
ממש אהבתי עכשיו ממש עזרת לי כי ממש הייתי בדילמה לגבי זה וממש פטרת לי את הבעיה תודה רבה ,💗
פליז תענה לילחכות לשעון החדש של אפל או לקנות את 7??,🙏
תודהההה!!! אלוף זה כזה כיף לצפות בסירטונים שלך!!!,❤️‍🔥
תודהההה!!! אלוף זה כזה כיף לצפות בסירטונים שלך!!!,❤️
אני לא מכיר את העכבר אבל עכבק מוזר צורה מוזרה וזה אפל אי טוב בטלפונים לא בעכברים,🤣
באמת המוצר הכי גרוע שלהם הוא ממש לא נוח לשימוש ונראה כמו מכשיר מעוצב ופחות שימושי ,😩
המיקרופון מת ,💀
סקירה מגניבה ביותר !!!! מוצר יקר מאוד לטעמיאלון תגיד מה זה הצמיד המגניב הזה עם ה-XXX? ומה קרה לאפל ווטש שלך??? ,🧐
וואלה תודה רבה חשבתי ליקנות רחפן כזה ועכשיו אני יותר שמח בקשר לליקנות אותו תודה רבה אלון ימלךךך,❤
בבקשה אלון תעשה סרטון על השעונים החדשים של סמסונג ואם אתה רואה את התגובה הזאת אוהב אותך ,❤️
אפשר לשאול מאיפה החולצה?,😅
אחד הסירטוני סקירה הכי טוב שראיתי,🥰
אוף חיכיתי ממש לרחפן הזה והוא בסוף ממש יקר חחחבעיקר בגלל שאמרו שהוא מושלם למתחיליםכנראה שנתחיל עם ה-FPV ,🤷‍♂️
כל מי שקורא את התגובה הזאת שיהיה לו חיים טובים,🙏
יאווו אתה מבין בכלללל הטכנולוגיה האפשרית!!! אלוףףף אין עליך!!!,❤️‍🔥
יאווו אתה מבין בכלללל הטכנולוגיה האפשרית!!! אלוףףף אין עליך!!!,💪
תודה אהבתי את הסרטון תעשה עוד על רחפנים נתתי לייק וסאב ממזמן תמשיך כך ,👌
תודה אהבתי את הסרטון תעשה עוד על רחפנים נתתי לייק וסאב ממזמן תמשיך כך ,❤
זאת ךא חולצה של מארוול בוגד,😜
עוד סרטון של אלון תודה,😁
למחיר מיוחד ב NordVPN https://nordvpncom/Gariniבבקשה כנסו זה עוזר לערוץ! ,❤️
ועכשיו דוגרי אלון חותם אתה ממשיך עם העכבר והמקלדת של  ,😂
איזה כיף לראות את הסרטון הזה ,😁
חשבתי שהמוצר הגרוע ביותר של אפל הוא המטען נייד האלחוטי שלהם ,🙃
אתה ממש טועה טעינה של 2 דקות מספיקה ל9 שעות אז אני לא חושב שלקחת הפסקת קפה תהרוג אותך,😀
סרטון מעולהיהיו מקלדות למחשב בטאץ&#39; מתישהו?,😍
סרטון מעולהיהיו מקלדות למחשב בטאץ&#39; מתישהו?,👍
אלון אין כמו סמסונג גלקסי מסדרות הדגל ,🥇
השתמשת בעכבר שנים ועכשיו אתה בא להגיד שזה גרוע כי שלחו לך מתנה? קונים אותך בעכבר? יוטיובר לא מתחיל אמור לעלות קצת יותר,😂
לרכישה ופרטים על הפליפ ופולד 4: https://bitly/3BZiv18תכסנו לקישור זה חשוב לערוץ! ,♥️
הי אפשר בבקשה סרטון על הgalaxy watch 5? כי קניתי אותו והוא מגיע עוד כמה ימים,😀
וואי אתה גדול לחחחח אחלה מעברים ממש זורם ונחמד כיף לשמוע אותך אלוף ,❤️
וואי אתה גדול לחחחח אחלה מעברים ממש זורם ונחמד כיף לשמוע אותך אלוף ,✌️
וואי אתה גדול לחחחח אחלה מעברים ממש זורם ונחמד כיף לשמוע אותך אלוף ,😅
וואי אתה גדול לחחחח אחלה מעברים ממש זורם ונחמד כיף לשמוע אותך אלוף ,🙏
תודה ,✌🏼
איכס מכשיר מגעיל עם מסך צר ולא נוח הוא קיים כבר שנים בשוק והרוב לא רוצים אותו וגם לא ירצו אותואפל לא חושבים בכלל על מכשיר מכוער כזה שגורם לחברה להפסיד ביצור,🤢
איכס מכשיר מגעיל עם מסך צר ולא נוח הוא קיים כבר שנים בשוק והרוב לא רוצים אותו וגם לא ירצו אותואפל לא חושבים בכלל על מכשיר מכוער כזה שגורם לחברה להפסיד ביצור,🤮
אלון אלון אני מעריץ ענק שלך עם תוכל להמליץ לי על פלפון טוב עד 1500שקלים אני יותר מאשמחתודה,😘
אלון אלון אני מעריץ ענק שלך עם תוכל להמליץ לי על פלפון טוב עד 1500שקלים אני יותר מאשמחתודה,🤗
אלון אלון אני מעריץ ענק שלך עם תוכל להמליץ לי על פלפון טוב עד 1500שקלים אני יותר מאשמחתודה,🥰
חתיכת סרטון!! שאפו אלון! הפתיח הצחיק אותי,🤣
אלון יא מלך אין לי אינסטגרם או משהו לדבר איתך אז אני פונה אליך פהאני רוצה לקנות טלפון במחיר של עד 2000 שקלים חשוב לי אנדרואיד לא אייפוןאני צלם במקצועי חשוב לי מאוד מערך הצילום והמעבדאשמח אם תתן לי את הטלפון שישמש אותי ברמה הכי גבוהה לנתונים שהבאתי לךכמו תמיד כיף לצפות בסרטונים שלך!שבת שלום,💪
אלון יא מלך אין לי אינסטגרם או משהו לדבר איתך אז אני פונה אליך פהאני רוצה לקנות טלפון במחיר של עד 2000 שקלים חשוב לי אנדרואיד לא אייפוןאני צלם במקצועי חשוב לי מאוד מערך הצילום והמעבדאשמח אם תתן לי את הטלפון שישמש אותי ברמה הכי גבוהה לנתונים שהבאתי לךכמו תמיד כיף לצפות בסרטונים שלך!שבת שלום,✌️
אחלה חולצה ,💪
הרמה ממש עלתה  כל הכבוד!!!,😲
איזה חולצה של ריק ומורטי ,😍
יקרררררראוהב אותך אלון,😮
יקרררררראוהב אותך אלון,👏
מחכה לסקירה על גלאקסי ווטש 5,🙏
סרטון מהמםעכשיו לחזור לעשות פודקאסטים,😝
איזה מלך  אלוןןןןןן מת עליך סרטון מניו יורק!!,👑
סקירה LG C2 מבחינת !! ,👏
מאכזב לראות שאין שום שינוי מהותי בדורותסקירה מעולה ושאפו על המהירות,👍
אני כל-כך מעריך את זה שאתה טס פאקינג לניו יורק כל שנה בשביל לצלם לנו ראשון !ֶ אתה מלך אלון באמת (מקווה שאתה שם עד היציאה של האייפון 14ֶ⁠),☺️
תותח אחלה סרטון כמו תמיד ,🙏
פגז,🔥
כול הכבוד לך אתה מלך אין עליך אלון מעריכים את כול מה שאתה עודה בשבילנו,❤️
אחלה סרטון ! עזרתי לי עם יותר מידע על הטלפון ועל המידע לקנות אחרי הA51 את הflip 4 ,👍
תותח סרטון פגז ונראה שהפעם היה שווה לטוס ,🔥
תותח סרטון פגז ונראה שהפעם היה שווה לטוס ,😅
אפילו העלת לפני MKBHD!תמיד אמרתי שאתה ה MKBHD הישראלי,😏
מקווה שבעדכון הבא יהיה אפשרי להפעיל את כניסת ה 35 ממ מאז האייפון 7 גמורים לגמרי שם באפל,🤦🏼
צד אחד רציתי שיראו מלא זמן כבר את האחוזי הסוללה כי זה היה מעצבן שכל הזמן צריך היה לגלול למעטה כדי לראות כמה סוללה נשארה באייפון וצד שני כבר התרגלתי לגלול למעלה ולראות כמה סוללה נשארה באייפון לא יודע מוזר לי לא יודע אם זה טוב או רע,🤣
צד אחד רציתי שיראו מלא זמן כבר את האחוזי הסוללה כי זה היה מעצבן שכל הזמן צריך היה לגלול למעטה כדי לראות כמה סוללה נשארה באייפון וצד שני כבר התרגלתי לגלול למעלה ולראות כמה סוללה נשארה באייפון לא יודע מוזר לי לא יודע אם זה טוב או רע,❤️
מסתבר שאני רואה כל סרטון פעמיים כי אני עוקב אחריך בכל הפלטפורמות ,😉
אפליסטים: יש סוף סוףאנשים שמשתמשים באנדרואיד: ,😐
אלון אני אוהב לצפות בסרטונים שלך מאוד תנסה להעשות סקירה על IONIQ 5 החשמלית החדשה! ,🙏
סקירה אמיתית ונכונה מנסיון ,👍
אחלה של סרטון!!!רק עצה שלי תשים סגיר או משהו אחרי הסרטון אנימציה או משהו כזה כדי לא לגמור את הסרטון בבום כמו נגיד עכשיואבל זאת התלונה היחידה שלי הסרטונים שלך,😉
סרטון מדהים! תודה על ההסבר המפורט אשמח אם תוכל לסקר עוד רכבים מועיל ומאוד מעניין! ,😄
אחלה סקירה!13:00 לגבי הסטייה מהנתיביש שני סוגי מערכות הקשורות לסטייה מנתיב1 בקרת שמירה על נתיב - זו בקרה ששומרת עלייך במרכז הנתיב קבוע ממש כאילו אדם נוהג ברכב2 תיקון סטייה מנתיב - כמו שזה נשמע הרכב לא ישמור על מרכז הנתיב ויתקן את הסטייה שלך במקרה וסטיתזו בקרה שנועדה לעזרה במקרה של היסח דעת קל בנהיגה וזה לרוב אגרסיבי בכדי שתתעורר ותתרחק מכל היסח דעת כמו טלפון ילדים וכו…,😁
אחלה סרטון לא מכיר את ג׳ילי - אחרי שראיתי - קניתי עוד מניות טסלה  just sayin,🤷🏼‍♂️
אוו מגניב אני שמח שאתה מתחיל לחזור למכוניות,❤
אוו מגניב אני שמח שאתה מתחיל לחזור למכוניות,😉
אוו מגניב אני שמח שאתה מתחיל לחזור למכוניות,😃
אוו מגניב אני שמח שאתה מתחיל לחזור למכוניות,👍
תוסיף בבקשה אופציה לכתוביות ,🙏
אהבתי מאוד תמשיך! סקירה נהדרת ואתה מעביר את התחושות שלך הכי טוב שאפשר במילים ממש הרגשתי את זה ותמיד אעדיף לראות סקירה שלך מאשר הסקירות רכב שאנחנו מכירים כיום ,🙏🏻
לא מחפש רכב ובכל זאת אתה פשוט עושה את זה כ&quot;כ מעניין ,🙌
לא מחפש רכב ובכל זאת אתה פשוט עושה את זה כ&quot;כ מעניין ,❤️
פתיח מדהים ,😍
אלון מת עליך ועל הסרטונים שלךבבקשה תעשה עוד סרטונים על מכוניות חשמליות מאוד אוהב את התחוםמלך,👑
בקיצקוץ הרכב לא להיט  אבל הסרטון כן סרטון מעולה העריכה מעולה וכמו תמיד נהנתי מאוד,💥
בקיצקוץ הרכב לא להיט  אבל הסרטון כן סרטון מעולה העריכה מעולה וכמו תמיד נהנתי מאוד,🫠
תשמע סקירה זה שהבחנת בעניין של הבלימה של המנוע שכל פעם צריך לכוון מחדששאפואבל חסרון גדול שלא הבחנתה בו הטעינה המהירה בגילי לא מספיק מהירה כמו שמקובל 250/150 הטעינה שלה היא 75 קילוואטמאוד איטי לטעינה מהירה,🔥
יצא לי לראות הרבה סקירות אתה וצביקה מקבוצת קופר דיל פשוט הכי תותחים ששמעתיאם אפשר לבקש סקירה של 3 סוגי רכב חשמליים שנגישים גם במחיר דוגמת Aiways/geely/mg as ev ובעצם לעשות השוואה מה הכי טוב ומשתלם בעיניך תודה מראש ,🙏
יצא לי לראות הרבה סקירות אתה וצביקה מקבוצת קופר דיל פשוט הכי תותחים ששמעתיאם אפשר לבקש סקירה של 3 סוגי רכב חשמליים שנגישים גם במחיר דוגמת Aiways/geely/mg as ev ובעצם לעשות השוואה מה הכי טוב ומשתלם בעיניך תודה מראש ,❤
כמו שאמרת בסרטון קודם לצלם בחוץ נראה פשוט מדהים צבעים טובים תאורה טובה הסרטון נראה פשוט טוב!,🔥
אחלה סרטון רק להבא חשוב לדבר גם עם בטיחות לא פחות חשוב ,😉
איזה מגניב בטירוף וסרטון מהמם,😘
המוקם שאני נמצא בוא אחד המלוכלכים אני הולך להיות עשיר,🤑
איזה אפליקציה זבל… אגב הם לא חשבו שהם מתאימים את זה לישראלים? פה זה לא אירופה ישראלים מספיק תחמנים כדי לקחת זבל מהביתלזרוק בחוץ ולצלם את עצמם אוספים אותו בשביל הנקודות (וברצינות: יוזמה טובה וצילום ועריכה ממש טוביםאלון עשיתי לייק לסרטון),😂
כפרה על קלין קוין ועליך ,❤
סרטון מדהים ואפליקציה פצצה לא סתם אלון בחר לעשות עליה סרטון כפיים ,👏
ואווו ,😍
ואווו ,👌🏼
אני חשבתי כבר על הרעיון הזה וזה ממש מבאס בשבילי שזה קיים…,😰
אני מתגעגע לזקן הארוך,😖
אני מתגעגע לזקן הארוך,😭
אלון אני מת על הערוץ שלך תמשיך ככה ,🔥
רמה של חו&quot;לסקירה מעולה ,🔥
היי תגיד יש פלאפון חדש של נוקיה winner הוא הולך להימכר בארץ? ואם כן מה המחיר המשוער שיימכר? אשמח לתשובה בבקשה,🙏
אחלה סקירה כרגיל תודה על הכנות שנתת כי היה לי צד לקנות אותה וכנראה אני יקנה את הפוקו f4 אז תודהואממ איפה היית בקסריה הראשונה? איזה הופעה? (פתאום אתה אומר לי אודיה,😂
אחלה סקירה כרגיל תודה על הכנות שנתת כי היה לי צד לקנות אותה וכנראה אני יקנה את הפוקו f4 אז תודהואממ איפה היית בקסריה הראשונה? איזה הופעה? (פתאום אתה אומר לי אודיה,😉
מחר אני קונה איייפון se ושום דבר לא יעצור אותי מלקנות אייפון,👈
מחר אני קונה איייפון se ושום דבר לא יעצור אותי מלקנות אייפון,😍
האנדרואיד שמעוצב הכי טוב כי הוא מעוצב כמו אייפון ברור שהוא נראה הכי טוב,💪
הפס למטה של האייפון,😍
רק אני שמתי לב שהוא שיפר את העריכה ?דרך אגב סקירה מטורפתת ,🔥
אני בתור סאונדמן בבדיקה של מיקרופונים יתחיל לומר ”אם 1 אם 2” ,😅
גרעיני כפרה עליך( )איפה הסרטון על הטלפון של נופינג?,👑
אחלה סרטוןןןמה עם הנוטינגגגאני ממש רוצה לקנות אותו,😂
סקירה מטורפת  סרטון ענק מלך ,👑
סקירה מטורפת  סרטון ענק מלך ,🔥
סקירה מטורפת  סרטון ענק מלך ,😍
אלון אני רואה כל סרטון שלך וכל סרטון שלך מעולה ונותן את כל מה שצריך לדעת על פריט מסויםתודה רבה לך עזרת לי ברכישת דברים רבים ,❤️
אלון אני רואה כל סרטון שלך וכל סרטון שלך מעולה ונותן את כל מה שצריך לדעת על פריט מסויםתודה רבה לך עזרת לי ברכישת דברים רבים ,😊
כן פשוט תדפוק אותו על השולחן,🤷‍♂️
סוף סוך טלפון לחולי אפילפסיה,❤️
אני יוותר בליקנות את המכשיר המשונה הזה,😮‍💨
המכשיר נראה כמו עוד קשקוש שלא שווה שקל הסרטון טוב ,😃
עוד פלאפון שום דבר חדש ,🤷🏻‍♂️
תעשה סקירה מלאה אלון ,💥
לא מאמין זריז אתה ,😳
לא מאמין זריז אתה ,🤓
לא מאמין זריז אתה ,🤩
אין על הסקירות שלךאיתך מאז ה18k ,😍
אין על הסקירות שלךאיתך מאז ה18k ,❤
היה אחלה לייב אלון יא תותח !! תודה על ההשקעה,🙏🏻
היה אחלה לייב אלון יא תותח !! תודה על ההשקעה,❤️
היה אחלה לייב אלון יא תותח !! תודה על ההשקעה,😁
הושק כבר חדש לא רלוונטי יותר ,😂
יש לי בדיוק את הטלפון הזה,😁
אני אמור לקבל את המכשיר הזה ממש בשעה הקרובה עשית לי את היום,💪🏼
מחכה נורא לסקירה חדש בנושא האייפון 14 האמת מי שאני יחסית מאמין בו בחול זה זון אוף טאצ אבל מחכה ממש לסקירה שלך מתקרבת לאייפון 14 ובכלל לדברים החדשים של אפל,👑
זה יותר טוב מהפוקו אף שלוש?תודה ורני חולה על הסרטונים שלך,🔥
קניתי זוג מכשירים של הדגם כזה להורים שלי לכבוד יום הנישואין שלהם! הם סופר אהבו את המכשיר בעיקר הטעינה המהירה!! הייתי בהלם מקצב הטעינה המהירה הזאת ואלון היקר כמו תמיד סקירה מהממת,🔥
קניתי זוג מכשירים של הדגם כזה להורים שלי לכבוד יום הנישואין שלהם! הם סופר אהבו את המכשיר בעיקר הטעינה המהירה!! הייתי בהלם מקצב הטעינה המהירה הזאת ואלון היקר כמו תמיד סקירה מהממת,👏🏽
היי אלון מנצל את זה שזה סרטון על שיאומי אז אין לו הרבה תגובות אבל אתה חייב לעשות סרטון של המדריך האולטימטיבי לבחירת מצלמה!!! חייב חייב חייב חייב… (לא בגלל שאני מחפש מצלמה אני מבקש בשביל חבר וזה גם יתפוס מלא חשיפה),🙄
גמרתה אותי עם ה 5G ,😂
אחלה סקירה כמו בדרך כלל ,❤
יא מלךרציתי לבקש ממך אם אתה יכול לעשות סירטון על הסמרטפון של אלון מסק,❤
לייק לפני צפייה כרגיל ,🥵
לייק לפני צפייה כרגיל ,👌
סקירה לעיניין ,‼️
נזכרת לעשות עליו סקירה,😂
היידה אלון אח בכיררר אין כמו הסקירות שלך,❤️
היידה אלון אח בכיררר אין כמו הסקירות שלך,🔥
אלון סקירה מצוינת כל הכבוד ,👏
אלון סקירה מצויינת אהבתי מאוד את החשיבה מאחורי כל הרקעים זה ממש מוסיף לאיכות הסרטון  המשך כך אין עלייך! ,💪
אלון סקירה מצויינת אהבתי מאוד את החשיבה מאחורי כל הרקעים זה ממש מוסיף לאיכות הסרטון  המשך כך אין עלייך! ,👍
אחלה סרטון כמו תמידנשמח מאד אם תעשה עוד תוכן על שיאמי ,🔥
אחלה סרטון כמו תמידנשמח מאד אם תעשה עוד תוכן על שיאמי ,🥇
אחלה סרטון כמו תמידנשמח מאד אם תעשה עוד תוכן על שיאמי ,⚡
אין על הסירטונים שלךאיזה אוזניות של אפל אתה ממליץ לקנות עכשיו?,❤️
יש לי רדמי נוט 9,😅
סירטון מדהים כמו תמידיש לי שאלה האם עדיין כדי לקנות את האיירפודס פרו?,❤️
איזה קטע שגם בתמונה המסך של האייפון שבור ,😂
יש לך ביטקוין?,😯
לא ‏ ‏קראטה את השאלה שלי :( (לא בקטע רע ),😝
שמח שאתה מתגרה בנו עם הפלייסטישן 5 ברקע שם ,😉
אלוף! מצטרף לבקשה לסרטון הדרכה בPinalCut למתחילים,🙏
וואי אלון סרטון פגז אחי אשמח לסרטון על דיסני פלוס יעזור לי מאוד אוהב אותך מלך ושמח שאתה מקבל מוטיבציה מהתגובות החמות תמשיך ככה אח ,❤️
מלךךךךךך,👑
אלון אם אפל יוציאו רכב היה לו windows ? ,😂
תקציר של הפודקאסט אבל כל מה שאתה עושה תמיד מעניין,❤
מחזיק הרבה אצבעות,😂
איזה סרטון טוב נהניתי מכל רגע,🥰
הבעיה הכי גדולה של האנושות שנגמרת הסוללה של המצלמה באמצע רק טוב לך ולעם ישראל,🤣
חולה על ‏הסירטונים ‏שלך ,😁
באמת ניראת טלויזיה מדהימהתתחדש אלון אחי! ,🙂
באמת ניראת טלויזיה מדהימהתתחדש אלון אחי! ,👍
אתה יודע איך מסירים את הiOS 16אנו לא רוצה אותו בטלפון שלי,🥺
סרטון מעולה קודם כל תגבי המסכי קולנוע בגלילות יש מסך onyx שהוא חווית הקולנוע הכי טוב בארץ ברמה של oled ממליץ לך לבדוק ,😊
היי אני מתחיל ערוץ גיימינג למשחקי vr אם תוכלו להצטרף לבדוק ולתמוך בערוץ רק כדי לתת לו את הבוסט ההתחלתי ממש אודה למי שיכול ואתחיל להעלות לייב סטריימס מהקווסט 2 ,🙏
הכי חשוב הסרט של ספיידרמן אין דרך הביתה ,😵‍💫
רשאית כל תודה על הסקירה!שנית כמה זמן אחריות ועל מה לא שמעתי עם אמרת,🤔
וואו אלון אוהב אותך יש לך סרטונים מעולים בבקשה תענה מחכה לכל סרטון שלך מתי תעלה סקירה על הגלקסי טאב s8 אולטרה?והאם תוכל לעשות סקירה גם על הטלוויזיה הכי טובה של סמסונג?,🔥
אלון כל הסרטונים שלך מצויינים וטובים ואני אשמח נורא עם תעשה סרטון הדרכה על השלט של mini3 pro ואיך מורידים לפלאפון בבקשה אני מתחנן (מי שאיתי שיתן לייק),😔
