אלון ינסיך על חלל מצחיק שזה נכתה 3 מתוך 4 אותיות ביוונית(אח שלך חובב יוונית)Δ = deltaΣ = sigmaΟ = o micronאז יותר נכון לקרוא את זהDSROד&quot;א R ביווניתנכתה: Ρ,❤️
בחייאת תעשה סרטון על מחשב נייד ב3 4 אלף ,🙏
יום מאושר הוא יום שעולה בו סירטון חדש אצל אלון,😍
יום מאושר הוא יום שעולה בו סירטון חדש אצל אלון,❤
אחלה סרטון ,👌
אחלה תוכן אלון,😀
אחלה תוכן אלון,👍
בול בשבילי,😃
סירטון מושלם אלון אתה יכול לעשות סירטון השוואה בין 13 פרו מקס לבין ה 12 פרו מקס ,🙏
סירטון מושלם אלון אתה יכול לעשות סירטון השוואה בין 13 פרו מקס לבין ה 12 פרו מקס ,💚
אתה יכול לעשות סרטון על הPolishing cloth החדש של אפל?,😂
אין עליך ,❤️
אין עליך ,👌
אין עליך ,👏
שמח שאתה מגוון בתוכן,💻
שמח שאתה מגוון בתוכן,🖥
מחשב גיימינג ממש מגניב סרטון טוב איך הן לך כבר מליון סאבים ,💪🏼
מחשב גיימינג ממש מגניב סרטון טוב איך הן לך כבר מליון סאבים ,🛎
מחשב גיימינג ממש מגניב סרטון טוב איך הן לך כבר מליון סאבים ,👍
יגבר חולה עליך תמשיך אני צופה בך כבר שנתים כל מה שאני יודע על טלפונים זה ממך,📱
מתי תעשה סקירה על הmacbook החדש? אוהב אותך תותח,🔥
עשירי אחלה מחשב אהבתי ,👍
אחלה סרטון לפני שראיתי,😁
סרטון מרגש אבל אפשר קישור לרקע של האייפון?,😳
אז לקנות את האירפודס 3 או את הפרו? ,🤔
אוהבים אותך אלון כל פעם שאני רוצה להתעדכן אני נכנס לסרטונים שלך ,🥰
מעניין ממש איך יהיה המעבר מדור 2 לדור 3 באופן אישי קניתי את האיירפודס פרו שהן רק יצאו עד היום נמצאות אצלי בקרטון אחרי שהשתמשתי בהן בפעם אחת לא התאימו לי מקווה שהדור החדש יישב בול! סקירה מעולה אח!,😉
אחלה ביקורת תודה ,😃
אלוף אלוף !! תהייתי אם תוכל להשוות בין האיירפודס החדשים לבין beats studio buds האוזניות האלו ??,👏
מדהים איך הצלחת לעשות את כל הסרטון הזה בלי שיורגש שנשבר לך הקייס של האיירפודס פרו…,🤣
מדהים איך הצלחת לעשות את כל הסרטון הזה בלי שיורגש שנשבר לך הקייס של האיירפודס פרו…,😂
וואו 4:34 ,😂
תעשה גם ככחה על דגמי האייפון פרו 12 ו13 ,👍
תעלה סרטון שלך משחק פאבגי ,🙏
היישמתי לב שיש עוד צלם איתך( כאילו תמיד אתה מצלם לבד),😜
מסך מטורףסקירה משובחת ביותר ,👍
הגב של אלון אחריי שהוא הרים את המסך הזה,♿
עוד בוקר משובח עם סרטון של אלון התותח ,🤩
משהו טוב ,🍬
מדהים יש לי מסך 34 של LG בבית והוא מרגיש לי גדול מידי עם מסך כזה הייתי צריך שולחן חדש ,😁
תתחדש ,❤️
מטורףף תחדש תותח ושהיה לך שבת שלום,😃
לפני שפתחת את העטיפה מהמסך עצמו הוא היה נראה כמו הכלי נשק של ת&#39;אנוס,😂
חלאאאאאאאס לדבר על אפל,🤣
אין עליך באמת מספר אחד מבחינתי !! תהייתי אם תוכל להשוות בין האיירפודס החדשים לבין beats studio buds האוזניות האלו,🤘
אין עליך באמת מספר אחד מבחינתי !! תהייתי אם תוכל להשוות בין האיירפודס החדשים לבין beats studio buds האוזניות האלו,💪
מה זה המחירים האלו?!?!?! אמאלההההה משכנתא ,😂
מה אתה מחכה את unbox therapy אפילו יש לך את העציץ על השולחן לובש כובע מנסה להיראות כמו לו ,🤦🏻‍♂️
אתה אלוף! כיף לראות סרטונים שלך ,❤️
המעבדים האלה של אפל תוכננו בארץ,🇮🇱
כל כך מדויק אלון! ( כבר לא מפתיע מזמן ) מעריץ אותך,‼️
אין עליך אלון תותח על חלל ,👍
אין עליך אלון תותח על חלל ,⚡
וואו תכלס אפל רוששו אותך השנה רחמים,😒
700 שח לאוזניות בלי סינון רעשים ,🤦‍♀️
חיכיתי לתגובה שלך מתי בדרכ המקים החדשים מגיעים לארץ ביחס לארה״ב?,🔥
תעשה השוואה בין המטלית החדשה של אפל לחבילת טישו רגילה,🤑
כפרה אין לך בטרייה בעכבר,😂
כליה אחת תספיק כדי לרכוש את ה14 אינצ&#39;? ,🤕
אלון אתה פשוט טוב ,🔥
שבת שלום ,❤️
היה אחלה לייביאללה תעשו עוד,👌
היה אחלה לייביאללה תעשו עוד,👍
אלון אתה חייב לציין שזה ה11T PRO שעולה 2699 שח והמכשיר שעולה 1800 שקל הוא 11T עד שהבנתי מה קורה פה (12GB ראם בסרטון לעומת 8 באתר של המילטון) התבלבלתי לגמרי,😅
סוף סוף סקירה על דגם של שיאומי חיכיתי לזה העם דורש יותר סירטונים של שיאומי!,😂
סרטון מעולה!!בהחלט נשמח לראות סרטונים על מכשירי ביניים של כל החברות ולא רק של אפל וטיפלה מסמסונגולא רק סרטונים כל מכשירי פרימיום שמעט מאד אנשים קוניםנשמח גם לראות סקירות על סדרת הפרימיום של סמסונג כמו שאתה עושה לאפלמקווה שזה יגיע אילך אלוןתודה רבה,😁
בס&#39;&#39;דלקוח של שיאומי ותודה על הסרטוןמה הטלפון הכי שווה לקנות משיאומי לבנאדם רגיל נשמח לשמוע ואתה פשוט נראה טוב ועושה את עבודתך נאמנה אפילו שאתה מעריץ של אפל,🙏
אורך הסרטון הוא 13:13 ,😎
היי אלון גרעיני ראשית כל הכבוד על המקצועיות בסקירה תמשיך כךאחרי עשר שנים עם אנדרואיד עברתי לiOS ואני חייב לציין שהמעבר היה קל וידידותי מה שהכי חששתיאני מחפש מידע נוסף על מערכת ההפעלה של iOS ‏ומה יתרונות שיש למערכת על פנים אנדרואיד?‏אודה לך אם תעשה סרטון בנושא,😉
אייפון 13 רגיל בעזרת ה&#39; היום/מחר חדשדש בעזרת ה&#39;,🙏
אלון אתה אלוף בלסקר ברמותת אבל נראה לי שעדיף סוני,👍
אלון אתה אלוף בלסקר ברמותת אבל נראה לי שעדיף סוני,❤
הbackground מאחוריך בסרטון הזה ממש נקי ויפה רמה של חול,❤️
הbackground מאחוריך בסרטון הזה ממש נקי ויפה רמה של חול,😅
סרטון מעולה כמו תמיד,❤
מרגש ומעניין ,👋🏻
אין עלייך אלון מקצועי ביותר אתה מסביר הכי טוב שיש תודה ענקית ,❤️
הייתי אתמול בהשקה! (אני אמרתי לך לעשות את הסירטון ),😁
תעשה סרטון באיזה אייפד כדאי לבחור בבקשה,🥺
תותח,👑
תותח,❤️
תותח כמו תמיד,👍
אני אתה ושחר צריכים לקבל מדליה על כמות הפעמים שהפלנו מוצרים  סקירה מעולה כמו תמיד!,🤣
אין עלייך אלון כמו תמיד סקירה אחלה מעניינת ותמיד כיף לשמוע אותך,😃
סרטון אשש חיכיתי לו ממש ממש עזרת לי כהרגלךך,🔥
כמו תמיד אחי תותח,🔥
הייתי בניו יורק כשהמכשיר הושק התרשמתי מהקלילות שלו ממש קל והיה מאוד נוח להחזיק אותו רכשתי לעצמי אייפון מיני 13 אשמח לסקירה של האייפד מיני והאייפד בהזדמנות זו אחזור על מה שאמרתי לך לפני כשבועים ( במסעדת פועה ביפו - שוק הפשפשים ) שאני מאוד נהנה מהחומרים שאתה מעלה ,🙂
אם אני לא זוכר להשקות כל יום אתה רוצה שאני אזכור להשקות כל שנה?!,😂
כיף לראות את כל הסקירות שלך תענוג ,♥️
מדהים מה שהמוח הישראלי יודע לחלום ולממש! וכבוד על הסרטון והרצון התמידי שלך לפרגן ולעזור ,👏
קודם כל אבל דבר ראשון לכל דבר אחר: וואו!!!! פשוט וואו! ההשלכות של ההמצאה הזו על כל העולם!!! זה פשוט נס!כן חייב לשאול: הדבר הזה יכול לשרוד בשמש הישראלית לאורך זמן?? (חושב על האפשרות של לשתול את הקוביות הללו באדמות החקלאיות פה בארץ)חולה על הסרטונים שלך אלון פשוט תמשיך באותה הדרך! ,💕
שאפו על הפלסטיות והגמישות שלך להעלות לנו תוכן מעניין ללא התחייבות לנושא או לתחום מסויים ,💜
מזל שיש אותך,❣️
עם אתה הולך לסקר פיתוח והנדסה בישראל אתה הולך להיות מפוצץ בעבודה (:מעניין אם תוכל לסקר מוצרים של רפאל ואלביט מערכותמה שניתן לפרסום   ,✈
עם אתה הולך לסקר פיתוח והנדסה בישראל אתה הולך להיות מפוצץ בעבודה (:מעניין אם תוכל לסקר מוצרים של רפאל ואלביט מערכותמה שניתן לפרסום   ,🚀
עם אתה הולך לסקר פיתוח והנדסה בישראל אתה הולך להיות מפוצץ בעבודה (:מעניין אם תוכל לסקר מוצרים של רפאל ואלביט מערכותמה שניתן לפרסום   ,🛰
הדבר הגדול הבא מאז המצאת הטפטפה עוד סרטונים כאלה בבקשה! ,👏🏼
אחלה סירטון מרענן ,👍🏼
רעיון לא פחות מגאוני לפינהגאווה ישראלית  ישראלעלהמפה,🇮🇱
רעיון לא פחות מגאוני לפינהגאווה ישראלית  ישראלעלהמפה,❤
אני פשוט מעדיף צמחים מלאכותיים לבית,🤷‍♂️
מה יותר טוב ‏פולד3 או סמסונג גלקסי אס 21 אולטרה,⚡
סרטון מצוין (כרגיל) וחבל שלא ידעתי שאפשר לשאול אותך כל כך הרבה איזה אייפד (בתקציב מוגבל) מומלץ לעבודה עם פוטושופ לייטרום ופרימייר Rush?(כזה שיתן עבודה לפחות ל 3-4 שנים )אגב ממליץ על שמן לזקן של Label M,😃
בסירטון הזה ענית לי על כמה שאלות ביחד,👍
לגבי מה שאמרת על סקירת מכוניות גם mkbhd אמר את זה על עצמו בסרטון סקירה שלו האחרון על באייפון 13 פרו ב 2 דקות האחרונות שאנשים מגיבים לו על זה אז תרגיש בנוח,👊🏻
סרטון מעולה אהבתי את הקטעים הקרינג&#39;ים חחחח אין מילים לתאר את ההערכה על ההשקעה,🤩
תענוג רצוף לשמוע סקירות מימך,🤙
אלון שאלהיש לי את הIPHONE 12 PRO MAX ואמרת שAPPLE הפסיקו לייצר אותו אבל במעבדות תיקונים יהיו חלקים להחלפה?נב אני אוהב את הסרטונים שלך אתה עושה אותם פשוט מטורף תמשיך ככה,😊
אתה הסוקר הכי טוב בארץ חבר,🔥
תעשה השוואה בין ה12 פרו מקס ל13 פרו מקס חחחחח כי שידרגתי מה12 ל13 (פרו מקס) מעניין אותי מה תגיד,😅
קצר ולעיניין שאפו ,🥇
קצר ולעיניין שאפו ,🙏
חחחחחחח לאבד גם את האייפון וגם את הארנק במכה ?לא יכולתי לבקש יותר טוב מהמוצר הזה אתה מסביר מטורף כרגיל ,🤙🏽
אלון אפשר בבקשה אותו ,🙏
נהדר אבל למה 720 ,😅
חברים שלי!זה הקישור לאייפון 13 באתר פרטנר כנסו ותראו להם ששווה לפרסם אצלי https://bitly/2WbpAZZ,☺️
מה המחיר ,❤️
כול הכבוד ,👍
אלון אלון אלון אני לא יודע אם זה אמיתי ראיתי עכשיו סרטון של הjbl flip 6 אני מנסה לחפש עליו מידע ולא מוצא כלוםאז יש לי כמה שאלות שאולי אתה תוכל לענות לי עליהן:כמה הוא עולה?איפה אני אוכל לקנות אותו?(באיזה אתר / חנות)תודה מראש ומעריך,😉
אלון אתה אחלה בנאדם!!אפשר ותעשה סרטון על סידור זקן בבית,🙏
נעעע לא משהו מיוחד אם כבר אייפון עדיף את ה12 בפחות כסף לא מקבלים פה משהו יותר טוב באמת(הסרטון טוב בכל אופן ),😁
מתי יהיה כתוביות בעברית לסרטונים שלך?,🤔
לא נכנסתי לסרטון כלכך מהר מאז הסרטון האחרון שלך,😉
אתה פשוט יוטיובר מדהים המשך כך,💙
אתה פשוט יוטיובר מדהים המשך כך,💚
אתה פשוט יוטיובר מדהים המשך כך,👍
אלוףף ,🔥
קניתי לפני שבוע את ה13 פרו ובאתי מאייפון 7 בן ארבע וחצי שנים חחח :)אני מרוצה מאודד הוא מדהים! זה פשוט עולם אחר אני עדיין מתרגלת לגודל של המסך שהוא גדול מאוד ביחד לאייפון הקודם שהיה לי והוא גם כבד מאוד ביחס אליו חוץ מזה הוא מעולה עזרת לי מאוד בבחירה עם הסרטונים שלך תודה רבה!  אין עליך!! אלוףף,💕
היי נסיך תודה על כל מאמצייך ! כל חיי אני עם גלקסי וחשבתי הפעם ללכת על אייפון על מה היית ממליץ לי ללכת הייתי בייסיקית שיש לא עובדת ממנו אבל בו כל הזמן תודה רבה !!! אתה מומחה תותח פשוט,🙏
היי נסיך תודה על כל מאמצייך ! כל חיי אני עם גלקסי וחשבתי הפעם ללכת על אייפון על מה היית ממליץ לי ללכת הייתי בייסיקית שיש לא עובדת ממנו אבל בו כל הזמן תודה רבה !!! אתה מומחה תותח פשוט,❤
אלון יש מצב לקבל אחד מכל אלפי הטלפונים שיש לך? יש לי סמסונג 5 2016,🤣
אלון יש מצב לקבל אחד מכל אלפי הטלפונים שיש לך? יש לי סמסונג 5 2016,😭
באיזה אייפון יש סוללה יותר טובה ב13 פרו או 12 פרו מקס והסרטונים שלך מטורפים,🔥
סירטון יפה,❤️
אוהב את הערוץ שלך כייף גדול שיש אחד כמוך שמרים את הרף בארץאני עשיתי הזמנה ל13 פרו מקס 256 ג&quot;בואני מסופק אם לבטל ולהזמין את ה512 ג&quot;בכמה מספיק ה256 לאחד שהולך להשאר איתו 3-4 שנים?משתמש במשחקים וצילום ושאר ירקותתודה,🙏
מי שם לב שגם הזמן של הסרטון הוא 13 דקות עגולות ? ,😂
מה בסך הכול ביקשתי ליום ההולדת טלפון בשביל שיחות ולא מעבר אך לבסוף קיבלתי 21 אולטרה באמת תודה אבל כוסעמק המרדף אחר מודרניזציה,🤦‍♂️
מה בסך הכול ביקשתי ליום ההולדת טלפון בשביל שיחות ולא מעבר אך לבסוף קיבלתי 21 אולטרה באמת תודה אבל כוסעמק המרדף אחר מודרניזציה,😔
הייעל מה אתה ממליץ לפלאפון גיימינגאני רוצה להזמין את הRog phone 5 ultimateאבל שמעתי שהוא מתחמם קיצוניאו שזה סתם שטויותבבקשה תעזור לי ,🙏
איך הפרו שוקל יותר מהפרו מקס?,🤔
אלון תגיד אתה יודע מתי יהיה אפשר להעביר צאטים של וואטסאפ מאנדרואיד לאפל אשמח שתגיד את זה בסקירה על האייפון 13 ודרך אגב אתה אחלה של יוטיובר כיף לשמוע ביקורות,❤
אלוף אלוף אין כמוך תוכן ברמה הכי גבוהה שיש ותמיד לפני כולם !!!,😉
אלוף אלוף אין כמוך תוכן ברמה הכי גבוהה שיש ותמיד לפני כולם !!!,✌️
כמה הם עולים ,💸
תעשה סקירה על גארמין ,🔥
תודה ימלך ,💙
תודה ימלך ,👑
בנוגע לתשלום דרך השעון? לא התייחסת כלל חבל הקלדה דרך השעון הייתי ממליץ להוסיף בסיקור על אפשרות לקנות מקלדות חיצוניות שהיא נראת כמו מקלדת רגילה כמו בטלפוןהאם ניתן להריץ יוטיוב (של גוגל)?סה&#39;כ סיקור מעולה ,☺
תגיד שאלה מה רמת הקרינה של הרכב הזה? סרטון נדיר אגב ,👑
תגיד שאלה מה רמת הקרינה של הרכב הזה? סרטון נדיר אגב ,❤️
היי אלון תעשה וידאו ללא עריכה (כשעה)שנוכל לראות את הרשמים שלכם והערות בזמן הנסיעה כולם יצפו אפילו שעתיים  thanks ,🙏🏼
היי אלון תעשה וידאו ללא עריכה (כשעה)שנוכל לראות את הרשמים שלכם והערות בזמן הנסיעה כולם יצפו אפילו שעתיים  thanks ,🇺🇸
279000 כולל הכול לא יודע מאיפה הבאתה תמחיר הזה ,🤷‍♂️
הלו לא ללכלך על דימונה,😂
אלון עריכה הגשה וסקירה מעולה תענוג לצפות ,👍
שווה להזמין אייפון מאמזון? אגב סרטון מעולה,👍
איזה כיף שקניתי אותו אני בחול,😍
בשניה שראיתי את הטריילר ידעתי שישר תעלה סרטון ,👀
יש לי 12 פרו מרגיש ממש ישן כרגע ,😂
יש לי 12 פרו מרגיש ממש ישן כרגע ,🙃
אחלה סרטון ,❤️
אז אין בסוף תקשורת לווינית!?,😩
גדול ,❤
תותח על אתה תענוג לצפות בך דיוק והשקעה בפרטים הקטנים אם זה החדר הסידור של המוצרים הכל אפילו הומור אתה מכניס תענוג לצפות בך אח יקר שרק תצליח ותצמח ,🙏
אחלה סרטון אני אוהב את הסרטונים שלך אני אשמח מאוד כשיצא האייפון 13 תוכל לעשות בין 13 לאייפון 12 השוואה כולל איכות ורמקול תודה רבה תמשיך עם הסרטונים האלה ,👍
או שפשוט תקנו אוזניות sony,🤣
חיכיתי לזה ,👍
תודה רבה סרטון מדהים לא כמו כל סקירה ,💯
אלון סקירה מעולה כהרגלך לדעתי הג&#39;ברה 75 ו 85 פשוט מעולות ובפער מהמתחרים בקטגוריית המחיר הזאת ,😊
אלון סקירה מעולה כהרגלך לדעתי הג&#39;ברה 75 ו 85 פשוט מעולות ובפער מהמתחרים בקטגוריית המחיר הזאת ,👍
נראה שהבאדס פרו לוקחות ,😃
אחלה של סרטון סרטון מפורט איכותי ועם מלא b-roll שמסבירים ממש טוב את מה שאתה אומר  (ממש אהבתי את שלושת ה thumbnails שעשית לסקירות של המוצרים של סמסונג Galaxy buds 2Fold 3Flip 3(,🔥
אני עם באדס פלוס רוצה לקנות באדס חדשות ,☹
היי אלון יש לי שאלה אם אני קונה טלפון בארצות הברית אז אני יכול להשתמש איתו גם בארץ? אם אני אתקשר בארץ לא תהיה לי בעיה? בבקשה תענה ליכי אני בארצות הברית עכשיו ואני עוד כמה ימים יכול לקנות,🙏
סרטון מטורף,😍
שמח שאתה רואה את פודי,😎
אלון סרטון מדהים!! מה אם הסקירה על המק מיני????? מחכה לו בטירוףףף כי אני מתלבט אם לקנות אותו מה אתה אומר? אתה מרוצה ממנו?,🔥
וואלה מגרד לי באצבעות לקנות אותו,😄
אתה יכול לעשות סרטון על המי בנד 6 כי הוא נורא שונה מהחמש ואני מת על הדעות שלך וזה יעזור לי להחליט עם לקנות אותו,🙏
אני שנזכר שיש לאלון משקפיים ,😳
מתי סרטון על הגלקסי באדס 2?,🙂
מתי סרטון על הגלקסי באדס 2?,😁
סירטון מעולה אני לא מתה על טלפונים מתקפלים באמת שאהבתי את הסירטון שלך ,👑
שנה טובה נשמות,💙
היי אלון יש לי שאלה אם אני קונה טלפון בארצות הברית אז אני יכול להשתמש איתו גם בארץ? אם אני אתקשר בארץ לא תהיה לי בעיה? בבקשה תענה ליכי אני בארצות הברית עכשיו ואני עוד כמה ימים יכול לקנות,🙏
שנדע לארגן את הכיס,🙈
אחלה סרטון משמעותי בעניי אני אוהב איך אתה מסביר העל הכל תוכל לעשות בעתיד סרטון אל Dji om5 בבקשהתודה אתה אלוף,💪
אני מתלבט האם לקנות ענן באפל בתשלום חודשי או פשוט להעביר הכל לאיחסון פיזי ?!?!?אשמח לתגובה יסודית בעניין …,🤔
מחכה לשעון בקוצר רוח,😍
את האמת קניתי שיצא אייפון 11 פרו ואיירפודס פרו ואני באמת מבסוט זה טלפון מטורף והאוזניות כל כך טובות רק שיתחיל לי קצת בעיות נחדש כמובן רק אפל ,🍏
שנה טובה!בבקשה תעשה סקירה לGalaxy Watch 4 ,🙏🏼
אתה ענק ! מחכה לאייפד פרו חדש ,😬
רק ה13 הרגיל והמיני קצת מפחיד? (כן כנראה שרק אותי),😶
רק ה13 הרגיל והמיני קצת מפחיד? (כן כנראה שרק אותי),😀
חופש למען פלסטין,🇵🇸
חופש למען פלסטין,✌️
סרטון מצויין ואיכותיממש כיף לצפות בתוכן שלךואתה מלמד אותי המון דברים חדשים המשך כך! יש לי שאלה שמאוד אשמח שתענה לי עליה איזה טלפון לפי דעתך יותר טוב ולמה ה-oneplus 9r 5g או ה-galaksy s20 fe 5g או ה-poco f3 5g מאוד אשמח עם תענה זה מאוד יעזור לי תודה מראש,💪
סרטון מצויין ואיכותיממש כיף לצפות בתוכן שלךואתה מלמד אותי המון דברים חדשים המשך כך! יש לי שאלה שמאוד אשמח שתענה לי עליה איזה טלפון לפי דעתך יותר טוב ולמה ה-oneplus 9r 5g או ה-galaksy s20 fe 5g או ה-poco f3 5g מאוד אשמח עם תענה זה מאוד יעזור לי תודה מראש,😜
סרטון מצויין ואיכותיממש כיף לצפות בתוכן שלךואתה מלמד אותי המון דברים חדשים המשך כך! יש לי שאלה שמאוד אשמח שתענה לי עליה איזה טלפון לפי דעתך יותר טוב ולמה ה-oneplus 9r 5g או ה-galaksy s20 fe 5g או ה-poco f3 5g מאוד אשמח עם תענה זה מאוד יעזור לי תודה מראש,☺
רק לי נראה שהיד של הבחור של אינטל לא קשורה אליו ,🤭
מעבדים ממש מעניינים! בהחלט נראה כמו צעד החלמה אחרי ההתנתקות של אפל מאינטל אבל מי כמוהם יודע לעשות את זה נכון במעבדים! סרטון פצצה אלון מעולה רמה ממש גבוהה,👌
תוכן איכותי ומעניין לקחת את הערוץ שלך לרמה אחרת ,🔥
Mkbhd הישראליאין מחמאה גדולה יותר ,👏
אני מת על הסקירות שלך אין אתה רואה את זה תעשה לי לב  בבקשה,💓
אלון יא מלך כולנו אוהבים אותך תמשיך כך,👑
אלון יא מלך כולנו אוהבים אותך תמשיך כך,♥️
תעשה בבקשה סקירה על הביטס סטודיו באדס החדש ,🙏
