סירטון טילללללללללללללללל,😁
עוד מעט ההשקה של אפל ,🤩
״יאייי אימוגיז ״,🙌🏻
כיף לדעת שאתה בעלת סרטון שלושה ימים רצוףאתה תעשה סקירה על:poco x3?,😁
אני מתחננת שתענה לי הורדתי את העידכון (ה 14 של אפל) והוא גרוע פליז איך מבטלים אותוסליחה שאני כותבת את זה מלא פשוט אני צריכה שתענה לי,🥺
אני מתחננת שתענה לי הורדתי את העידכון (ה 14 של אפל) והוא גרוע פליז איך מבטלים אותוסליחה שאני כותבת את זה מלא פשוט אני צריכה שתענה לי,❤️
הטלפון הבא שלי,😀
מחכה לסקירה על הpoco x3באמת מעניין אותי אם כל המערך צילום שלו שימושי או כמו שאמרת שיווקינגעת בנקודה ממש טובה שלא הרבה שמים לבאני לא שמתי לב עד שאמרת,👍
אתה אלוףנרשמתי לערוץ והפעלתי את הפעמון,🏆
בבקשה תעשה סרטון על הgalaxy note 10 lite,🙏
סקירה טובה כמו תמידאלון אתה תעשה סקירה על:poco x3?,😉
שוב פעם התגלחת?,😂
אלוןןן אתה יכול לעשות סקירה על שיאומי רדמי 9??זה טלפון פסיכי ב 500 שקל !!!! נשבע לך זה טלפון טוב מאוד יחסית למחיר!!!,💖
אלוןןן אתה יכול לעשות סקירה על שיאומי רדמי 9??זה טלפון פסיכי ב 500 שקל !!!! נשבע לך זה טלפון טוב מאוד יחסית למחיר!!!,👍
אלוןןן אתה יכול לעשות סקירה על שיאומי רדמי 9??זה טלפון פסיכי ב 500 שקל !!!! נשבע לך זה טלפון טוב מאוד יחסית למחיר!!!,❤
תודה רבהאחלה סרטון ממש חיכיתי לו,💓
מה אם הפולד 2 חחח נראה לי אתה צריך עזרה בכסף לקנות אותו,👑
מה אם הפולד 2 חחח נראה לי אתה צריך עזרה בכסף לקנות אותו,😂
כמה עונג לצפות בסרטונים שלך,❤️
אלון אני אתה יוטיובר מדהים ומסביר מובן וטוב! אשמח עם תעשה לי לב,♥️
והמצלמה שלו פשוט מפחידה מרוב שהיא טובה ואלון אתה מלך,❤
אתה אומר על חלק גדול מהטלפונים &quot;מחבר אוזניות שזה נדיר בימנו&quot; מה שהופך את מחבר האוזניות ללא כל כך נדיר בימנו ,😂
אין על המכשירים של גוגל!!,😁
מעניין מה הטלפון הכי טוב מבחינת הכל,🤔
סקירה טובה אהבתי שהתייחסת ליתרונות שיש לעטוכן כל העניין הזה עם הגרסאות מבאס אגב תעשה סקירה על הz fold 2? בוא נגיד שהוא הרבה יותר מעניין,😎
סקירה טובה אהבתי שהתייחסת ליתרונות שיש לעטוכן כל העניין הזה עם הגרסאות מבאס אגב תעשה סקירה על הz fold 2? בוא נגיד שהוא הרבה יותר מעניין,😇
סקירה טובה אהבתי שהתייחסת ליתרונות שיש לעטוכן כל העניין הזה עם הגרסאות מבאס אגב תעשה סקירה על הz fold 2? בוא נגיד שהוא הרבה יותר מעניין,👍
האם אלון יצמיד את השאלה שלי? לאא או שכן?תוכל לעשות פתיחת קופסה לpoco x3?,🤔
הקטע הזה שהמסך מלא למרות שאני בטלפון (כמו שהסברת בעבר) וכל החוויה של צפייה בסרטון ככה זה פשוט שונה ומדהיםאין עלייך ביגאפ!⁦⁩,❤️
ניראלי אתה הבן אדם הכי חכם בעולם! מאיפה כל הידע הזה!?!?,😂
pov:&quot; אלון מלכלך על דינאמיקה ,😏
אוזניות הכי טובות בעולם וסאונד מצויין ,🤍
אוזניות הכי טובות בעולם וסאונד מצויין ,🖤
אוזניות הכי טובות בעולם וסאונד מצויין ,💚
אחלה אוזניות ולא שמת אותם נכון הם אמורות להיות בתנוחה שוכבת בגלל זה כאבה לך האוזן,🤦🏻‍♀️
אני מתחננת שתענה לי הורדתי את העידכון (ה 14 של אפל) והוא גרוע פליז איך מבטלים אותוסליחה שאני כותבת את זה מלא פשוט אני צריכה שתענה לי,🥺
אני מתחננת שתענה לי הורדתי את העידכון (ה 14 של אפל) והוא גרוע פליז איך מבטלים אותוסליחה שאני כותבת את זה מלא פשוט אני צריכה שתענה לי,❤️
היי אשמח אם תוכל לענות לשאלה שלייש לי אייפון 11 וזה האייפון הראשון שלי עכשיו כשאני מצלמת במצלמה הקדמית תמונות סלפי אז זה יוצא הפוך זאת אומרת שנגיד אני בצד ימין אז זה יוצא בצד שמאל תוכל להגיד לי אם יש אפשרות לתקן את זה?,😊
אתה יכול לעשות סקירה על ה google pixel buds?ואתה יכול כל סקירה להשוות לחברות אחרות? זה ממש עוזרחולה על הערוץ שלך⁦⁩,♥️
אלון אתה בבקשה בבקשה יכולה לענות לי על התגובה הזו אני רוצה אייפד לציור וליראות סרטים אבל אני לא יודעת איזה איפד לקחת אתה יכול לעזור לי ,🥺
זה נראה כמו מכשיר שמיעה כשזה בתוך האוזן,😕
מאיפה המחשב שעל השולחן?אגב סרטון ממש טוב תמשיך ככה,😅
מאיפה המחשב שעל השולחן?אגב סרטון ממש טוב תמשיך ככה,🤔
ניהיה פה הרבה יותר קליל ומצחיק חייב להגיד ,❤
אלוף אין מילים אתה מסביר בצורה אכי נכונה שיש מה לקנות ,👑
אלוף אין מילים אתה מסביר בצורה אכי נכונה שיש מה לקנות ,❤️
אהבתי את הפתיחה,😂
איך פותחים סטודיו לצילום ?כי גם אני רוצה להיות צלםאשמח שתענה לי ,😁
מושלםאגב הקטעים המצחיקים שלך ממש מוסיפים,👌
אצלי אין סיב אופטי ,☹️
מתי לדעתך יגיע הwatch 3 esim לארץ? ,🙏
תודה על סקירה מעולה  נראה מוצר ממש פרקטי וורסטילי ליוצרי תוכן ,👌
תודה על סקירה מעולה  נראה מוצר ממש פרקטי וורסטילי ליוצרי תוכן ,🙏🏽
יפה מאוד אתה אלוף ! המון תודה רבה חפשתי את הסקירה הזאת הולך לקנות את המוצר,💪
וואו נשמע ונראה מדהים אתמול קבלתי במתנה את הגימבל הזה תודה על ההסבר המקצועי,👍
מושלם הזמנתי,❤
אני לא חושב שזה נוח אני לא מבין למה אני צריך שישאר לי מדבקה בגב הפלאפון???,🤦🏻‍♂️
היי אלון ינסיך איזה סוג הכובע שלך ימלך אהבתי אותו,❤
תגיע כבר ל-100000!סרטון טוב ומעניין כרגיל,😉
סוף סוף יוטיובר טכנולוגיה איכותי סאב קבוע רואה כל סרטון ונותן ב,👍
אני עוקב חדשראיתי כמה סקירות בכללי ואתה היחיד שמדבר תכל&#39;סאמיתי ישר וסיקור עמוק כל הכבוד אני עוקב ,😊
תודה ,❤️
תודה ,🙏🏾
אלוף אתה ,😍
אפשר ראש בראש של הנוט 10+ והנוט 20 אולטרה?,🙏
רק אני לא אוהבת את העיצוב? המצלמה גדולה מידי לא יפה לעין אבל עדיין מכשיר נחמד כמו שאמרת לא ההיתי קונהחוץ מזה סרטון יפה בכללי הערוץ מושלם אלון אתה אלוף ברמות,💕
יש מצב שאתה עושה סרטון שאלות תשובות אני ממש אוהב את הסרטונים של השאלות תושבות,😂
מתי אתה עושה סיקירה על איפון החדש ואני מאוד אוהב את התוכן שלכה,❤️
תתחדש על הגילוח ,👍🏻
תודה אלון רכשתי ואודות לך יש לי קצת יותר מושג ,❤️
אתה ממש מסביר יפה ומדויק! וטוב במה שאתה עושה תודה לך על זה,🙏🏻
אתה ממש מסביר יפה ומדויק! וטוב במה שאתה עושה תודה לך על זה,❤️
אני מתחננת שתענה לי הורדתי את העידכון (ה 14 של אפל) והוא גרוע פליז איך מבטלים אותוסליחה שאני כותבת את זה מלא פשוט אני צריכה שתענה לי,🥺
אני מתחננת שתענה לי הורדתי את העידכון (ה 14 של אפל) והוא גרוע פליז איך מבטלים אותוסליחה שאני כותבת את זה מלא פשוט אני צריכה שתענה לי,❤️
טוב לראות אותך עם אייפון וממש יפה לך עם זקן צמוד,😎
טוב לראות אותך עם אייפון וממש יפה לך עם זקן צמוד,☺️
הצחקת אותי אחלה סרטונים,😂
סרטון טוב ,👑
סרטון טוב ,👍
סרטון טוב ,❤
וואו זה ערכת את הסרטון הזה שונה רצח מאיל שאתה עורך בדרך כלל מגניב,😉
יש לי ערוץ ואני השמח אם תתמכו ותפיצו בבקשה ,😊
אחלה סקירה,🍺
אחלה סקירה,🥇
מספיק לי ה156 אינץ של הנייד שלי,🤣
מספיק לי ה156 אינץ של הנייד שלי,😂
אלון ימלך תעשה סקירה על וואן פלוס נורד ווואן פלוס באדס בבקשה יגבר מת עליך,❤
ימלך!תמשיך לעשות את הסרטונים המעיינים והמצחיקים שלך אני נהנה לראות אותם כל פעם מחדשתמשיך ככה ימלךךךךךךך!,🧠
אני מאוהב בך אלון אני לומד ממך כל כך הרבה אתה פשוט השארה מקווה שתיתן לב לתגובה,❤
פשוט אליפות! סקירה מדהימה ,💚
הסרטוןגרעינית!לכו לשמוע את הפוטקאסט!!,💣
מטורף ,👌🏽
רוצים סרטון על הnord,🙏
רואים כמה אתה משקיע ונותן מעצמך עובדה מעולה ,👍
״עם מיליארד צבעים״חשבתי שאתה צוחק ,😂
אהבתי שתוך כדי אתה רואה מניות של טסלה,😉
אלון תדע שאתה ממש עוזר לכולם כל הכבוד על ההשקעה אין עליך,😁
יש לך את הערוץ הכי טוב בארץ מת עליך,😘
וואו מדהיםם שאפו אלון! מתי יהיה שאלות ותשובות?,😍
וואו מדהיםם שאפו אלון! מתי יהיה שאלות ותשובות?,🙃
כולל קידום מכירות בתשלום,😍
כולל קידום מכירות בתשלום,❤
איזה כיף קיבלת ספונסר!! ,😃
הגיע הזמן לסירטונים ממומנים אני שמח לראות שלאחרונה אתה מרשה לעצמך יותר להכנס לעולם הזה כי רק ככה תוכל להגדיל את הערוץ ולעשות מהפכה בעולם צריכת התוכן ובסקירות המוצרים בארץ אוהב מאוד שהדעה שלך היא עדיין אובייקטיבית ומציגה גם את החסרונות של המכשיר תגדל ותצליח אמן ,❤️
טיפה לסדר את השולחן לפני הסרטון לא יזיק,😂
שמע אח מישהו חחחב לעשות הגהה לכתוביות כי סקייט שעושה 40 קילומטר לשנייה מראה לי קצת הזייה ,😉
לייק כל מי שאוהב את היוטיובר הזה יש לי ערוץ שאני משקיע בו ברמות ואני ממש רוצה שהוא יגדלואני ממש אשמח שתעזרו לי ותרשמו תלחצו על כפתור הסאב אני מחזיר סאב,🦈
לייק כל מי שאוהב את היוטיובר הזה יש לי ערוץ שאני משקיע בו ברמות ואני ממש רוצה שהוא יגדלואני ממש אשמח שתעזרו לי ותרשמו תלחצו על כפתור הסאב אני מחזיר סאב,🐶
לייק כל מי שאוהב את היוטיובר הזה יש לי ערוץ שאני משקיע בו ברמות ואני ממש רוצה שהוא יגדלואני ממש אשמח שתעזרו לי ותרשמו תלחצו על כפתור הסאב אני מחזיר סאב,🐼
לייק כל מי שאוהב את היוטיובר הזה יש לי ערוץ שאני משקיע בו ברמות ואני ממש רוצה שהוא יגדלואני ממש אשמח שתעזרו לי ותרשמו תלחצו על כפתור הסאב אני מחזיר סאב,👍
זה מחיר הרבה יותר מדי גבוה לשוק הסקייטבורד החשמלי בעולם,😤
סירטון מדהים  אבל הכלי הזה מאוד מסוכן !!! טעות קטנה ואתה נכה ,😢
סירטון מדהים  אבל הכלי הזה מאוד מסוכן !!! טעות קטנה ואתה נכה ,😍
אני יודע שאף אחד לא יראה אבל אני בכל זאת כותב את זה לפני שבוע וחצי קניתי טלפון חדש את הרילמי x3 ועכשיו יש לי עדכון תוכנה מה אני אמור בבקשה תראה ותענה לי,🙏
שלום אלון מעניין אותי אם איזה רחפן צילמתה את הסירטון אחלה סירטון איןן עליך מסביר ברור שווה לתת לך לעשות סקירות,👍🏻
היי חברים! אני אלון ופתחתי ערוץ חדש החלום שלי הוא להגיע ל1000 סאבים ואני רחוק אבל אני צריך את עזרתכם תכנסו לערוץ ובבקשה אם תאוהבו או תרצו לעזור לי להגיעה למטרה שלי תתנוסאב אני משקיעה בלייבים כול יום מקווה שתקחו לתשומת לבכם תודה!,❤
אלון סירטון מעולה הרעיון לעשות את הסרטון מדהים ושוב תודה רבה שאתה דואג לתוכן איכותי ומרענן  אתה אחלה גבר !,🔥
אלון תעשה בבקשה סרטון על מצלמות באיכות ששווה לקנותתודה,🙏🏼
הייי אלוןאני בת 10 ואני ממש רוצה אייפון אתה יכול להגיד לי איזה טלפון אני יכולה לקנות? שמתאים לי?,❤
אלון אני מאוד אוהב את הסרטונים שלך מעניין מאוד אולי תעשה הגרלה אל איזה טלפון ,🙏
היי אלון אני מעריץ שלך שנים אתה אלוףיש מצב ליקנות אותו מימך?,🥵
היי אלון אני מעריץ שלך שנים אתה אלוףיש מצב ליקנות אותו מימך?,♥️
תעשה סירטון על הnote 10 lit מי שרוצה שיתן לייק,👍
תוכל בבקשה לעשות סרטון שיסביר איך למחוק את כרטיס האשראי מהאייפון אחרי ביצוע של רכישת אפליקציה בבקשה נב סרטון ממש טוב,👏🏻
תוכל בבקשה לעשות סרטון שיסביר איך למחוק את כרטיס האשראי מהאייפון אחרי ביצוע של רכישת אפליקציה בבקשה נב סרטון ממש טוב,👍
תודה על הסרטון כרגיל איכותי  היה קצת מצחיק לראות את הטלפון של סוני קם לתחייה שובהיה לי אחד מהדגמים הראשונים של אקספיריה והוא היה טוב עד שבטעות ממכה ממש קלה נהרס משנו בפנים בגלל שהמכשיר היה בין הראשונים שהיו עם הדבקה של זכוכית משני הצדדים והדרך שסוני בונים את המכשיר שני טכנאים באזורים שונים לגמרי בארץ ממעבדות טובות הסתבכו לגמרי עם איך בכלל לתקן אותו שילמתי בסביבות האלף שקל אולי טיפה יותר על שני התיקונים ביחד והטלפון המשיך לעשות בעיות עם מסך המגע הרמקולים והמצלמה שלבד לא עבדו כמעט בכלל בסופו של דבר הייתי עם טלפון חדש שפשוט היה שבור ואחרי זמן קצר שניסיתי להסתדר עם זה בטעות ישבתי עליו (חמישים קילו) וכל המסך התנפץ :|,👌
מזל טוב על 80k ותתחדש על הרקע הלבן שאמרת שרצית לקנות הרבה זמן! מגיע לך את ה80k ויותר אני מנוי שלך עוד מה20k /15k הראשונים,😜
איזה אלוף אחלה סירטון,❤
כמה כיייף אתה היחידי בארץ!!! תמשיך להפתיעעע מחכה לפיקסל 4 xl וכן הלאה ,😛
מכשיר מעולהההה אחלה של סמארטפון וגם אתה אלון תותח כיף לראות את הסקירות שלך אלוף,😜
צפיתי בכול הסרטון מלך נב מזל טוב 803k,😁
תענוג של ידע ופרזנטציה ,🏆
תענוג של ידע ופרזנטציה ,👌
תענוג של ידע ופרזנטציה ,👍
קל אוף דיוטי בלי לאגים ? וכמה זה עולה ומתי היה את זה בישראל וחוץ מיזה מצוין ,👍
אלון איך אני משיג אותך בפרטי לגבי המכשיר הזה? דחווווווף ,🤒
חבל שלא השיקו אותו פה בישראל ,😔
היי אלון אני צופה בך המון ואני אוהב את התכנים שלך אבל הפרסומות של הדר אשוח נמצאות בכל סרטון שלך אולי תוכל לעשות משהו בנידון ולשנות את התוכן של הפרסומות זה ממש מציק כבר תודה דורון,❤️
מה אתה ממליץ טאבלט סמסונג s6 lite או s5e??,👍
וואי זה חלום אבל אין לי איך ליקנות ואני לא צריך,😭
אלון הפעם זה הכי טוב שלך ,📣
אלון הפעם זה הכי טוב שלך ,📷
אני לא מבין למה אסוס ישראל שולחת לך מכשיר לסיקור שהיא בכלל לא תיהיה מושקת בארץ לך תבין ,🤷🏻‍♂️
איזה אלוף אחלה סירטון,❤
אשכרה הסקירה שלך היא באותו הזמן כמו Mrwhosethebossזה מטורף,😱
יכול להיות שלא הייתי קונה אותו ספציפית אבל הייתי קונה את הרד מג&#39;יק 5G אם היה בארץ,👍
כחול שאני מתקדם בסרטון כך הוא נהיה מסובך יותר,🤐
כחול שאני מתקדם בסרטון כך הוא נהיה מסובך יותר,😑
כחול שאני מתקדם בסרטון כך הוא נהיה מסובך יותר,😵
כחול שאני מתקדם בסרטון כך הוא נהיה מסובך יותר,😰
כחול שאני מתקדם בסרטון כך הוא נהיה מסובך יותר,🤔
סרטון מטורף! הגעת ל80K מנויים,🥳
80k רשומים ,🏆
80k רשומים ,🎈
מלך גרעיני,🌋
כן אבל לענן בטלגרם למשל יש מומחי אבטחת מידע שיושבים על המערכת והכל מאובטח השאלה איזה רמת אבטחה יש לזיכרון שיושב אצלי?,🤔
תודה ,❤
בקושי לפתוח וורד אני יודע אבל אני רואה בשקיקה את החומרים שלךתודה רבה! ,🏅
אלון אני מאחל לך להגיע ל 100k רשומים ואפילו יותר ואני אפילו יודע שזה יקרה אלון יא פצצה גרעינית אחלה של סרטון (פרגן באיזה לב),♥️
סוף סוף הבנתי איך זה עובדסרטון טוב כמו תמיד,❤️
סוף סוף הבנתי איך זה עובדסרטון טוב כמו תמיד,👌
אני לא מפסיק לראות את זה גאון (גרעיני כמובן),⭐
אני לא מפסיק לראות את זה גאון (גרעיני כמובן),😂
אני לא מפסיק לראות את זה גאון (גרעיני כמובן),😉
אלון תשמע מצלמות לא מענינות אותי ואני בעל זאת רואה כי אתה מעביר את זה כאילו כולם מכירים ויודעים מה אתה אומר!אתה תותח!,👑
אלון תשמע מצלמות לא מענינות אותי ואני בעל זאת רואה כי אתה מעביר את זה כאילו כולם מכירים ויודעים מה אתה אומר!אתה תותח!,💪
וואו תודה רבה לך אלוןהבנתי עכשיו המון דברים באנגלית וידע כללי מטורף שבטוח יעזור לי על מצלמות ואיך להפעיל אותם כמו שצריך ולא להתבלבלמקווה שתמשיך עם סרטונים כאלה בגלל שאני הולך לפני כל קניית מצלמה לצפות בסרטונים שלך מעריך שלך ⁦⁩,🔥
וואו תודה רבה לך אלוןהבנתי עכשיו המון דברים באנגלית וידע כללי מטורף שבטוח יעזור לי על מצלמות ואיך להפעיל אותם כמו שצריך ולא להתבלבלמקווה שתמשיך עם סרטונים כאלה בגלל שאני הולך לפני כל קניית מצלמה לצפות בסרטונים שלך מעריך שלך ⁦⁩,♥️
אלון הרבה זמן חיכיתי לסרטון על מצלמות!אפשר בבקשה לעשות סרטון על מצלמת - Canon 2000D אני ממש אשמח ומקווה שגם כולם!⁦⁩,❤️
פתאום הסירטון רץ לי על 1080p בלי בעיהלא יודע אם זה קשור אבל אחלה,👌
פתאום הסירטון רץ לי על 1080p בלי בעיהלא יודע אם זה קשור אבל אחלה,👏
נחמד מאוד לראות שאתה גם עושה סרטונים לא רק על סמרטפונים וטלוויזיות אלא גם על מכשירים שכמו כולם או יוצרי תוכן צריכים ויכולים להתבסס על הביקורת/ההמלצה שלךשאות אנו כה מעריכים,😊
ממש אהבתי את הסרטון אלון,👌
אחלה סירטון הרגתה אותי שעשיתה חיקוי של וולוגר ,😂
אלון אני מאוד ישמח שתענה לי פעם ראשונה שאני מתעסק עם אפל אז אני לא יודע קיצר קניתי את האייפד הגירסה היקרה והמצלמה שלו מששש אבל ממש גרועה הכול מטושטש הזום על הפנים ניראה כאילו זה מצלמה של טלפון ב200 שקל יש אולי דרך לסדר את זה בהגדרות מממש אשמח לתשובה אגב אחלה ערוץ תוכן ממש איכותי וטוב,🥰
אני כבר חצי שנה עם האיפד פרו 129 ולא ידעתי חצי מהדברים שהופיעו בסרטוןתודההוממש אשמח אם תסביר באחד הסרטונים שלך על עבודה במחשב/מקבוק דרך האיפד,❤️
אני כבר חצי שנה עם האיפד פרו 129 ולא ידעתי חצי מהדברים שהופיעו בסרטוןתודההוממש אשמח אם תסביר באחד הסרטונים שלך על עבודה במחשב/מקבוק דרך האיפד,😍
בזכותך קנו לי לבר מצווה,😋
מעולה תודה! אתה ממליץ לכבות את האייפד כל לילה?,😓
מעולה תודה! אתה ממליץ לכבות את האייפד כל לילה?,🤔
אני מעצבת גרפית ולאחרונה האייפד פרו שלי נסדק על ידי אחד הילדים:( ראיתי את הסקירה ומאוד מתלבטת האם לרכוש את החדש המחיר בהחלט משחק תפקיד חשוב אני משתמשת הרבה באפליקציות לאיור ויוצרת קבצים וקטורים רבים דרך האייפד אשמח להעזר בהמלצתך האם לנסות לתקן את החדש שלא ניתן כרגע לאייר בו או לקנות חדש מאוד מאוכזבת מהשירות הנוראי של איי דיגיטל כך שאם יש לך המלצות על מקום לרכישה אשמח מאוד לשמוע,🤔
ישש תודהה היי אני לא יודעת אם אתה יודע אבל אפשר לקנות מקלדת ועכבר נפרדים בשביל האייפד וזה הרבה יותר נוח ממה שראיתי יש גם מגנים שהם בלי מקלדת וככה אפשר להשתמש בו מבלי להוציא ראיתי שזה הפריע לך פשוט המקלדת המתחברת נועדה איך ורק לזה ,🤗
תודה רבה ממש עזרתה לי כי אבא שלי רצה לקנות לי מחשב אבל בוא היה שמח שזה היה גם טאבלט וממש עזרתה לי בסירטון הזה תןדה!,❤️
אני ממש אשמח אם תיכנסו לערוץ שלי kid technology הוא מתעסק בטכנולוגיה אני ערוץ מאוד מתחיל ואני אשמח אם תעזרו לי לפתוח אותו לקהלים חדשים,🙏
וואו אלון עוד מעט 80 אלף רשומיים !! או מיי גאגא,🤣
וואו אלון עוד מעט 80 אלף רשומיים !! או מיי גאגא,😉
וואו אלון עוד מעט 80 אלף רשומיים !! או מיי גאגא,❤
