תקשיב המצלמות האחוריות מתי שיש תאורה טובה וואו! זה אשכרה מצלמה אמיתית איכות גבוהה פיצוציםובלי קשר עריכה ממש טובה! אהבתי נב עכשיו תעשה גם כזה מהגלקסי נוט 10 פלוס ,😜
תקשיב המצלמות האחוריות מתי שיש תאורה טובה וואו! זה אשכרה מצלמה אמיתית איכות גבוהה פיצוציםובלי קשר עריכה ממש טובה! אהבתי נב עכשיו תעשה גם כזה מהגלקסי נוט 10 פלוס ,🔥
תקשיב המצלמות האחוריות מתי שיש תאורה טובה וואו! זה אשכרה מצלמה אמיתית איכות גבוהה פיצוציםובלי קשר עריכה ממש טובה! אהבתי נב עכשיו תעשה גם כזה מהגלקסי נוט 10 פלוס ,👍
איך צומח לך זקן כזה מהר,😂
הפעמון לא עבד בכל מיקרה סרטון מעולה מה הסיכוי שתשים לב לתגובה שלי ,😎
הפעמון לא עבד בכל מיקרה סרטון מעולה מה הסיכוי שתשים לב לתגובה שלי ,😕
הפעמון לא עבד בכל מיקרה סרטון מעולה מה הסיכוי שתשים לב לתגובה שלי ,😥
ואו איטליה  מה עם סרטון על תוכנות עריכת וידאו וטיפים לעריכה? יצירת כתוביותרזולוציותמס פריימים לשניהכל מיני טריקים במעבר בין פריימים כמו הילוכים מהיריםוכו וכו ועוד ועודנשמח :),❤️
ואוו אני זוכר את עצמי ליפני כמה חודשים ניכנס ליויטיוב ומתלבט אם להשאיר סאב להירשם לערוץ שלך וראיתי שאתה נחמד אז פירגנתי היה לך בקושי רשומים כרגע אתה עומד על 50 אלף ואוו הלואי שתגיע למיליון רשומיםאהבתי תקטע שאתה משלב טיולים עם הערוץ שלך שהוא בעצם מדבר על הדור החדש תכנולוגיהתמשיך ככה כיף זה פשוט מושלם להעביר תזמן או סתם סתם לבלות בערוץ שלך,❤️
אתה מאוהב באייפון הזה יש לי אייפון 10s גם אני מאוד מרוצה ממנו ,😎
אתה מאוהב באייפון הזה יש לי אייפון 10s גם אני מאוד מרוצה ממנו ,😂
צופה בסרטון מה11 פרו מקס 256,😉
איזה סרטון אש תחזור לעשות כאלה ,❤
אני מ2021 אלון יש לך 109k יש קורונה עדיין יש iPhone 13 אם חיבורים אייפד מיני אם חיבור type c ,😱
תגיד איפה קונים את הדבר הזה החום שאפשר להדביק לטלפון ואפשר לשים בו כרטיס בבקשה תענה לי אני חייב את זה,🙏
מדהים אלון אשמח לדעת האם לדעתך כדאי לי לקנות אירפודס פרו (כרגע אני עם גברה עלית 65t)אני רץ עם שעון גרמין אז ככה שהן פחות יתחברו לאייפון ,🙏🏼
מדהים אלון אשמח לדעת האם לדעתך כדאי לי לקנות אירפודס פרו (כרגע אני עם גברה עלית 65t)אני רץ עם שעון גרמין אז ככה שהן פחות יתחברו לאייפון ,🔝
הי אלון ה-pro יותר קטן מהקודם האם האורך משפיע בזמן שיחה שבה מי שמדבר איתי ישמע אותי פחות טוב? כי עד עכשיו היה לי אוזניות כפתור שתקועות באוזן ולא הצליחו לשמוע אותי בשיחות אשמח לתשובה תודה,🙏
החסרון הכי גדול שלא נאמר כאן זה שאי אפשר לשלוט על הווליום מהאיירפודס,‼️
לייק כל מי שאוהב את היוטיובר הזה יש לי ערוץ שאני משקיע בו ברמות ואני ממש רוצה שהוא יגדלואני ממש אשמח שתעזרו לי ותרשמו תלחצו על כפתור הסאב אני מחזיר סאב,🦈
לייק כל מי שאוהב את היוטיובר הזה יש לי ערוץ שאני משקיע בו ברמות ואני ממש רוצה שהוא יגדלואני ממש אשמח שתעזרו לי ותרשמו תלחצו על כפתור הסאב אני מחזיר סאב,🐶
לייק כל מי שאוהב את היוטיובר הזה יש לי ערוץ שאני משקיע בו ברמות ואני ממש רוצה שהוא יגדלואני ממש אשמח שתעזרו לי ותרשמו תלחצו על כפתור הסאב אני מחזיר סאב,🐼
לייק כל מי שאוהב את היוטיובר הזה יש לי ערוץ שאני משקיע בו ברמות ואני ממש רוצה שהוא יגדלואני ממש אשמח שתעזרו לי ותרשמו תלחצו על כפתור הסאב אני מחזיר סאב,👍
הי אלון! יש לי את הairpods pro כבר חצי שנה ושמתי לב שכל פעם שאני מחייך אז הם זזות וכמאת נופלות לי מהאוזן בכל הגדלים אשמח אם תבדוק את זה,😅
יופיי עזרתה לי לדעת על האוזניות תודה,🤘
אתה סתם אומר,😒
אני יודעת שהסרטון קצת מזמן אבל אני חייבת להגיד לך תודה ענקית !!! הייתה לי בערך חצי שנה שהתלבטתי בין אייפון למשהו אחר ובאמת הכי אמיתי בעולם שברתי את הראש על זה ואז ראיתי סרטונים שלך אוליי 100 פעמים ועזרת לי להחליט ובסוף קניתי את האייפון 11 האדום כמובן חחח ( ואגב הוא מהמם ) ובאמת יש בו את כל מה שפירטת לגבי איכות מסך והכל באמת באמת הייתי חייבת לרשום תודה ענקית !!! ערוץ מהמם ואלון פשוט אלוףףף !!!! תודהההה ,❤️
סרטון מהמם,❤
יש לי אייפון 11 ואני חייבת לומר שהוא טלפון מדהים שווה כל אגורה של המחיר שלו ובהחלט הטלפון המשתלם של השנה,😃
יש לי אייפון 11 ואני חייבת לומר שהוא טלפון מדהים שווה כל אגורה של המחיר שלו ובהחלט הטלפון המשתלם של השנה,👍
היי תגיד מה עדיף איפון x או איפון 8+ או איפון 11 ??? זה דחוףףף,❤
אני רואה לפעמים גם סרטונים של אנשים מחול שעוסקים בתכנולוגיה וברצינותשאני חושב שאתה הרבה יותר מפורט מהם וזה לא רק הידע על הניר !זה גם הדרך שבה אתה מעביר את הסרטון!מקווה שתצליח בערוץ עד הסוף ,👍
יש לי רעיון!למה שלא פשוט תעשה סרטונים באנגלית עם תרגום לעברית ואז תהיה בשוק הגדול באמת מבלי להפסיד את הקהל של הארץ פשוט בהרבה יותר גדול ואני באמת צושב שאתה יכול להצליח,✊
אלון יא גבר אחי מעריך אותך הסירטונים שלך מגניבים אתה לא צריך עבודה בישביל ערוץ יוטיובתמשיך ככה,💋
אני צופה בך עוד מגלקסי 8 ואגב קניתי אותו בזכות הסרטון הזה,🤣
מלך,♣️
מלך,🎆
הפיקסל 4 כבר הגיע לחנות גו מובייל הלוואי ותביא אותו לסקירה,🙏🏻
נשמע מאוד מאכזב ניראה כמו טלפון מ2017 וחבל ועוד מסתבלטים על אפל ,🤷🏼‍♂️
חיקוי זול של אייפון ,⚫
חיקוי זול של אייפון ,🍪
אין על הסרטונים שלך,👑
איפוא הזקןןןןןןןן!!!!!!!!!!!,😢
איפוא הזקןןןןןןןן!!!!!!!!!!!,😥
Google משעממים עד מוות,😴
עם זקן יותר חתיך,😀
לייק מי ששם לב לרדאר ב4:55 ,😂
זה נראה כמו ההדלפות של אייפון 11,😂
אחלה סרטון ימלך מחכה כבר שתביא אותו לסקירה ואני חושב שעצם זה שהם הוסיפו עוד מצלמת זום זה כבר יקפיץ את הצילום ברמה יותר גבוהה ולפחות המחירים שלהם לא כמו אפל,❤️
אחלה סרטון ימלך מחכה כבר שתביא אותו לסקירה ואני חושב שעצם זה שהם הוסיפו עוד מצלמת זום זה כבר יקפיץ את הצילום ברמה יותר גבוהה ולפחות המחירים שלהם לא כמו אפל,🔥
לא ציינת שעכשיו לא מקבלים הרחבת מקום אחסון בגוגל תמונות ולרדר קוראים project solyואחד השימושים של הקשר זה לנופף לפוקימון בשומר מסך⁦⁩,😂
לא ציינת שעכשיו לא מקבלים הרחבת מקום אחסון בגוגל תמונות ולרדר קוראים project solyואחד השימושים של הקשר זה לנופף לפוקימון בשומר מסך⁦⁩,👌🏻
איכסססס אייפון אני עדיין לא מבינה למה כולם אוהבים את זה,🤮
אלון: אני בהחלט מתרגש מ־2020אני: ,🤦
היי אלון אני מזה אוהב את הסרטונים שלךיש מצב שאתה תעשה סרטון על הnote 10lite??זה ממש יעזור לי ,😍
היי אלון אני מזה אוהב את הסרטונים שלךיש מצב שאתה תעשה סרטון על הnote 10lite??זה ממש יעזור לי ,😁
גאון פשוט ככה הפתיח פשוט עילוי ,⭐
גאון יהודי !! יירבו כמוך ! ,👍
היי שלום לך אלון!!!יש מצב לסקירה המלאהשיאומי רדמי נוט 8 פרו בבקשה,😉
היי שלום לך אלון!!!יש מצב לסקירה המלאהשיאומי רדמי נוט 8 פרו בבקשה,🙏
היי יש בבעלותי אייפון 7האם שווה שדרוג או לחכות לדגם הבא? תודה ,🙏🏻
היי יש בבעלותי אייפון 7האם שווה שדרוג או לחכות לדגם הבא? תודה ,👌🏻
היוטיובר הכי טוב בישראל ,❤
אוהב את הערוץ שלך ,👍🏻
האם אפשר לחבר אפל וואץ&#39; לאנדרואיד,😕
האם אפשר לחבר אפל וואץ&#39; לאנדרואיד,😍
היי אלון אני ממש אשמח אם תתייחסאני ממש רוצה לעבור מגלקסי לאייפון אמרו לי שעדיף לקנות עכשיו את ה11 אבל אני לא מתחברת לעיצוב שלו בכלל וממש לא בא לי אותוזה יהיה חכם לקנות את הxs max למרות שיצא ה11? וזה נכון שכל פעם שיוצא אייפון חדש אפל מחלישים את האייפונים הישנים יותר?,❤
מתי עוד סרטון שאלות תשובות,❔
מי שצופה ב 2021 ,👇
יש לי אייפון 11 תראו את האימוגים ,🥰
יש לי אייפון 11 תראו את האימוגים ,😃
יש לי אייפון 11 תראו את האימוגים ,🤣
יש לי אייפון 11 תראו את האימוגים ,😊
יש לי אייפון 11 תראו את האימוגים ,🙂
אבל אחרי הכל סרטון אחלה ממש,🥰
500 מנויים חדשים ביום,😵
תודה אתה באמת עוזר ,👌🏼
תודה אתה באמת עוזר ,👍🏼
כמה פעמים אפשר להגיד &quot;פרו&quot; בסרטון תמשיך ככה כל יום עוד 1000 סאבים,😂
מהמם,❤
האייפון 11 עמיד במים?? בבקשה תענה!!⁦⁩,🙏🏻
אני הייתי לוקח את האייפון 11 פרו כי יש לו שלוש מצלמות ומסך טוב בהרבה מאייפון 11 הרגיל והוא גם מגיע אם מטען מהיר אז מה שהכי מטעים לי זה האייפון 11 פרו אבל לא הפרו מקס כי הוא ענק ,😅
היי רציתי לדעת עם הטלפון מחוץ לארץ או בישראל בבקשה תענה זה דחוף,💗
בשביל זה יש מחשב לא ??,😝
סרטון מעולה! את האמת שאני חוסכת כבר לאייפון 12,🤗
מלך ,👑
אין עליך,❤️
ירדת בתדירות ואין שום דבר מעניין חדש יותר איפה אתה,😏
וואו אתה צעיר פה חחחח,🤣
היי:) אשמח להמלצה למקום באילת שמוכר אייפון 11 פרו 256GB יבואן רשמי (ואם זה משנה אם זה יבואן רשמי בכלל)ותודה על הסקירות יא אלוף עוזר תמיד!! ,🙏🏼
תגיד איפה קונים את הדבר החום הזה שאפשר לשים בו את הכרטיס בבקשה תענה לי אני חייב ,🙏
לא צריך לרדת עוד למטה!!! כמובן שאתם מוזמנים להיכנס לערוץ היוטיוב שלי ולהנות מהתכנים הבלעדיים והמעניינים שלי ואם אהבתם אל תשכחו להירשם לערוץ ולהפעיל את הפעמון,❤
אתה יכול בבקשה להסביר על צ&#39;יפ ה m1?זה שהוא מהיר יותר וחסכוני יותר אחלהאבל לא הבנתי מה זה אומר סיליקון? ואיך בדיוק הוא מאפשר לניידים להיות ללא מאווררים? זה נשמע קצת מד&quot;ב ,👀
אתה יכול בבקשה להסביר על צ&#39;יפ ה m1?זה שהוא מהיר יותר וחסכוני יותר אחלהאבל לא הבנתי מה זה אומר סיליקון? ואיך בדיוק הוא מאפשר לניידים להיות ללא מאווררים? זה נשמע קצת מד&quot;ב ,🤔
באתי לצפות שוב בשביל לעזור תמשיך עם העבודה הטובה,👏
לללתללללללל,🧡
לללתללללללל,💚
ריספקט על המחויבות!אם אני לא טועה אתה הערוץ בעברית ראשון שהעלה סיכום אירוע  #כבוד,👏
היי שאלה שווה להחליף מגלקסי 8 לאייפון שמונה פלוס?ואם תוכל אשמח להצעות עד 3500 שקל אפילו 4000 או אפילו האייפון 11 תודה יא גבר,❤
אם תוכל תעשה גם סקירות על ה-apple arcade apple TV+,🤞
אלוף,👌🏻
מחכה לראות את האייפונים אצלך! אלוף,👌🏻
סרטון מעולה !!!!!!!!!!! כל הכבוד אלון ,👍
סרטון מעולה אין עליך אתה פשוט אלוף אין עליך הערוץ שלך מתקרב ל 40000 סאבים אני כול כך שמח כי זה פשוט מגיעה לך יה אלוףףףף ,👍
אלוףף! כל הכבוד על כל ההשקעה והמאמץ שלך בסרטון ממש נהנתי מהסקירה שלך על ההשקה מתרשם מאוד מהאייפון החדש ומחכה לראות אותו בסקירה אצלך!!!! ,😉
אלוףף! כל הכבוד על כל ההשקעה והמאמץ שלך בסרטון ממש נהנתי מהסקירה שלך על ההשקה מתרשם מאוד מהאייפון החדש ומחכה לראות אותו בסקירה אצלך!!!! ,✌️
היי חברים! אני עוד בערך שבוע-שבועיים מהיום אקבל את טלפון הגיימינג החדש של אסוס - asus rog phone 2 זה הטלפון החזק בעולם כרגע והמשתלם בעולם לפי דעתי אם תרצו סקירה עליו תנו לייק לתגובה(אלון אני מצטער שאני משתמש בפרסום שלך בשביל זה אבל הבנתי שאתה לא עומד לקנות אותו כי הוא לא יגיע לארץ בכל מקרה אם מפריעה לך התגובה הזאת מוזמן למחוק),😁
היי אלון בבקשה אני רוצה לקנות טלפון עם עט אז עם אתה יכול לענות אל השאלה -אם אווי או איפון יוצאו טלפון עם עט ? (כן או לא) תודה ,❤
אחלה סרטון אוהב אותך אלון רק שאלה מה עדיף לקנות את הטלפון הזה או את המי 9 הרגיל,❤
אתה אלוף אתה הכי מושלם אין עליך אתה היוטיובר הכי טוב שישאוהב אותך אין עליךמה אתה אומר על אייפד os האם אתה חושב שעכשיו הוא כבר יכול להחליף מחשב,👍
נו באמת למה לא קיבלתי התראה חוץ סרטון מעולה כמו תמיד (;,😭
סרטון מצויין מת עלייך,👍🏻
או יה אני לייק 400 ;) אלון!! אחלה סרטוןןןן⁦⁩⁦⁩⁦⁩,❤️
סרטון מצוין ,😄
גאוןןןןן,🤯
אלון אתה פשוט ענק איזה כיף לראות סרטונים ברמה של mkbhd בארץ,😃
לייק מי שראה עד החלק של ספיידרמן ,🕸️
תודה רבה עזרת לי מאוד לפני הסרטון הזה אמא שלי לא האמינה לי שהקרינה לא מזיקה עכשיו היא מאמינה וקונה לי תודה רבה רבה,🙏
לייק מי ששומע עם האירפודס שלו,😂
אלון יש לי שאלה עוד איזה שבועיים קונים לי טלפון חדש אשמח לדעת על מה אתה ממליץ בסביבות ה3000-3500 שקל ואפשר גם פחות,😅
ערוץ מצויין,👍
מעולה כרגיל מדהים איך סרטון אחד בפייסבוק זה שמראה את האוזניות ליד מד קרינה יכול לעשות כזה &#39;נזק&#39; תודעתי כשאנשים לוקחים את מה שמוצג להם כמובן מאליו ולא מנסים אפילו להפעיל חשיבה ביקרותית ולבדוק בעצמם אם יש אמת בדברבכל מקרה כמו שאמרו פה מגיבים נוספים &quot;קרינה בלתי מייננת&quot; בהגדרה לא מסוכנתוהמכשיר שהצמידו שבודק שיש קרינה פשוט בודק בדיוק את זה הימצאות קרינה אלקטרו-מגנטית,🔥
אחד הסרטונים האלה שאני עושה לייק עוד לפני שאני צופה,😉
אני אוהב את הסרטונים שלך צופה בכל אחד מהם מת עליך!!!!חיכיתי לעוד שאלות(אני חושב שלא היו מספיק שאלות) אשמח שתיקח את זה לתשומת לבךאוהב אותך,😁
ערב טוב אלוף ,🏆
ולמה אין לך אף פעם מגן?,😂
סרטון ברמה גבוהה דרך אגב הכי חשוב בעוד שבעוד שבוע יוצא אייפון 11 ,🎉
לאבא שלי יש איירפודס אז מקווה שזה בסדר אבל מצד שני גם לך יש איירפודס אז ואתה משמש בהם הרבה אז זה בסדר ופרגן בלבבבבבב,😂
יש לי galaxy a50 טלפון מעולה אבל שאני צופה בך בקושי יש פסים שחורים בצדדים בסרטונים אחרים שלא שלך יש לי יותר פסים שחורים למה כך אשמח עם תענה,🙏
מלך !!!,👑
החולצות שלך ממש מגניבות  מאיפה אתה קונה אותם,👏
ואתה ערוץ יוטיוב הכי טוב בהסבר על פלאפון תמיד אני נכנס לערוץ לפני שאני קונה פלאפון חדש אתה מלך,❤
תודה לימדת אותי מלא,😀
תודה לימדת אותי מלא,👍
אלון אתה אלוף ולדעתי הסירטונים האלה אפילו יותר טובים מסקירות כי זה נותן לך ידע כללי אז תודה רבה נב האם אתה יכול לעשות בבקשה סקירה מעמיקה של הנוט 10 אני מאד יעריך את זה,👍
אחלה סרטוןואגב תודה שחתכת את הפריים בשביל להגדיל,👍
אהבתי תסרטון תמשיך עם הקונספט הזה עזר לי מאוד,❤
למה? אני לא מקבל התראה לסרטון אני פשוט עצבני שאני צריך לגלות שעלת סרטון בערך לפני יום כי זה הגיע למומלציםחוץ מיזה סרטון מעולה אלון (;,🤔
תודה אחי ימלך,👌
פעם צילמתי תמונה בבריכהחשבתי שהטלפון שלי לא היה עמיד(למרות שהוא כן) ולא הבנתי למה הוא נהרסעכשיו הבנתי והיה לי הסבר מפורט,☺️
סידרת לי את הראשתודהה,❤
תודה ימלך חבל שלא העלתה את הסרטון לפני לי היה galaxy a8 והוא היה נגד מים מה שקרה שצללתי איתו והוא נהרס לי ,🤣
אלוף עשית לי פה סדר ואפילו חידשת לי כמה דברים,👍
אתה 10 תגיד אתה ממליץ על הסמסונג A 10,👌
שמע סופסוף מישהו מסביר ,👑
אלון היקר עדיין ממליץ על הנוט 10 פלוס?? יש גרסה של 5G שאני מת לקנות אשמח שתגיב ,😁
גאון  פשוט ככה,⭐
הסוקר הכי טוב בארץ רמה של חול עזרת לי המון ,🙏
הסוקר הכי טוב בארץ רמה של חול עזרת לי המון ,👍
אלון אתה ממש גבר ואני אוהב את הסירטונים שלך ואתה משכנע אותי לקנות כל מוצר שאתה מפרסם אוהב אותך ותמשיך לעשות סרטונים כאלה,🔥
אלון אתה ממש גבר ואני אוהב את הסירטונים שלך ואתה משכנע אותי לקנות כל מוצר שאתה מפרסם אוהב אותך ותמשיך לעשות סרטונים כאלה,❤
כל הכבודתודה אלוף,😀
כל הכבודתודה אלוף,✌🏻
אלון קינגגגג,🌷
אייפון שלוש ביותר גדול ,😂
יש מצב לעשות סירטונים על תוכן של שימוש באפליקציות כמו ספוטיפי וכאלה והסבר מה ומי בהגדרות על איכות שמע וכו על פיצים שלא ידענו ,🙏
איזה טלפון באמת יש לך,😂
קצת לא קשור אבל יש בגלקסי 7s טעינה אלחוטית???,😅
חלום שגוגל ישווקו בארץאני עם הפיקסל 2 כבר שנתיים מאוהב במכשיר ובמצלמה לגבי עיצוב לא כזה אכפת לי אישית כל עוד הוא &quot;ייתן עבודה&quot; מבחינת צילום וביצועיים תודה על עוד סרטון ,❤️
חלום שגוגל ישווקו בארץאני עם הפיקסל 2 כבר שנתיים מאוהב במכשיר ובמצלמה לגבי עיצוב לא כזה אכפת לי אישית כל עוד הוא &quot;ייתן עבודה&quot; מבחינת צילום וביצועיים תודה על עוד סרטון ,🙏
כרגיל סרטון של האלוף  מחכה בקוצר רוח לסרטון נוסף! ,❤️
כרגיל סרטון של האלוף  מחכה בקוצר רוח לסרטון נוסף! ,💪🏻
ב2019 מי קונה מכשיר כזה מכוער ,😆
תודה על הסרטון הוא פשוט מעולהואני חושב שהמצלמה ממש ממש טובההיום בבוקר שהסרטון עלה לא נתנו לי לכיתוב תגובה זה היה חסום יש לך מושג למה?חוץ מזה הסרטון היה מעולה אתה פשוט מושלםלעומת כול ערוצי התכנולוגיההערוץ שלך נראה הרבה יותר טובוזה פשוט כיף לצפותתודה שאתה מחלק איתנו את הידעה שלךתודההההה ,👍
אלוף!!!!!,❤️
אלוף!!!!!,😂
סרטון מעולהמקווה לסקירה מעמיקה אגב אני רשום לערוץ שלך עוד מהסרטון של האייפון 7 פלוס נגד הגלקסי נוט 7בקיצור שמח להיות בין הוותיקים ,🙌
סרטון מעולהמקווה לסקירה מעמיקה אגב אני רשום לערוץ שלך עוד מהסרטון של האייפון 7 פלוס נגד הגלקסי נוט 7בקיצור שמח להיות בין הוותיקים ,😊
סרטון מעולהמקווה לסקירה מעמיקה אגב אני רשום לערוץ שלך עוד מהסרטון של האייפון 7 פלוס נגד הגלקסי נוט 7בקיצור שמח להיות בין הוותיקים ,😁
ועכשיו ביסחות הסירטון הזה שלך אנשים וגופים פרטיים יתחילו להביא אותו לארץ ,😆
אחלה סרטון אלון מחכה לסרטון של הנוט 10 ביום רביעי ,😉
אחלה סרטונים יש לך תמשיך ,👍
אלוף תמשיך עם הסרטונים על פלאפונים,🔥
סרטון טובתהיה עליו גם סקירה מלאה?,👍
וואלה הייתי מתנגד גדול ל5G הצלחתה להרגיע אותי אני מוכן לרכוש מכשיר תומך 5G ההסברה שלך ממש הצליחה לשכנע אותי,👍
רגע לאמא שלי יש גאלקסי s10 אז מה לעשות אני מפחדת ,😓
רגע לאמא שלי יש גאלקסי s10 אז מה לעשות אני מפחדת ,🥺
אתה אדם חכם מאודדדדד,👨‍🎓
אתה אדם חכם מאודדדדד,👍
באלי את הפלאפון הזה רק בגלל הצבעע,💙
באלי את הפלאפון הזה רק בגלל הצבעע,😍
לי יש טלפון שעולה 500 שקל,🤣
אתה אלוףףףף ,❤️
אחלה סקירה אלון יתותח וואללה אחי אתה צודק לא צריך להוציא הרבה כסף על פלאפון יש כמו שאמרת אחלה סמארטפונים בחירים נורמליים!! תמשיך איך שאתה,🇮🇱
