עגווניה ,🍅
באתי מהדיסקורד,😅
הגעתי מהלייב סירטון מעולה,😉
הגעתי מהלייב סירטון מעולה,👍
באתי מהליייב ימלך,😄
יש מלאי חדש בחנות הסחורה לינק בתיאור אל תשכחו לשים קוד shib ,🤩
שיבולת עם אתה אומר ששיבולים צריכים הגנה אז אולי גם כבשים צרכים הגנה זה לא יפה שאתה אומר שרק שיבולים צריכים הגנה ,😤
סליחה על שדיווחתי עליך זה נלחץ לי בטעות אוהב אותך אתה מלך! קיבלת סאב,🍉
זאת רק אני או שי נמצא בול איפה שהטוטם?חושבים שזה רמז למשהו? ,🤪
זאת רק אני או שי נמצא בול איפה שהטוטם?חושבים שזה רמז למשהו? ,😲
זאת רק אני או שי נמצא בול איפה שהטוטם?חושבים שזה רמז למשהו? ,🥴
החתול ששמע את הנעום נראה כמו החתולה שלי,🐈
היי חבריםאני מנגן באורגן ולאחרונה החלטתי להעלות קטעים ליוטיובכרגע לא העלתי מלא זמן כי אין יותר מידי תמיכהאני מנגן כל שיר שתרצו!!!אשמח אם תירשמו לערוץ או לפחות תצפו באיזה סירטון !ותיכתבו לי שיר שההיתם רוצים שאני ינגןתודה לכם ,♥️
היי חבריםאני מנגן באורגן ולאחרונה החלטתי להעלות קטעים ליוטיובכרגע לא העלתי מלא זמן כי אין יותר מידי תמיכהאני מנגן כל שיר שתרצו!!!אשמח אם תירשמו לערוץ או לפחות תצפו באיזה סירטון !ותיכתבו לי שיר שההיתם רוצים שאני ינגןתודה לכם ,♥️
@2BOF &quot;הגאון בנה עיר בשם &quot;בופאופוליס כדי לחבוש את הפרלמנטום בנתיים : אתה SBSביג בוסטטים בלאסטבבופאופליס העיר של הרעים והוא רוצה לגייס את כולם וליהיות ראש העיר של בופאופילס והפרלמנטום,💣
סרטון מעניין בטירוף ניצחת על בטוח! תמשיך ככה,😉
וואו אתה נותן לי המון מידה על פורטנייט תודה רבה תמשיך להיות מי שאתה,♥️
9:5 אורקה זה דולפין!ואוו והאורקה הזה ניראה חמוד  סליחה הדולפין הזה!,😋
בבקשה תמשיך את הסדרה,🙏
ממש כיף לי לראות סאבנאוטיקה בגלל שזה לא משחק שהוא טרנד גדול וזה משחק מעניין בקיצור מת עליך תעשה עוד פרקים,❤️
אני ממליץ שתשים סאונדטראק שלך ולא של המשחק כי זה משעמם טיפה(לא המשחק משעמם המשחק מעולה סיימתי אותו לפני שנה)ותמשיך!,😁
היי חבריםאני מנגן באורגן ולאחרונה החלטתי להעלות קטעים ליוטיובכרגע לא העלתי מלא זמן כי אין יותר מידי תמיכהאני מנגן כל שיר שתרצו!!!אשמח אם תירשמו לערוץ או לפחות תצפו באיזה סירטון !ותיכתבו לי שיר שההיתם רוצים שאני ינגןתודה לכם ,♥️
תמשיך עם הסדרה יאלוף,🥳
תקשיב שיבולת יש מלא יוטיוברים שמשחקים בזה ורוצים רק לסיים את המשחק אז בבקשה תכנס למשחק הזה יותר לעומק כי יש כל כך הרבה דברים לעשות תאמין לי ,😉
תשחה מה אתה צריך את כל זה,😕
שיבולת המלך,👑
שיבולת המלך,😃
שיבולת המלך,👍
לפחות אני יודעת שאני לא היחידה שמשחקת בזה,😜
ימלך,😍
חיכיתי 3 שנים שתעשה סאבנוטיקה ,👴
2090 אני אסטרונאוט שנשלח לכוכב אחר והספינה שלי התפוצצה אני ששיחק סבנאוטיקה:,😎
תקטין קצת את הפייסקאם אתה מכוער מדיסתם אני צוחק אבל אתה מסתיר חצי מסך,😂
פורטנייט !!!!!!!!!!!,🥰
פורטנייט !!!!!!!!!!!,😁
זה שיבולת הוא נולד עכשיו בואו נראה בלייקים בן כמה הוא יהיה,😄
לא היה אתגר לייק ,😲
מר שיבולת: עשיתי לכם מקבץ של כול שיתופי הפעולה וחסכתי לכם זמן אני שראיתי כבר את כול הסרטונים,🤬
הגיוני יש עשרים ראשונים,🤔
שיבולת פליז תעלה יותר הפרלמנטום,🙏🏻
קקטוסים,🎶
פרק טוב אתה היוטיובר האהוב עליי,💕
שנה לאחר שהמישחק מת ,😪
לכו לערוץ שורטס של מר שיבולת תתרגמו אותו לעברית ותסתכלו על השם של הערוץ,🤣
אפשר הסיפור מאחורי מר שביולת,😅
אפשר הסיפור מאחורי מר שביולת,👍
וואו איזה סרטון מושקע,❤️
עוד סירטון מעולה של מר שיבולת כרגיל ,😎
עוד סירטון מעולה של מר שיבולת כרגיל ,👌
תוכלו להירשם אליי? זה עוזר לי מאוד!! אני מעלה סרטוני פורטנייט מטורפים!!!,🙏
מתי עדכון 117 ,😭
בבקשה תעשו לי סאב אני מעלה סירטון כל יום,🥺
אתה יכול בבקשה לכתוב את הפקודה שאמרתה ב-6:33בבקשה,🥺
הגירסה כבר יצאה,🤷🏼
מת עליך רק המיקרופון שלך לא משהו ,❤
מר שיבולת הרג שיבולת והסתיר את הרצח צריך לדווח לרשויות ,😎
מר שיבולת הרג שיבולת והסתיר את הרצח צריך לדווח לרשויות ,😆
מר שיבולת הרג שיבולת והסתיר את הרצח צריך לדווח לרשויות ,😢
מר שיבולת אני מקבה שתענה נכון הסיפור של פרטנייט איפה כל הפטריקים איפה הם והעיר העיר קטנה אם היצורים ואיפו אמקדש של הפיצה והמונגר מקבא שתענה ממני ליאל ,😘
מר שיבולת אני מקבה שתענה נכון הסיפור של פרטנייט איפה כל הפטריקים איפה הם והעיר העיר קטנה אם היצורים ואיפו אמקדש של הפיצה והמונגר מקבא שתענה ממני ליאל ,😍
מר שיבולת אני מקבה שתענה נכון הסיפור של פרטנייט איפה כל הפטריקים איפה הם והעיר העיר קטנה אם היצורים ואיפו אמקדש של הפיצה והמונגר מקבא שתענה ממני ליאל ,🥰
מר שיבולת אני מקבה שתענה נכון הסיפור של פרטנייט איפה כל הפטריקים איפה הם והעיר העיר קטנה אם היצורים ואיפו אמקדש של הפיצה והמונגר מקבא שתענה ממני ליאל ,🤞
למה אתה עושה משימות כשאתה הג&#39;סטר? אתה עוזר להם לנצח!,😡
עשיתי סאב לשלושתם ,❤
עשיתי הכל מקווה לזכות תמשיך לייצר תוכן טוב,❤
יש לי חלום והוא להגיע ל4000 סאבים ו אני באמת משקיע הרבה מאוד בערוץ שלי!אז כמובן שאתם לא חייבים אבל אם בא לכם לעזור לי אז אשמח שתרשמו לערוץ שלימעריך את כל הסאבים החדשים,🖤
הי היום אני חוגג את היום הולדת שלי אני אשמח אם תסמן בלב את התגובה שלי ,🌾
תקלטו איך לקבל מלא לייקים לתגובה תכתבו מפיתעבד? ,😏
תקלטו איך לקבל מלא לייקים לתגובה תכתבו מפיתעבד? ,👇
גם אתה נפלת למשחק הזה,😅
אני לא מבין למה אתה עושה &quot;אתגר הלייק&quot; אם כולם כבר עשו לייק לסירטון,🤣
אני לא מבין למה אתה עושה &quot;אתגר הלייק&quot; אם כולם כבר עשו לייק לסירטון,👍🏻
תותח אחד מחר אני שם שוב את הקוד כי היום אני לא יכול להיכנס לפורטנייט אז מחר אני שם שוב,😎
תותח אחד מחר אני שם שוב את הקוד כי היום אני לא יכול להיכנס לפורטנייט אז מחר אני שם שוב,🤗
מיני שיבולת,🌾
רואים שבתאות לחצתה על הקפטור שמראה את האנשים שמחוברים,🤣
רואים שבתאות לחצתה על הקפטור שמראה את האנשים שמחוברים,😅
מישהו יכול לתת לי מנוי ואני אתן לו?,😳
מישהו יכול לתת לי מנוי ואני אתן לו?,🤨
-מה זה חזרה בזמן חזרה הזמן להתחיל אימון הזמן הוא פשוט הפוך ,🕘
-מה זה חזרה בזמן חזרה הזמן להתחיל אימון הזמן הוא פשוט הפוך ,🤩
-מה זה חזרה בזמן חזרה הזמן להתחיל אימון הזמן הוא פשוט הפוך ,🕟
 ואלוהים הו אלוהים אלוהים הוא עשה&#39;אני עשיתי טיגנתי נוחתים יודע מה הוא עברית,💥
 ואלוהים הו אלוהים אלוהים הוא עשה&#39;אני עשיתי טיגנתי נוחתים יודע מה הוא עברית,🦠
 ואלוהים הו אלוהים אלוהים הוא עשה&#39;אני עשיתי טיגנתי נוחתים יודע מה הוא עברית,🦵🏻
 ואלוהים הו אלוהים אלוהים הוא עשה&#39;אני עשיתי טיגנתי נוחתים יודע מה הוא עברית,😲
אני כשאני מגלה את הסיבה שהפורטל לא עבד,🤦🏼‍♀️
מר שיבולת אני רוצה לומר לך משהו שקשור לפורטנייט עכשיו בקולוסאום יש מים ושתי ספינות רציתי לשאול אותך עם אתה יודע מה זה אשמח שתעשה עוד סרטון של שינוים במפה תודה,🙏🏻
אז אתה רוצה להגיד שמה שמנע מכל חברי הפרלמנט להגיע לנדר ולהשיג מלא דברים היה הטמטום הקטן הזה של הכפתור?נב שימו לייק כל מי שידע עוד מההתחלה למה הפורטל לא עבד (כמוני),🤦‍♂️
קוראים לי אדל עקבתי אחרי שלושת הערוצים המדהימים שלך מקווה לזכות בהגרלה ,😻
קוראים לי אדל עקבתי אחרי שלושת הערוצים המדהימים שלך מקווה לזכות בהגרלה ,♥️
עשיתי לייק לכל הערוצים מקווה לזכות יגבר אוהב אותך,❤
נרשמתי לכל הערוצים שלך ולחצתי על הפעמון ועל הלייק ,❤️
הוצמד על ידי מר שיבולת SHIB?,📌
כולם עוברים דירה השנה מה זה (גם אני עובר דירה,😂
איך השגת את המשחק שריף?ואיך מסיגים אוצו(אם אפשר),🥰
שי נרשמתי לערוצים של מורשת הרשת שיבולת שורת וגם לערוץ הזה מקווה לזכות בהגרלה בחיים לא זיכיתי אפילו בהגרלה הכי לא שווה ויש לך תוכן ממש ממש טוב,❤
זה מר שיבולת  יש לו 1 iq כל לייק ה-iq עולה לכמה נגיע? ואני מציין שברגע ששיבולת בכבודו ובעצמו נותן לייק ה-iq עולה ב-10!,🌾
הוצמד על ידי מר שיבולת SHIB,📌
אתה יכול להירשם לערוץ שלי קוראים לו ultra mega Lego master בבקשה אין לי הרבה סבים,😞
פליז תן לי ,💖
פליז תן לי ,💓
אני חי מתחת לסלע,😥
סרטון מצוין הסבר טוב מאוד,👍🏻
מר שיבולת תעשה סירטון שאתה אומר מתי טרוויס סקוט יוצה לחנות בבקשה ,🥺
שיבולת ימלך  עשיתי סאב לשלושת הערוצים מקווה מאוד לזכות בהגרלה!,🤴
וואי איך אני מתגעגע לסיזון 4 תקופה טובה,😥
וואי שיבולת ימלךךךךבהצלחה עם המעבר לבית של חברה שלך,❤️
עידו ביגבוסט עזב?,😥
מת על שיבולתתתת,♥️
היי אני ממש משקיעה בסרטונים אשמח אם תיתן חמ סאב נראה מי יהיה הסאב ה60 שלי ,😊
בבקשה תעשה לייב ראסט!!!,🙏🏻
בבקשה תעשה לייב ראסט!!!,❤
טו בשבט שמח לכולם ,😁
מעצבן אותי שגנבו לך,😡
מעצבן אותי שגנבו לך,🤬
עשיתי לייק ,❤️
אני שעשיתי לייק לפני שהתחלתי לצפות כי ידעתי שזה יהיה טוב,😗
‏שרטון טוב גם ארוך,😜
אוי לא הגופה של זיגי בטאבנייל,👀
סרטון חזקק מר שיבולתתת עשיתי הכל בשביל להיות בהגרלה שלך ,💥
סרטון חזקק מר שיבולתתת עשיתי הכל בשביל להיות בהגרלה שלך ,❤️
הי יש תודהההה על התוכן אני מאוד אוהב ראסט זה הדבר היחיד שמעניין אותי בזמנים האחרונים ,💯
הי יש תודהההה על התוכן אני מאוד אוהב ראסט זה הדבר היחיד שמעניין אותי בזמנים האחרונים ,👍
אחי שומעים אותך ממש חלשחוצמזה אחלה סדרה ,😁
יא מלך חולה אלייך רואה כל סרטון שלך של מורשת הרשת וגם של האמונג אס חולה מקווה לזכות הגרלה ימלך,🏅
יא מלך חולה אלייך רואה כל סרטון שלך של מורשת הרשת וגם של האמונג אס חולה מקווה לזכות הגרלה ימלך,🥇
יא מלך חולה אלייך רואה כל סרטון שלך של מורשת הרשת וגם של האמונג אס חולה מקווה לזכות הגרלה ימלך,🏆
יא מלך חולה אלייך רואה כל סרטון שלך של מורשת הרשת וגם של האמונג אס חולה מקווה לזכות הגרלה ימלך,🎖
יא מלך חולה אלייך רואה כל סרטון שלך של מורשת הרשת וגם של האמונג אס חולה מקווה לזכות הגרלה ימלך,🎮
זאת כמות האנשים שאוהבים את מר שיבולת,👇
נרשמתי לכל הערוצים שלך ונתתי לייק מקווה לזכות ובהצלחה לכולם!,🎉
מר שיבולת אחלה סירטונים אוהב תסרטונים שלך עשיתי הכל להגרלה,💥
י דאפוק  י#$^&amp;£^%//$$÷,👎
י דאפוק  י#$^&amp;£^%//$$÷,🤬
שיבולת יש ארבעה דברים שאני ממש אשמח עם תעשה 1 שתגריל ראסט2 שתסביר איך מדברים בראסט 3 תן לי תגובה/ לב שראית את ההודעה 4 שתסביר איך עושים טיםתודה תנו לייק תגובה מי שרוצה,🙏
בבקשה בפרק 4 תתחיל לשדוד בתים ולעשות פלישותכל מי שמסכים לייק,👍
אני רשומה לכול הערוצים שלך תעשה עוד סבים  בהצלחה בסרטונים שלךתמשיך להעלות תוכן טוב,❤️
אני רשומה לכול הערוצים שלך תעשה עוד סבים  בהצלחה בסרטונים שלךתמשיך להעלות תוכן טוב,😁
מה הסיכוי שאני אזכה  180000 - 1 יאללה ה&#39; בבקשה תן לי לזכות 0:18,😑
מה הסיכוי שאני אזכה  180000 - 1 יאללה ה&#39; בבקשה תן לי לזכות 0:18,👌
ימלך,👑
מי מתי יש לך עיניים כחולות ,🤔
בבקשה תן לי יותר סיכוי לזכות לא זכיתי באף הגרלה והאיתי בלפחות 25 הגרולות,🙏
עשיתי סאב כבר לפניי חודש לכל הערוצים,👍
היי מר שיבולת אני מאוד אוהבת את הסירטונים שלך ואני צופה בך מלא מלא זמן וגם עקבתי אחרי כל הערוצי יוטיוב שלך כולל בטיטוק ובאינסטגרם וגם אני תמיד נותנת לייק אז אני יכולה להשתתף בהגרלה? בבקשה כולם shid בשופפפ,😁
היי מר שיבולת אני מאוד אוהבת את הסירטונים שלך ואני צופה בך מלא מלא זמן וגם עקבתי אחרי כל הערוצי יוטיוב שלך כולל בטיטוק ובאינסטגרם וגם אני תמיד נותנת לייק אז אני יכולה להשתתף בהגרלה? בבקשה כולם shid בשופפפ,😝
אההה עם דורש חלק 3,👉
אההה עם דורש חלק 3,🚨
איזה כיף שיבולת סימן את התגובה שלי בלב ,❤️
סטייק?!?! ,🤣
אתה המלךךךךך,⬆️
נרשמתי לשלושת הערוצים ממש מקווה לזכות!,🌵
נרשמתי לשלושת הערוצים ממש מקווה לזכות!,🌾
זה מספק שאתה אומר מורשת הרשת,🤣
ראיתי איך התפתחת בין השנים וזה מדהיםמ50 סבים ל100 ל150 ועוד רגע ל200מת אליך תמשיך להשקיע ועל תעזוב לעולם,❤️
אם לא תשימו לייק השריף יאכל אתכם ,😂
אם לא תשימו לייק השריף יאכל אתכם ,😇
אני נרשמתי לערוצים ,👍
שיבולת אני מאוד נהנה מהסרטונים שלך ימלך ממש אוהב אותך שמתי סאב ופעמון לשלושת הערוצים מבתיח יגבר ,👍
לאחותי יש מחר יום הולדת,🥳
אני רוצה לייק סתם שמתי סאב פעמון ולייק לשתי הערוצים,🍆
אני רוצה לייק סתם שמתי סאב פעמון ולייק לשתי הערוצים,😃
וואלה יפה,❤️
סרטן פריךהוסרטןפריךאני אותךכלכךצריך,✨
סרטן פריךהוסרטןפריךאני אותךכלכךצריך,🧽
סרטן פריךהוסרטןפריךאני אותךכלכךצריך,🍔
סרטן פריךהוסרטןפריךאני אותךכלכךצריך,👩‍🦰
סרטן פריךהוסרטןפריךאני אותךכלכךצריך,🦀
אשמח ממש לזכות באקסבוקס!!!אני כמובן רשומה לכל הערוצים ואני לא רוצה להיות שוביניסטית אבל עד עכשיו לא נראה לי שבת זכתה בהגרלות של אקסבוקסים ,😍
אני מתה עליך ,😘
נרשמתי לשלוש הערוצים שלך,😊
נרשמתי לכל הערוצים מקווה לזכות!!,🌵
נרשמתי לכל הערוצים מקווה לזכות!!,🌾
מכווה לזכות,🏆
היי יש ערוץ של גיימינג אשמח אם תרשמו זה עוזר לי מאוד,🙏
היי יש לי ערוץ יוטיוב של גיימינג אשמח אם תרשמו לערוץ ,🙏
נרשמתי לשלושת ערוציםוגם הפעלתי את הפעמוןמקווה לזכותאוהב את הערוץ שלך ממש,🤞
כל מי שמחפש את הכפתור אז הוא פה,👇
עשיתי את זה ובבקשההההה תן לי לנצח אני עוקבת כבר מלאאא זמן וא לי לתת לאח שלי את זה במתנה ,🥺
xbox  לי אישית אין קונסולה אלא רק מחשב ואני מאוד מעריך את זה אבל xbox יהיה יותר מנחמד,😎
אומיגד אני הייתי עם האקר הזה הרגע ,😮
אני רשום לכול הערוצים שלך בלי לזכות,❤️
עשיתי סאב לשלושת הערוצים ראיתי כל סרטון בשלושת הערוצים ואני מת על כל הערוצים שלך,❤
חברים העלתי סרטון אדיר חובה צפייה ,🔞
נרשמתי לכל הערוציםוהפעלתי את הפעמוןמקווה לזכות,🤞
אני לא אימפוסטר אם דיברתי עם הצ׳אט!! ,💔
אני לא אימפוסטר אם דיברתי עם הצ׳אט!! ,🥲
נירשמתי לכל הערוצים מקווה לזכות,😁
עשיתי בשלושת הערוצים בבקשה תן לי פעם אחת לזכות מכל היוטיוברים בבקשה שיבולת אתה היוטיובר האהוב עליי ואתה מצחיק רצח ,💯
אני אהקר יצא לי ,😄
עשיתי לך סאב לכל הערוצים וגם הגבתי בפוסט ביוטיוב שהעלת אז מקווה לזכות,💖
עשיתי לך סאב לכל הערוצים וגם הגבתי בפוסט ביוטיוב שהעלת אז מקווה לזכות,❤
הסרטן הפריךךךךךך,😲
הפורטל לא עובד ביגלל הכפתור!!!!!!,🤣
השער לא עובד ביגלל שלא בניתה אותו טוב,🤠
קפתור (לחצן) הקפתור מפריע תוציא את המצית תהרוס את הקפתור תצית את השער עם המצית וזה ואבוד נקודה,😁
עשיתי סאב לשלושת הערוצים אתה מלךךך,😎
הגרלה על אקסבוקס שהתנאי להיכנס אליה הוא להירשם לשלושה ערוצים נשמע מוכר,🤔
הייייי נרשמתי ל3 הערוציםםם והפעלתי את הפעמוןן אוהבת את הסרטונים שלך ממש אני בת 15 ואוהבת לשחק במחשב אתה נותן לי השראה כול כך,🥺
הייייי נרשמתי ל3 הערוציםםם והפעלתי את הפעמוןן אוהבת את הסרטונים שלך ממש אני בת 15 ואוהבת לשחק במחשב אתה נותן לי השראה כול כך,🙃
הצלחתי לעשות את אתגר הלייק ועשיתי את 3 השלבים של ההגרלה מקווה לזכות ,🤗
הצלחתי לעשות את אתגר הלייק ועשיתי את 3 השלבים של ההגרלה מקווה לזכות ,👍
עקבתי בשלושת הערוצים מקווה לזכות,😊
כמות האנשים שאוהבים את שיבולת,👇🏻
וואי גבי הרג אותי במשחק האחרון,😂
היה לי פרסומת של שיבולת שועל,🤣
אני אוהב את הסירטוני אמונג אס אבל אני מחכה לסירטוני פורטנייט,😜
ממליץ לך לעשות סרטונים של אימפוסטר,😁
התאוריה שלי:מלחמת העולם השלישית תהיה על ריב בגלל המילים בבבוי וכפתורתהיה מלחמה קשה מאודאבל בסוףהשיבולת מנצח(לא היה אימוגי של שיבול),🍓
תעשה בבקשה הפרלנטום ,🥺
2000 IQ חחח,😂
למר ששיבולת היקר בבקשה תעלה עוד פרלמנטום אפילו בשביל בן אדם אחד אין לך מושג כמה טוב זה עושה לי ולא רק לי אתה באמת לא יודע ותודה על כל הסרטונים ,👌
מזל טוב על 2000 IQ,🎉
מזל טוב על 2000 IQ,🎈
מזל טוב על 2000 IQ,🎊
‏הסרטון הכי טוב שלך ,👑
שי: חמוצי מתוק!אני: ,🤨
נרשמתי לערוץ והפלתי פעמון,✔
נרשמתי לערוץ והפלתי פעמון,🔔
יותר סרטונים שאתה רוצח,🙏
היי קורים לי the king of water ואני הרבה זמן רוצה להיות יוטיובר אבל אני כבר עוד מעט ארבע ימים ברציפות מעלה סרטונים אבל בקושי צופים בהם בבקשה החלום שלי הוא להיות אם 100 מנויים תרשמו בבקשה,😔
שיבולת שלך אותי מהלייבפלישהההה,😏
שיבולת שלח אותי ,❤
שיבולת שלח אותי תנו לייק וסאב,👍
לסבא שלי קוראים אברהם,🧐
לסבא שלי קוראים אברהם,🤯
וואו תקשיב שי אתה חכם מאוד וכמעט אין יוטיוברים שעושים את זה אתה הראשון שאני רואה אתה גם מלמד אותנו דברים חוץ ממשחקים וואו כל הכבוד לך אתה היוטיובר הכי טוב ומלמד שיש חחחחח אוהב אותך מי שמסכים שיתן לייק ושי אני רוצה שאתה תסמן לב על התגובה הזאת ותקרא אותה,😃
שי אתה יוטיובר מדהים!!!אתה גם מסביר המון עובדותגם עושה משחקים מעניניםיודע לראות צדדים שונים בדבריםאיזה מלך אתה,🤩
חשוב,❗
אלופים ,🏆
ערים שכחת כואב אחד,😁
קוראים לך שי??!?!!!?עם כן אז למה לא סיפרת???!!?!?,🤔
קוראים לך שי??!?!!!?עם כן אז למה לא סיפרת???!!?!?,😱
מר שיבולת : כואב לי מר שיבולת אחרי כמה שניות :אוכל שוב את מה שגרם לכאב ושוב מר שיבולת :כואב לי תחשבו שזה אין סוף פעם אבל אין לי כוח לכתוב מלא פעם,😏
הרגת את ראמן!לייק וסאב לשיבולת כל מי שהבין,👍
ימלך כל מי שראה את התגובה לשים לייק סאב וכמובן פעמון אז רדו למטה סימו לייק סאב וכמו שאמרתי פעמון אם אתם שמים את מה שאמרתי אתם גברים,👍🏻
