עגווניה ,🍅
איזה מקומות ישארו לא שאני רוצה את זה,🥺
לא עשיתי לייק,🖕
אין לי פורטנייט,😭
אני ממש משקיע בערוץ שלי ואני ממש אשמח אם רק תלחצו על הסאב בערוץ שלי ואם לא לתת סאב אז לפחות לראות את הסרטונים או לתת לייק! תודה מראש!,🙏
תאמת שאני מכיר את הכול אבל אחלה סירטון ,🔥
תאמת שאני מכיר את הכול אבל אחלה סירטון ,😁
תענוג לצפות בך מר שיבולת אתה הורס השיבולים המקצועי תעשה עוד סרטונים כאלה ואני מעריך את ההשקעה שאתה עושה בכול סרטון ימלך אוהב אותך!,👍🏼
יפה יש פה דברים שלא ידעתי שאפשר לעשות כל הכבוד לך יצא סרטון טוב ,👍
אני יואמר משהו (הוא לא נכון והוא מהדעת שלי) בטריילר של סיזן 10 ראינו את הבננמן כועס בתוך הטרילר ואז שתי סיזנים אחרי פיתאום הוא חוזר בבאטל פאס בעניים כועסות ואז ראינו בור לעד המקום של מיידס הכספת לאף אחד זה לא מרגיש מיקרי מידיי? לייק מי שחושב שזה נכון במיקרה שלך מר שיבולת ,💓
אה מר שיבולת התקופה שאפילו לסקין היה סיפור כרגע 3 חודשים או יותר בעונה 11 וכלום לא קורה,🥶
אה מר שיבולת התקופה שאפילו לסקין היה סיפור כרגע 3 חודשים או יותר בעונה 11 וכלום לא קורה,😭
תעשה סרטון על הסיפור של סקין הדג,🐟
יש!  איירון מן זה הגיבור האוהב עלי ,👍🏻
יש!  איירון מן זה הגיבור האוהב עלי ,🤗
יש!  איירון מן זה הגיבור האוהב עלי ,👌🏻
יש!  איירון מן זה הגיבור האוהב עלי ,✌🏻
וואו אחי אתה כזה טוב איזה השקעה תמשיך ככה ,👍
שמתם לב שפילי מחזיק כוס שייק ,😂
פה מאז 50 סאביםמזל טוב אח יקר ,♥
מזל טוב מר שיבולת,😁
מזל טוב שיבולתאוהבת אותך,🎁
מזל טוב שיבולתאוהבת אותך,💋
מזל טוב שיבולתאוהבת אותך,❤
מזל טוב מר שיבולת,🥳
מזל טובבבבב,❤
מזל טובבבבב,🎊
מזל טובבבבב,🎉
מזל טוב מר שיבולת אח יקר יגבר עד 120 תעלה במדרגות הזהב יגבר,❤
מזל טוב ,👑
מזל טובואיזה כיף להיות בין ה 1000 הראשונים שנרמו לערוץואתה היוטיובר האהוב עלי חולה אליך ותמשיך את מה שאתה עושה שזה פשוט להיות מלךךךך,😍
בהתחלה חפרתה עם היי חברים כאן מר שיבולת ,😂
אחי פתחת תערוץ רק ב3 לאוקטובר איך שנה,😂
מזל טוב,❤
הי חברים כאן מר שיבולת חוגג שנה לערוץ,🥳
מזל טוב ימלך תמשיח כחה,❤
מזל טוב!!!! ,😀
מזל טוב!!!! ,😋
מזל טוב יאחאבל מה הם ערים הוא גם חלק בערוץ,💙
מזל טוב יאחאבל מה הם ערים הוא גם חלק בערוץ,😉
מזל טוב שיבולת,👏
אולי תגיד היי שיבולים במקום היי חברים נראלי יותר מגניב מזל טוב גבר,❤
מזל טוב ,🥳
מזל טובבבב,🎈
מזל טובבבב,🎊
מזל טובבבב,🎉
שיבולת ימלךךחולה עליך תמשיך ככה,🥳
מזל טוב יגבר use code shib ,🌾
הרגת,🤣
הרגת,😂
עוד סרטון חדש ומעולה מבית מר שיבולת ,👌🏻
מר שיבולת אווז לא אוכל שיבולים?,🤔
אדיר תעשה מלא סרטונים על זה תומך ומעריך גם באייטם שופ בפורטנייט וגם בכללי וגם בדברים אחרים,🙏
מכירים את זה שאתם כותבים תגובה שמקבלת הרבה לייקים ואז מישהו כותב לכם ״בדיוק באתי לכתוב את זה״ תנו לייק אם אתם מכירים את זה,😑
במאה אחוז יהיה חור שחור (אמר בפלישה אחרי האיוונט),😂
אני לא רוצה שפורטנייט יגמר,😭
קרינגי ברמות!!!The Endאיזה פחד,🥶
קרינגי ברמות!!!The Endאיזה פחד,😱
יהיה סיזן 11 ,😭
אתה מלך Boss מיספר 1,🏆
אתה מלך Boss מיספר 1,🎆
אתה מלך Boss מיספר 1,🥇
איך סתם איזה דפוק,👎
אתם מחפשים מעצב טאמניילים מקצועי?אז הנה מצאתם אני יעצב לכם טאמנייל רק בחצי שעה מזמן השליחה!מה תקבלו:1 אמינות ומקצועיות2 מחרים זולים3שינוי כל דבר בטאמנייל עד כשעה מזמן הסיום לפנייה וצפייה בתיק עבודות פנו אליי בפרטי הדיסקורד שלי DESINGER - ZONG$6055,😱
וואו אתה מלך,🤗
וואו אתה מלך,🤴
הפתיח קרינג אהבתי שיבולת רק SHIB בחנות ,🙂
חהחהחהחה,😂
נשאר לעונה שבוע וחצי על מה אתה מדבר  זה לא שלוש שבועות,🤣
גוטאם היא תוספת מדהימה!!!!! לייק כל מי שמסכים איתי,👇🏻
מי ששם לב ב155 שהוא אמר שזה פשוט הוא אמר פגוט מי ששם לב שיתן לייק,😉
זה הסירטון הכי טוב שראיתי בעולםםםם!!!!,🤦‍♀️
סירטון מטורף,😂
יש מישהוא שצפה &quot;בסירטון&quot; הזה עד הסןף?,😂
מרגש!,😮
עכשיו חברים זה תוכן,😀
טוב אלה 10 דקות ושתי שניות שאף פעם לא יחזירו לי או לכם ואפילו למר שיבולת,😂
זה באמת הסרטון הכי מושקע בעולם ,🤣
זה באמת הסרטון הכי מושקע בעולם ,😂
וואו,👏🏻
איזה משואמםםםם,🤣
אתה מזכיר לי את אבא קריר עם הסרטון הזה,😂
חחחח פשוט דילגתי לסוף,😈
וואו אני גאון הסרטון בלופים,🤯
אל תשים  את הסרטונים שלך כפרסומת,👏🏻
רציתי להיכנס לשרת שלך ורז הסופריים קילל אותי ונתן לי באן,😭
שלום מר שיבולת לי קורים בפורטנייט Noam1802 אני ממש ממש רוצה לשחק איתך ואני אוהב אותך ממש ממש אני צופה בך מהאתחל שלך אני רוצה שתמשיך לעלות סירטונים כמו תמיד מעולים אוהב אותך מאוד אתה היוטיובר הכי טוב בעולם תמשיך איך שאתה אוהב אותך ,♥️
מר שיבולת עשיתי אותך בחברים פורטנייט אני ממש רוצה שתשלח לי גיפט ולא אישרת אותי אז פליז אני מת על הסרטונים שלך של פורטנייט ושל מיינקראפט תמשיך,😜
סמתי,🤙
סמתי,👍
אתהההה מלךךךךךךך כל כך כיף לרואת דברים שלך ,❤️
ב עונה 7 זה היה בשבוע 8,🤭
מזל טוב על 1000 עוקבים! ,🎉
תודה רבה לך תותח ,💙
חולה על באטמן,🦇
אתה לא מאשר במשתמש,👑
אתה לא מאשר במשתמש,🤦‍♂️
לייק מי שצופה בזה ב2022,👍🏻
זה כמו מה שיש בלגו מיינקראפט רק במיינקראפט ,🎮
שיבולת  ערים,👍
‏בכל סרטון אתה ‏ ‏מדהים אותי מחדש  אבל לא הבניתי כל כך איך בונים אותה,😱
אחלה שיבולים,🤗
בשיר קקטוסים של שי זה נראה שיש לו אודם בפה,😂
מה זה הטאמנייל הזה??,😳
מה זה הטאמנייל הזה??,🤯
השאלה מתי סקין של פדיקסול יכנס למשחקסושי פדיקסול ברור,😆
השאלה מתי סקין של פדיקסול יכנס למשחקסושי פדיקסול ברור,👌🏻
יתותח יש מצב אתה עושה תשובות למשימה החדשה של הסקין החדש שיצא פליז אני פשוט נתקעת במשימה ואני לא מצליחה אותה יש מצב אתה עושה תשובות,🙏🏼
‏שמתי לך את הלייק מת עליך,💋
‏שמתי לך את הלייק מת עליך,♥️
אחלה מיינקראפט,😊
מר שיבולת זה לא שולח לי למשתמש שלך,😥
שיבולת קניתי מלא דברים בקוד שלך את love ranger פליז שלח לי את הגיפט בחיים לא קיבלתי גיפט יא גבר אוהב אותך ואם תרצה לשלוח לי גיפט השם davidpleeese127,😍
יוטיובר ענק מלך  בפורטנייט יש לך הומור מצחיק ובאמת שאתה היוטיובר האהוב עלי רק קוד Shib בחנות,👑
המצאתי שיר ליצן קטן נחמד נתלוש לך ת&#39;יד,😱
וואייייייי קרעת אותי עם העץ יאללה שיבולת האהוב שלנו תגיע כבר ל 100k,😂
רק קוד SHIB מקווה לקבל גיפט,😄
משממם שלא דברתה,😥
לייק 8,😑
שי בולת ,😉
למה ,🙃
למה ,😥
למה ,🌝
למה ,😪
למה ,🌬
קקטוסים קקטוסים זוכר אותי?,🎵
קקטוסים קקטוסים זוכר אותי?,🎶
קקטוסים קקטוסים ,🎶
קקטוסים קקטוסים ,🍃
קקטוסים קקטוסים ,🌵
קקטוסים קקטוסים ,🎵
קקטוסים קקטוסים ,🎼
אפשר לב ,❤
קקטוסים קקטוסים אוהבת אותך שיבולת אתה אחלה יוטיובר,🌵
קקטוסים קקטוסים אוהבת אותך שיבולת אתה אחלה יוטיובר,🎵
קקטוסים קקטוסים אוהבת אותך שיבולת אתה אחלה יוטיובר,🎶
יא מלך אני לא ראיתי תה סירטון אני לותן לייק ,😜
חחח ימלך אתה,💙
הכישרון של ערים מגיע להרים ,🎺
אבל למה!!!,🤣
אבל למה!!!,🤐
אבל למה!!!,😣
אהבתי את ההתחלה,🤣
כל היוטיוברים מגיבים לסירטון האחרון:מהה אני לא מאמין קליק ביט קליק ביט אני בחיים לא אוכל את זה יותר כל החיים שלי עם שקר אתה: וואו איזה מגניב אני מרגיש נבגד בקיצור אתה היחיד שלא מגזים בכוונה,😱
אין לי מושג למה אני כותבת את התגובה הזאתי רק עכשיו אבל בדקה 6:38 יש שיבולים בצד! ,🙃
תעשה עוד סרטון של שששש בפרק ספיישל ששחש שיבולת שאל חודש שעבר,😂
תעשה עוד סרטון של שששש בפרק ספיישל ששחש שיבולת שאל חודש שעבר,😬
אתה ממש מדהים ,🤟🏻
זה מה שקורה כשאתה עורך לבד ולא נותן לערים לערוך ,😘
שיבולת אתה יכול לעשות סרטון הדרכה על המשימות של הפנדורה,😁
31 באוגוסט התרחש רצח מי שנרצח היה החופש הגדול הרוצח היה הלימודים אנא זכרו את החופש לשנה הבאה ,😭
מר שיבולת אתה יכול גם להראות את המפה כולה בפעם הבאה ?נרשמתי לערוץ והפעלתי את הפעמון,🙃
מר שיבולת היקר אני רק מודיע לך שעשיתי לייק וסאב מקווה שאהבת ושזה מחמם בלב ואני מקווה שתשמע את זה ואתה צודק לפני כמה ימים הלכתי לראות את המקום הזה והיה שם שריפה אז חזרנו הביתה⁦⁩⁦⁩⁦⁩⁦⁩,❤️
סרטון מעולה  שיבולת מנצח !,👍
אני  את קווין,💜
מזל טוב קוין אוהב אותך ,♥️
מזל טוב קווין אתה מאוד חזק אני  אותך מאוד וגם אותך מר שיבולת המלך,😍
מזל טוב קווין אתה מאוד חזק אני  אותך מאוד וגם אותך מר שיבולת המלך,🥰
מזל טוב קווין,😚
מזל טוב קווין,😍
מזל טוב קווין,😋
מזל טוב קווין,😃
לזכר גריסי-לייק ,😩
לזכר גריסי-לייק ,😬
באירוע הסודי של העונה קווין יצאו 58 קווינים מיקומים שונים מתוך הריפט וכולם יהרסו את הרובוטים ה האלה,🤬
יש שמועות שמר שיבולת יצמיד לי את התגובה,😺
מזה ערים מה הוא כל-כך מכוער שאתה מראה תמונה של קוף?,🤔
מלך,👑
אתה ב&#39;ן כלב,💩
אתה ב&#39;ן כלב,👣
בבקשה תעשה מפת של העולם אישרדות שאתה משחק! שיהיה להורדה בתיאור ,👍🏻
הלו מר שמולאי שנה תשם שלך לשיבולאי,😂
בבקשה תעשה מדריך על ההגדרות בכרייטיב עדיין אף יוטיובר ישראלי לא עשה את זה וזה יעזור מאוד ,🙏🏼
סרטון אחד הטובים ערים עשה עבודה ,👌
מר שיבולת אתה יכול בהקשה לשחק איתי בבקשה,😭
מה שמצחיק בזה זה ליראות אתכם מתים,😂
מר שיבולת סרטון פצצה יגבר רצך,😘
למרות שאני בחול דאגתי שיהיו כמה סרטונים השבוע! מקווה שתהנו ,😆
מר שיבולת אתה היו&#39;טיובר שאני אחי אוהב ומקווה שתעלה ל100 אלף רשומים ,🤩
מעולם לא ראיתי כזה הרבה הכבישים,🕸
מעולם לא ראיתי כזה הרבה הכבישים,🕷
איזה טיפים טובים ,😍
היה שם יהלומים  איך לא ראיתה סרטון ראשון שלך שאני רואה ואני ממשיך לראות (כי אני חולה עליך),😂
היה שם יהלומים  איך לא ראיתה סרטון ראשון שלך שאני רואה ואני ממשיך לראות (כי אני חולה עליך),😉
היה שם יהלומים  איך לא ראיתה סרטון ראשון שלך שאני רואה ואני ממשיך לראות (כי אני חולה עליך),😀
איך פספסת אותם?? סתם סתם ציניות ערים כל כך מוסיף הרבה לסרטונים ואני נהנה לראות אותם ושי גם אתה ממש מצחיק ואתה כל פעם גורם לי לצחוק,😊
איך פספסת אותם?? סתם סתם ציניות ערים כל כך מוסיף הרבה לסרטונים ואני נהנה לראות אותם ושי גם אתה ממש מצחיק ואתה כל פעם גורם לי לצחוק,😂
איך פספסת אותם?? סתם סתם ציניות ערים כל כך מוסיף הרבה לסרטונים ואני נהנה לראות אותם ושי גם אתה ממש מצחיק ואתה כל פעם גורם לי לצחוק,😁
איך פספסת אותם?? סתם סתם ציניות ערים כל כך מוסיף הרבה לסרטונים ואני נהנה לראות אותם ושי גם אתה ממש מצחיק ואתה כל פעם גורם לי לצחוק,👍🏻
 זה מר שיבולת כל לייק  שתעשו הוא יעלה עוד סרטון מיינקראפט כמה סרטוני מיינקראפט הוא יעשה ?,🙋‍♂️
 זה מר שיבולת כל לייק  שתעשו הוא יעלה עוד סרטון מיינקראפט כמה סרטוני מיינקראפט הוא יעשה ?,👕
 זה מר שיבולת כל לייק  שתעשו הוא יעלה עוד סרטון מיינקראפט כמה סרטוני מיינקראפט הוא יעשה ?,👍
 זה מר שיבולת כל לייק  שתעשו הוא יעלה עוד סרטון מיינקראפט כמה סרטוני מיינקראפט הוא יעשה ?,👟
רגע אחד מה קרה לקווין? ,🤔
מה הקטע של העיניים הסגולות,🤣
מה הקטע של העיניים הסגולות,😂
אני ביון בא לי להיות שם ,😭
שיבולת אם לא שמת לב אז הטילים של המק זה הטילים שהיה באיוונט של הרובוט נגד המפלצת ועכשיו הוסיפו למק לייזר מתכוון כמו שהטיל באיוונט של סיזון 4 עשה על טילטד ואני חושב שהם יוסיפו לרובוט דברים מכל מני האיוונטיםאשמח עם תגיב ,🤙
שיבולת אם לא שמת לב אז הטילים של המק זה הטילים שהיה באיוונט של הרובוט נגד המפלצת ועכשיו הוסיפו למק לייזר מתכוון כמו שהטיל באיוונט של סיזון 4 עשה על טילטד ואני חושב שהם יוסיפו לרובוט דברים מכל מני האיוונטיםאשמח עם תגיב ,✌
בעונה החדשה השיא שלי זה 15 עשיתי אותו אתמול ,😝
אני הואב שאתה שר את השיר של הקקטוסים,🤣
אני הואב שאתה שר את השיר של הקקטוסים,🌵
אני הואב שאתה שר את השיר של הקקטוסים,😀
מה שיבולת יגבה,😻
מה שיבולת יגבה,🛴
מה שיבולת יגבה,📲
אתההה גאון הקטע עם ‏שער לכפר ,😱
‏תשחק משחק שקוראים לו Zooba בבקשה מר שיבולת,🥺
שיבולת אני אוהב את הסרטונים שלך ובמיוחד את ערים,😘
שיבולת אני אוהב את הסרטונים שלך ובמיוחד את ערים,❤️
שיבולת אני אוהב את הסרטונים שלך ובמיוחד את ערים,💕
שיבולת אני אוהב את הסרטונים שלך ובמיוחד את ערים,😍
תעשה לייבים מפחדים,😀
תעשה לייבים מפחדים,👍
רק מיינקראפט,🧐
אם אתה רוצה אנחנו יכולים לעשות סדרה ביחד בנפרד לסדרה של המינקראפט שלך שביחד נוכל בשרת ולהילחם לגבנות ובעיקר להנות אם אתה רוצה מוזמן לדבר איתי בפרטי popcoren7#5490,❤
טוב תמשיךך,👍
ההורים שלי התגרשו והיום יום ההולדתשלי באמת שאין יותר מבאס מזה ואני נורא אשמח אם תירשמו לערוץ שלי בבקשה,❤️
אתה מוכשר רצח!! אני עדיין לא מבין איך הצלחת לדייק בדיוק כמו השיר המקורי!!!,😍
ימטורף ראיתי עשיתה אשששש,🔥
וואו שיבולת הפתעת אותי לא לרעה ממש לטובה ממש מושקע השיר הזה נשבע אני ישים אותו לרינגטון של הטלפון ,😂
וואו שיבולת הפתעת אותי לא לרעה ממש לטובה ממש מושקע השיר הזה נשבע אני ישים אותו לרינגטון של הטלפון ,♥
יצא לך ממש טוב,👍
אחי אוווווו,😀
ככל שאני שומע יותר על חיות ככה אני חושב שבני אדם יותר טיפשיםאחלה סירטון,😃
הדובים הכי הפתיעו אותי הם כאלה חמודים,🐻
ואחרי זה אומרים שפיצוץ יצר את הדברים האלה ,😂
סרטון מדהים תמשיך ככה,😊
שיבולת אתה יכול בבקשה להמשיך את זה? זה ממש מעניין ויפה,😀
היי חברים כאן מר שיבולת סוחב אנשים מרגיש כמו משקולת ,😜
היי חברים כאן מר שיבולת סוחב אנשים מרגיש כמו משקולת ,❤
יש המוןןן באגים בעונה 10 : פטריקיםרכישות במשחקואפילו בכוכבים סודים!!,😡
מר שיבולת איבדת את האוצר הפטריקים!! אתה מפוטר ,⭐
מר שיבולת איבדת את האוצר הפטריקים!! אתה מפוטר ,😔
מה עם וילינגגגגגגגג אוף,😥
מר שיבולת אפשר לדבר איתך באינסטגרם דקה בבקשה,🥺
אחלה סירטון כמו תמיד גם אני מעלה פורטנייט כמוך ושמח ליראות שפורטנייט לא ימות לעולם,💪
עזרתה לי מאוד תודה רבה,👏
מר שיבולת אני אגם בן דוד של אורן(מת אלך),🥰
מר שיבולת מצאתי את פיט ורוקיפיט מת ורוקי מנסה להעיר אותה איפה שהיה הפרח שפיט ניסה לקטוף,😭
מר שיבולת מצאתי את פיט ורוקיפיט מת ורוקי מנסה להעיר אותה איפה שהיה הפרח שפיט ניסה לקטוף,😱
מתת אליך שיבולת תמשיך ככה מלך ,👑
יאח החלה סרטון קניתי את החולצה מהאתר אחלה חולצה ימלך סרטון פצצה !!,🎆
הווו השיבול הגדול אני מר שיבולת מרגיש כמו משקולת סוחב אנשים כן זה החיים כולם מרגישים כמו אנשים מדהימים שיבולים זה מדהים כן אנשים,👑
הווו השיבול הגדול אני מר שיבולת מרגיש כמו משקולת סוחב אנשים כן זה החיים כולם מרגישים כמו אנשים מדהימים שיבולים זה מדהים כן אנשים,🌾
הווו השיבול הגדול אני מר שיבולת מרגיש כמו משקולת סוחב אנשים כן זה החיים כולם מרגישים כמו אנשים מדהימים שיבולים זה מדהים כן אנשים,🎤
את ,👑
אך מרגיש ארים?,🤔
אן לי דיסקורד,😢
אן לי דיסקורד,😭
אין לי בטאל פאס ותמיד יש לי,😭
תביא לי ,❤️
לייק מי שצופה בזה בעונה 11,😂
לייק מי שצופה בזה בעונה 11,🔥
לייק מי שצופה בזה בעונה 11,🙏
לייק מי שאוהב את מר שיבולתתעזרו לי להגיע ל320 סאבים,💪
לייק מי שאוהב את מר שיבולתתעזרו לי להגיע ל320 סאבים,😊
קווין בגוף שלך,🤔
איפה הפטרקים ,😭
זה ממש גרוע בעברית חייב לאמר ,😂
לא קיבלתי התראה ,😢
מעריך אותך לגמרי על הסופורט אי קריאייטור ,👏
אפשר גם בבקשה סירטונים של מיינקראפט ??!,😄
אפשר גם בבקשה סירטונים של מיינקראפט ??!,👍
ימלך מר שיבולת ,💘
ימלך מר שיבולת ,❤
ימלך אוהב אתחה ימלךךךך,😍
איזה באסה אני בחול לחודש,🤣
ימלך,💙
ימלך,💜
ימלך,❤️
ימלך,💖
אם מישהו שם  שאחד הטילים נכנס לפה של המפלצת,💜
אם מישהו שם  שאחד הטילים נכנס לפה של המפלצת,☢️
אני פשוט מאתתי מהאירוע של עונה 9 המפלצת נגד הרובוט הדובי:חייבים לשים לייק למר שיבולת המלך: מי שלו שם לייק מפותר מהסירטון!!!!!!!!!!,👍
גמרת יפה אני רואה  16:43,😂
אמרת פרסומת אחת ונחזור והייתה לי פרסומת צפיתי עד הסוף,😂
מר שיבולת אם נחזור בעונה עשר בזמן למתי שהיה את דסטי דיפוט (לפי הטיזר שיצא) שזה עונה 3 אז לא יהיה את הפטריקים כי הם הגיעו יותר מאוחר למשחק,😭
ההסבר הכי טוב שיש!!,👏
סרטון טוב כמו תמיד ימלך,💪
סרטון טוב כמו תמיד ימלך,🤴
ולהפעיל את הפעמון זה עוזר המון,😂
תפוז,❤
זה קרה רק לי שמתי שהוא אמר פרסומת אחת וחזרנו באמת היה פרסומת ,😆
זה קרה רק לי שמתי שהוא אמר פרסומת אחת וחזרנו באמת היה פרסומת ,😂
 כל הכבוד,👍
אני מת על הסרטון הזה!!!,👍🏻
היי אחלה סרטון מר שיבולת ,😉
היי אחלה סרטון מר שיבולת ,♥️
שיבולת זה באמת חשוב אני חייב שתאשר אותי בדיס זה קשור לשרת פייבאם תאשר אותי בדיס Shalev זה השם #8182,🐔
יגבר אני סאב שלך ממזמן אוהב אותך  אני רואה כל סרטון,💓
שמע מה יש לך נגד קופים מה ז ה,😹
תעשה הרבה מיינקראפט זה ממש מעניין,♥️
תודה מר שיבולת בגללכה אני משלים הרבה משימות,😍
תודה יגבר עזרתה לי מלא מעריך בי!,❤
כולם shib בחנות עכשיו!!! ושמתי את הקוד ותודה לך על כול העזרה,😁
לייק מי שסיים את המשימות בגללו ,❤
מזל טוב שיבולת ,🥳
עשיתי ,❤️
עשיתי ,🎉
עשיתי ימלךך,❤
עשיתי את הכל לייקסאבפעמוןושמתי את הקוד shib בחנות וקניתי איתו ריקוד ב-800 וסקין ב-1200 דש לשיב הלמה ובהצלחה לכולם בהגרלה ,👌
עשיתי את הכל לייקסאבפעמוןושמתי את הקוד shib בחנות וקניתי איתו ריקוד ב-800 וסקין ב-1200 דש לשיב הלמה ובהצלחה לכולם בהגרלה ,❤
עשיתי הכול פלוס אבתי חברים חדשים ,😁
נירשמתי עשיתי לייק ו סב ו רשמתי את הקוד בחנות אני ממש אוהב את הערוץ שלך,🙈
