עגווניה ,🍅
באמת שיש לך כל כך הרבה פוטנציאל אבל אתה מבזבז אותו על פורטנייט ומיינקראפט⁦⁩,☹️
סוף סוף ,🔥
אהלן fish stick,🐡
אני רמה 23 ימלך,❤
זה הרדסטון גולם לא הרדסטון מונטרסטי,😅
עיניים ,😍
קקטוסים,🌵
סרטון טוב ומצחיק,🤣
סרטון טוב ומצחיק,😂
ממש מעניין,😃
עם למשהו יש תוכנת עריכה טובה במחשב שהיא בחינם אשמח עם תכתבו לי איך קוראים לה,🙂
קקי פופו,🤣
גדול  תוספת של שקר ועוד תבלין של חוסר לב וטיפה של עריכה ומה יוצא מלחמת עולם שלישית,🤣
בתחילת הסרטון הוא רשום לא לצפות בו ויש 16 אלף צפיות ,🤣
אני חושב שיוטיוב יוצאיו לך את הסירטון אבל עדיין נתתי לייק,❤
משתרה:מר שיבולת אתה עצור מר שיבולת:למה?המשתרה:בדקנו באתר מר שיבולת,😒
איזה קטע שראיתי את הפרסומת שלך לסמסונג לפני שראיתי את הסרטון הזה לול,😉
שיבולת מה קרה להראל קראפט אני מחכה הרבה זמן בקוצר רוח ו אין כלום ,😩
שיבולת מה קרה להראל קראפט אני מחכה הרבה זמן בקוצר רוח ו אין כלום ,😵
עוד סרטון!,🤠
קקטוסים ,😏
*מר המלך,🤴
אמרת שאתה לא אוהב מוטיב ימי אבל במורשת הרשת היה מוטיב ימי,😁
תחשבו על זה - זו אחת הסיבות שיצרו מים שלא הורגים - פעם מי שהיה נופל למים היה מת,💙
מי פה אחרי שדחו את הסיזן בעוד 8 ימים?,😭
ב 6:01 בצד שמאל למעלה יש דג,🤯
אפשר טריילר לעונה שתהייה עוד מעט אבל בעברית אוהב אותך,😊
לייק 93,😍
לפני 8שניות,😱
יום טוב לכולם,🙃
שיבולים שמח ,🌾
איפה האיירון גולם כשצריך אותו?,😂
זה ‏הבת שלו,😐
באתי ללחוץ עלבטל פרסומת שאתה אומר שאתה הדר אשוח,😂
תנו סאבולייקלמר שבולת בגבר על חלל,😊
תנו סאבולייקלמר שבולת בגבר על חלל,😍
הנשקהוא מהסייב דה וורלד,😝
אני משתתף בהגרלה! שם המשתמש שלי הוא spodir_mab1234הידעתם?!שניצל משיבולים הרבה יותר טעים משניצל רגיל!קורא רנדומלי: גאון!מר שיבולת: לייק לתגובה,🌾
תגובה קטלשהירק קוד שיב ,😅
תגובה קטלשהירק קוד שיב ,😁
אחי אני ממש אוהב אותך אתה היוטיובר האהוב עליי מכל הבחינות באמת אני אוהב אותך ברור ששמתי את הקוד SHIB וברור שאני סאב שלך מעשר אלף סאבים אפילו פחות  ובמידה ואזכה בהגרלה השם שלי הוא: kingpro5478 תודה רבה לך על הקריאה והראייה של התגובה והקדשת צומת הלב אוהב אותך ממני שלו,😍
אחי אני ממש אוהב אותך אתה היוטיובר האהוב עליי מכל הבחינות באמת אני אוהב אותך ברור ששמתי את הקוד SHIB וברור שאני סאב שלך מעשר אלף סאבים אפילו פחות  ובמידה ואזכה בהגרלה השם שלי הוא: kingpro5478 תודה רבה לך על הקריאה והראייה של התגובה והקדשת צומת הלב אוהב אותך ממני שלו,😇
אחי אני ממש אוהב אותך אתה היוטיובר האהוב עליי מכל הבחינות באמת אני אוהב אותך ברור ששמתי את הקוד SHIB וברור שאני סאב שלך מעשר אלף סאבים אפילו פחות  ובמידה ואזכה בהגרלה השם שלי הוא: kingpro5478 תודה רבה לך על הקריאה והראייה של התגובה והקדשת צומת הלב אוהב אותך ממני שלו,❤
עשיתי את כל השלבים וממש מקווה לנצח פעם ראשונה,😅
אני רוצה עוד פרק זה פשוט סדרה טובה מאוד תמשיך כך,👍
מר שיבולת היקר באמת תודה רבה לך שעשית את המשחק לפי דעתי הכי טוב בעולם רזידנט איוול 3 אני חולה על זה ועליך וערים כל הכבוד לך על העריכה המטורפת  שלך,👍
מר שיבולת היקר באמת תודה רבה לך שעשית את המשחק לפי דעתי הכי טוב בעולם רזידנט איוול 3 אני חולה על זה ועליך וערים כל הכבוד לך על העריכה המטורפת  שלך,🥳
מר שיבולת היקר באמת תודה רבה לך שעשית את המשחק לפי דעתי הכי טוב בעולם רזידנט איוול 3 אני חולה על זה ועליך וערים כל הכבוד לך על העריכה המטורפת  שלך,🙏
מר שיבולת היקר באמת תודה רבה לך שעשית את המשחק לפי דעתי הכי טוב בעולם רזידנט איוול 3 אני חולה על זה ועליך וערים כל הכבוד לך על העריכה המטורפת  שלך,❤
תמשיך עם הסדרה ברור,👍
אני רק רוצה שתידעושאין פואנטה לתגובה הזאת,😁
סירטון מגניב מחכה כבר לחלק שלוש,👍
תודה כמה חיקיתי לזה,❤
מלך,👑
מלך,❤
איזה מלך כן ברור שהצלחתי תודה ממש אל הכל  רק שיבולת ,🌾
איזה מלך כן ברור שהצלחתי תודה ממש אל הכל  רק שיבולת ,💖
תודה אלוף ,🗯
דובים דובים דובים דובים דובים דובים דובים דובים דובים דובים דובים דובים דובים דובים דובים,😂
היי מר חיטה,🤗
היי מר חיטה,🍞
מר שיבולת שאני לחוץ אז אני תמיד צופה בך וזה עוזר לי תודה יש לך תוכן מעניין ורק בבקשה אתה יכול לעשות רזידנט איוול 3 חלק שני עם חברה שלך בבקשה,🌹
מר שיבולת שאני לחוץ אז אני תמיד צופה בך וזה עוזר לי תודה יש לך תוכן מעניין ורק בבקשה אתה יכול לעשות רזידנט איוול 3 חלק שני עם חברה שלך בבקשה,🔥
מר שיבולת שאני לחוץ אז אני תמיד צופה בך וזה עוזר לי תודה יש לך תוכן מעניין ורק בבקשה אתה יכול לעשות רזידנט איוול 3 חלק שני עם חברה שלך בבקשה,🙏
מר שיבולת שאני לחוץ אז אני תמיד צופה בך וזה עוזר לי תודה יש לך תוכן מעניין ורק בבקשה אתה יכול לעשות רזידנט איוול 3 חלק שני עם חברה שלך בבקשה,👏
מר שיבולת שאני לחוץ אז אני תמיד צופה בך וזה עוזר לי תודה יש לך תוכן מעניין ורק בבקשה אתה יכול לעשות רזידנט איוול 3 חלק שני עם חברה שלך בבקשה,❤
מטיפה כל המידע הזה על העונה!? תותח,👻
מלך,🎧
מלך,🔊
מלך,👍
מלך,❤
אני מתה על הסירטוני פורטנייט שלך אני לא צוחקת,😅
אני מתה על הסירטוני פורטנייט שלך אני לא צוחקת,💞
אני מתה על הסירטוני פורטנייט שלך אני לא צוחקת,❤
לייק קל,🔥
מוזמנים לשתף את הסרטון להעלות מודעות ולהתחיל לבדוק את המקורות שלנו בשביל שלא ניפול לתוכן פייק ,🤗
חאליסי,😭
הראו את הסירטון הזה בחדשותמי שראה שיתן לייק,👍🏻
מזל טוב מר שיבולת היית בחדשות (בערוץ 12),🎉
אני כל כך מודה לך ברגע שראיתי את זה מיד מחקתי את כל הטוויטים עם הפנים שלי בטוויטר  נ&quot;ב אני עוקב אחריך באינסטגרם ובטוויטר,😃
עוד לא הבנתי גם אחרי שנכנסתי לקישור איך אני עושה את ,🤦‍♂️
אתה אלוף שי כל הזמן מחכה לסרטון הבא שלך כיף לצפות בסרטונים שלך,👍
איך אני אמור לדעת שאתה הוא מר שיבולת האמיתי????,🤣
אם אומרים לנו באינטרנט להיזהר ולא להאמין לכל מה שאומרים זה אומר שגם אנחנו לא אמורים להאמין לך?,🤔
נראה חריף לגמרי! ,🌶
אמאלה אני לא רוצה שישנו את פורטנייט ,😥
לייק מי שידע לפני הסרטון,🙈
מר שיבולת אם לא שמת לב יש לוגין סקרים שקוראים לו ASTROWILD שנותן מאלה רמזים לעונה הבאה ולמה שהולך לקרות בבקשה תבדוק את זה ואולי גם תשים את זה בסרטון בבקשה(ההאאא ודבר שני אתה מלך ואני מת על הסרטונים שלך במיוחד על כל האשארות על עונות הבאות ועל סיפורים ש מתרחשים בפורטנייט מת אליךך יא מלך ,👑
מר שיבולת אם לא שמת לב יש לוגין סקרים שקוראים לו ASTROWILD שנותן מאלה רמזים לעונה הבאה ולמה שהולך לקרות בבקשה תבדוק את זה ואולי גם תשים את זה בסרטון בבקשה(ההאאא ודבר שני אתה מלך ואני מת על הסרטונים שלך במיוחד על כל האשארות על עונות הבאות ועל סיפורים ש מתרחשים בפורטנייט מת אליךך יא מלך ,🤞
אני לא מאמין זה פשוט מטורף אין עליך אתה אח רואים שאתה דואג לכולם ,❤️
חחחחח,🤣
הרגתם אותיייייי,😂
אוי זה טוב,😂
חחחחחחחח,😹
חחחחחחחח,😂
אפשר עדכונים על הסיפור של פורטנייט??? מי שרוצה שיתן לייק!!!! עכשיו,😁
אין לי מילים,🤣
חחחחחחח יא גאון!! ,🤣
חחחחחחח יא גאון!! ,😂
מתתתתתת קורע בטירוף תמשיך עם הסרטונים האלההההה ,🤣
מתתתתתת קורע בטירוף תמשיך עם הסרטונים האלההההה ,😂
מתתתתתת קורע בטירוף תמשיך עם הסרטונים האלההההה ,😁
מצחיק חחחחח,👍🏽
חחחחחחחחחחחחחחחחח ,😂
חזק חחחחחחח ,🤣
חחחח גדול,🤣
חחחח אני מתתתתת יואוו אין עליך אתה כישרון מבוזבז לך תיצור מערכונים סרטים (וכמובן תמשיך לעלות סרטונים) חולה עליך! ,❤️
תמשיך עם זה עוד בבקשה??,🥺
הא הא קפיטליזם,🤣
רגע אז עכשיו אי אפשר להשיג את הדג בשדרוג של עונה 9 אבל אני מתקבן לשדרוג של עונה 9 שהראתה רק בפעם השניה ,🥺
אוהב אותך נרשמתי לערוץ לחצתי על הפעמון ועשיתי לייק יא מלך ,👑
אהלן!!!! עשיתי סאב ולייק ושמתי אתהקוד שלך בחנות אני מת עליך,❤
שיבולת : חושב על סרטוןדג האהלן בא שיבולת יאווווו דג האהלן לאאאאאאשיבולת בום סרטון,🖕
תמשיך את הסדרההה ,🙏
היי באירוע של טראוויס סקוט מופיע שם קווין והפרפר,🤯
ואי,🙆‍♂️
ואי,😱
המלך,🤑
המלך,🤯
בבקשה תעשה סרטון המשך,🙏
תלמדו מערים ילדיםתמיד תתחילו סרטון עם זום אין לשיניים ,🦷
אני שמתי לייק,❤
שמתי ,👍
אני ממש רוצה שהגמדים ינצחו (ומה שאני יודע לכתוב עכשיו רציני לגמרי וממש לא נושא לצחוק עליו) אני יחסית גמד ואולי ינצחו אנשים יחשבו אחרת גם על גמדים במציאותאפשר לקוות  ,🙏
אני ממש רוצה שהגמדים ינצחו (ומה שאני יודע לכתוב עכשיו רציני לגמרי וממש לא נושא לצחוק עליו) אני יחסית גמד ואולי ינצחו אנשים יחשבו אחרת גם על גמדים במציאותאפשר לקוות  ,😟
ממש אהבתי את הסרטון,👍
אחלה סרטון כרגילתעשה עוד כאלה!,💥
תשחק רובלוקס יוצרים מודים וכולי או שחחתי תנו לייק אם אגתם עד לשוף של מה שקתוב ותראה בבקשה את הדגובה ותראה אותה לשירותן מצחיק אחד ימלך,🇮🇱
תשחק רובלוקס יוצרים מודים וכולי או שחחתי תנו לייק אם אגתם עד לשוף של מה שקתוב ותראה בבקשה את הדגובה ותראה אותה לשירותן מצחיק אחד ימלך,🌈
תשחק רובלוקס יוצרים מודים וכולי או שחחתי תנו לייק אם אגתם עד לשוף של מה שקתוב ותראה בבקשה את הדגובה ותראה אותה לשירותן מצחיק אחד ימלך,💎
תשחק רובלוקס יוצרים מודים וכולי או שחחתי תנו לייק אם אגתם עד לשוף של מה שקתוב ותראה בבקשה את הדגובה ותראה אותה לשירותן מצחיק אחד ימלך,❤️
תשחק רובלוקס יוצרים מודים וכולי או שחחתי תנו לייק אם אגתם עד לשוף של מה שקתוב ותראה בבקשה את הדגובה ותראה אותה לשירותן מצחיק אחד ימלך,👑
זה היה הדבר החי מטורף שראיתי תודה שצילמתה את זה⁦⁩⁦⁩,❤️
זה היה הדבר החי מטורף שראיתי תודה שצילמתה את זה⁦⁩⁦⁩,♥️
אני היחיד שלא עבד לו ,😡
רק SHIB in the Shop,👍🏻
מזכיר לכם שיש חולצות שיבולת חדשות אם בא לכם להסתכל יש לינק בתיאור ,🤗
מר שיבולת חזק כמו משקולת כי הוא אוכל סולת הוא הורג אנשים והוא רוצה רק קילים הוא עושה תכנים ברמה ויוטיוברים מעתיקים ממך ברימאה ( פליזזז תפרסם אותי בסרטון הבא),🙃
מר שיבולת אני חולה עליך רשום כמנוי ונתתי ,👍
אולי זה קשור לקורונה,🤔
אולי בבקשה תחזור להעלות משימות קשה לעשות משימות בלעדיך,🙂
ימלך אני רואה כל סרטון שלך,👑
ימלך סרטון טוב כמו תמיד,😇
שעורה מעפןרק שיבולת,💪
מר שיבולתאתה היוטיובר היחיד שיש לו תוכן איכותי טוב ומעניין מאודאתה לא מהיוטיוברים האלה שוחשבים רק על כסף כסף וכסףהסרטונים שלך על הסנאפשוטים יותר כיפים לצפייה מאשר סרטוני סנאפשוטים של יוטיוברים אחריםאתה תמיד יודע ובודק הכלאתה גם רציני וגם ציני וזה שילוב מטורףאתה יודע בדיוק מתי לעשות קאטתמשיך להעלות,👍🏻
מר שיבולתאתה היוטיובר היחיד שיש לו תוכן איכותי טוב ומעניין מאודאתה לא מהיוטיוברים האלה שוחשבים רק על כסף כסף וכסףהסרטונים שלך על הסנאפשוטים יותר כיפים לצפייה מאשר סרטוני סנאפשוטים של יוטיוברים אחריםאתה תמיד יודע ובודק הכלאתה גם רציני וגם ציני וזה שילוב מטורףאתה יודע בדיוק מתי לעשות קאטתמשיך להעלות,❤
אולי שלגיה ופו הדוב משתפים פעולה עם פורטנייט ? יאח,❤️
אולי שלגיה ופו הדוב משתפים פעולה עם פורטנייט ? יאח,🧐
אני בצאד של הדובים,🧸
אני בצאד של הדובים,🐻
תעשה עוד אחד אני אוהב את הסרטונים פורטנייט שלכה ,👍
הא ואתה מעלה תוכן ממש טוב וכיף ואתה מביא לי המון מידעה אני אוהב אותך,😃
ותעשה יותר פורטנייט בבקשה פליז,😎
ותעשה יותר פורטנייט בבקשה פליז,😃
בבקשה בבקשה תמשיך עם פיקסלמון,🥺
איך עובד יוטיוב:9 צפיות ו-70 לייקיםאוהב אותך ימלך אני איתך בצוות השיבולים,🤦
איך עובד יוטיוב:9 צפיות ו-70 לייקיםאוהב אותך ימלך אני איתך בצוות השיבולים,🌾
מר שיבולת/שי אתה היוטיובר האהוב עלירק קוד שיב,🌾
שיבולת ,🤫
מת עליך! אתה יוטיובר מעולה! אתה יכול בבקשה להכניס אותי לסרטון,🙂
ישששששש הגעתי לתגובה על המסך,😉
ישששששש הגעתי לתגובה על המסך,😃
תצטרפו למועדון של שיבולת ותיהיו שיבולים ולא חיטה,🌾
ממוסחר ,😡
הייתי שמח להשתתף אבל לא מרשים לי,😓
חולה עליך שיבולת אני כבר מלא זמן בערוץ שלך לפחות שנה⁦⁩,❤️
חבל שזה עולה כסף ,🙁
שיבולת אני יכול לקבל רול תומך הצטרפתי למועדון השם של זה Ilay,🖤
מה קורה! אני אנסה להיצטרף,👍
מר שיבולתאיזה כיף שאתה שם את המוזיקה של סיזן6 כי אסור לי לקנות וי באקס אז לא קניתי איך אני מתגעגע!,❤️
מר שיבולתאיזה כיף שאתה שם את המוזיקה של סיזן6 כי אסור לי לקנות וי באקס אז לא קניתי איך אני מתגעגע!,😜
יש אל יווני שקוראים לו מידאס שכל דבר שהוא נגע בו הפך להיות זהב אולי זה קשור?ויש כיסא זהב למידאס אולי זה קשור?,🤔
היה סרטון מעניין ומצחיק בסוף,😂
שי אין אלייך תמשיך ככה !! אני נהנה מכל סרטון שלך כל פעם מחדש ויש לי ערוץ שלא כל כך מצליח לי ויש לי בו כבר 40 ומשהו סרטונים תוכל אולי לבדוק אותו ולהגיד לי מה אתה חושב אשמח מאוד אם תיתן לי ביקורת אוהב אותך,😭
שי אין אלייך תמשיך ככה !! אני נהנה מכל סרטון שלך כל פעם מחדש ויש לי ערוץ שלא כל כך מצליח לי ויש לי בו כבר 40 ומשהו סרטונים תוכל אולי לבדוק אותו ולהגיד לי מה אתה חושב אשמח מאוד אם תיתן לי ביקורת אוהב אותך,😅
שי אין אלייך תמשיך ככה !! אני נהנה מכל סרטון שלך כל פעם מחדש ויש לי ערוץ שלא כל כך מצליח לי ויש לי בו כבר 40 ומשהו סרטונים תוכל אולי לבדוק אותו ולהגיד לי מה אתה חושב אשמח מאוד אם תיתן לי ביקורת אוהב אותך,💓
אחד הסרטונים הכי מעניינים שלך ,💙
אחד הסרטונים הכי מעניינים שלך ,🤩
נתתי סאב לייק ופעמוןימלך יגבר,😘
נתתי סאב לייק ופעמוןימלך יגבר,😍
קורונה,🖕
אם זה מוד אז לא הצלחתי,😂
זה יהיה במשחק האמיתי? ויהיה בסורביבל? כי אם כן אני כותב שיבולת בעברית ולא צריך לחפש דיימונד ,🤓
זה יהיה במשחק האמיתי? ויהיה בסורביבל? כי אם כן אני כותב שיבולת בעברית ולא צריך לחפש דיימונד ,😁
בבקשה תעשה על 117 ,🙏
מת עליך סרטון מצויין כמו תמיד אני מאוד אוהב את התוכן שלך ואת הערוץ שלך יא מלך ,👑
מר שיבולת אתה יכול בבקשה לעזור לי ולומר לי אם איזה מכשיר אתה מצלם את הנינטנדו אני אשמח לדעת אני צריך את זה זה ממש ממש יעזור לי תודה רבה,😊
נקושש עצים,🌴
כשאמרת ok goggle זה פתח לי בטלפוןלמה אמרת? למה להפסיק לי באמצע,😆
איזה קרוע ,😅
אבא שלי חשב שאתה מדבר עם חבר שלי אז הוא מסר לחבר ד״ש אבל זה חבר שלי אז הוא מוסר לך ד״ש,😜
אבא שלי חשב שאתה מדבר עם חבר שלי אז הוא מסר לחבר ד״ש אבל זה חבר שלי אז הוא מוסר לך ד״ש,😝
סרטון מעולה משחק מצחיק אולי תשחק גם בsowrdנתתי לייק נרשמתי לערוץ מיזמן,♥
חחחח ב3:40 אני קפצתי מהזומביי ואז הבנתי אחרי זה מה זה,😂
היי מצאתי בונקר חדש בפורטנייט והייתי שמח שתעשה עליו סרטון אם אתה לא מכיר אותו אני אשמח להראות לך @מר שיבולת SHIB,👋
אתה פשוט מלך!,👑
אתה יכול לעשות על בראול סטארס בבקשה????????,🙏
יש לי את הכלף שאולה שלושים אלף שקל,🤑
מר שיבולת אשמח עם תעשה פרק כזה על seven deadly sins אני לא יודע אם יש משחקים והסדרה לא כל כך מוכרת בינתיים אם אתה לא מכיר תחפש בנטפליקס seven deadly sins מקווה שתתייחס לתגובה שלי  קיצר יש מצב שאתה תעשה על זה פרק?,😃
על מיינקראפט! על מיינקראפט! ,😁
אני מת אילך את הכי טוב שיש ⁦⁩⁦⁩⁦⁩⁦⁩ אין אליך ערים/ארים,❤️
אני מת אילך את הכי טוב שיש ⁦⁩⁦⁩⁦⁩⁦⁩ אין אליך ערים/ארים,🙉
אני מת אילך את הכי טוב שיש ⁦⁩⁦⁩⁦⁩⁦⁩ אין אליך ערים/ארים,🙈
אני מת אילך את הכי טוב שיש ⁦⁩⁦⁩⁦⁩⁦⁩ אין אליך ערים/ארים,🙊
jast cuos 4 בבקשה מלך,👑
חחחחחחחה ,😄
חחחחחחחה ,🤣
חחחחחחחה ,😅
חחחחחחחה ,🤭
חחחחחחחה ,😂
מה זה השטויות האלה &quot;דג אהלן&quot;!!!!מר שיבולת כנס כנס לבידוד בדחיפות חחח׳חחח ובדרך תוריד לעצמך איזה כפה שטות!!! חחחח׳חחחח ,🤣
מה זה השטויות האלה &quot;דג אהלן&quot;!!!!מר שיבולת כנס כנס לבידוד בדחיפות חחח׳חחח ובדרך תוריד לעצמך איזה כפה שטות!!! חחחח׳חחחח ,😂
אתה קרינג&#39;,😊
חחחח אהלן החשאי,🐠
אחלה סרטון ,😀
‏אני ילד בן תשע ‏שיבולת תקשיב בדיחה אם אתה ושועל הייתם ‏מוכרים מאכל איזה מאכל הייתם מוכרים? ‏שיבולת שועל!,😂
מר שיבולת אתה הנס לחיי אני רציתי להתאבד כי אף אחד לא אוהב אותי ובבית הספר מרביצים לי ובזכות הסרטונים שלך אני לא התאבדתי אשמח לדבר איתך בדיסקורד,❤
אני הלייק האלףףף,😱
תעשה חוות איירון אני אוהב אותך,🧨
ימלך ,❤
שיבולת אתה היוטיובר האהוב עלי ואני מקווה שתגיע למיליון סבים!!!!,❤️
איזה איכות!!!,🤯
אל תפסיק את הסדרה באמת היא ממש כיפית לצפייה ויש מלא כריזמה וצחוקים ובאמת ממש כיף ,❤️
אירוע סודי בפורטנייט אתה לא אומר מי שמסכים שיתן לייק,😡
זה המוד שלי כי קוראים לי הראל,🤯
המילה מר שיבולת אומר בכל פרק של חבילת המודים *מדהים*,🤣
המילה מר שיבולת אומר בכל פרק של חבילת המודים *מדהים*,🥯
המילה מר שיבולת אומר בכל פרק של חבילת המודים *מדהים*,🍞
המילה מר שיבולת אומר בכל פרק של חבילת המודים *מדהים*,🥖
אני הצופה השנימת עליךסמנתי לייק הפעלתי את הפעמוןנירשמתי לערוץ שלך,😎
אני הצופה השנימת עליךסמנתי לייק הפעלתי את הפעמוןנירשמתי לערוץ שלך,🔔
אני הצופה השנימת עליךסמנתי לייק הפעלתי את הפעמוןנירשמתי לערוץ שלך,👍
אתה מלך !!!!,👑
רק אני שמתי לב שיש לשי שיער ירוק?,😂
רק אני שמתי לב שיש לשי שיער ירוק?,😅
אשכרה עברה כבר כמעט חצי שנה מתחילת הקורונה ,😱
אשכרה עברה כבר כמעט חצי שנה מתחילת הקורונה ,😭
שיבולת אתה יודע מתי הדג המנהל יוצא לפורטנייט אני ממש מחכה לואגב אני רשום ושמתי לייק ,🤪
עשיתי סאב במקום לייק ,🤙🏾
עשיתי סאב במקום לייק ,🤘🏾
