אני חושב שבצילום רגיל סמסונג לוקח יותר טוב כי התמונות יותר אמיתיות וחדות אבל בצילום וידאו אני חושב שהאיפון לוקח יותר ומי שמיצר תוכן בווידאו אני הייתי ממליץ את האיפון אבל מי שמצלם המון תמונות כמו למשל אינסטגרם אז אין ספק שהסמסונג עדיף אני מנש אוהב את סגנון הסירטונים כי יש לך המון דברים מעניינים ואני ממש אוהב את התוכן שלך הוא מאוד עזר לי בקנית טלפון אני קניתי את הסמסונג כי אני פשוט מכור לצילומים אתה מלך ואין עליך ותמשיך ככה אני חושב שאתה בדרך הנכונה ,❤️
אני חושב שבצילום רגיל סמסונג לוקח יותר טוב כי התמונות יותר אמיתיות וחדות אבל בצילום וידאו אני חושב שהאיפון לוקח יותר ומי שמיצר תוכן בווידאו אני הייתי ממליץ את האיפון אבל מי שמצלם המון תמונות כמו למשל אינסטגרם אז אין ספק שהסמסונג עדיף אני מנש אוהב את סגנון הסירטונים כי יש לך המון דברים מעניינים ואני ממש אוהב את התוכן שלך הוא מאוד עזר לי בקנית טלפון אני קניתי את הסמסונג כי אני פשוט מכור לצילומים אתה מלך ואין עליך ותמשיך ככה אני חושב שאתה בדרך הנכונה ,🔥
מטורף,🔥
אהה ושכחתי להגיד סקירה אשש,🔥
אני חייב להגיד שאני סמסונג מאז שיש לי טלפון ואני פשוט כל פעם אומר לעצמי שאין כמו סמסונג הפשטות הנוחות הגמישות ופשוט מערכת הפעלה ממש טובהאני ממש לא אוהב את הגוון שהאייפון עושה לא מבין למה אומרים שזה טבעי זה כל הזמן טבעי יותר מידילא אומר שהאייפון לא מצלם טוב אבל הסמסונג עוקף אותו בכל פרמטר אחר אם לא בכל הפרמטרים חוץ מצילום הוידאו (שליטרלי לא מצאתי הבדל) סמסונג נותנים חדות ופירוט של התמונה לדעתי ברמה הכי גבוהה שיש היום,🙃
נדירר,❤️
נדירר,🤩
סרטון מעולה!!!! שים לב לא לשגר את האירוע שלא תקבל סטרייק כמוני ,🤷🏻‍♂️
אין אין לי מילים     1000000 מיתוך 100 סרטון טוב ערוץ לא טוב ערוץ הכי טוב וכמובן יש עוד הרבה  אגב גם לי יש ערוץ אתה יכול לראות אותו?,😲
אין אין לי מילים     1000000 מיתוך 100 סרטון טוב ערוץ לא טוב ערוץ הכי טוב וכמובן יש עוד הרבה  אגב גם לי יש ערוץ אתה יכול לראות אותו?,😃
אאאא ופסח שמח לכל מי שקורה את זה ,😃
סוקר מעולה! אני אוהב את הסירטונים שלך ,❤️
וואו איזה השקעה וכמה אינפורמציה אתה מציג בסרטון אני פשוט מתפעל בכל פעם מחדש! ולחשוב שככה אתה משקיע ב&quot;מכשיר ביניים&quot; - צילומים בפנים צילומים בחוץ משחק במכשיר מעברים טקסט יושב טובהבתי מאוד את האמירה שלך לגבי השורה התחתונה - ושאתה לא מתבייש להגיד את מה שאתה חושב בצורה מכובדת (לא עושה ספויילרים מי שרוצה לדעת צריך לראות) כיף לראות שאתה משחרר סרטון וכבר יש כמה תגובות מאוד חיוביות מהקהל שלך - אתה #תוכן,🔥
סרטון מטורף  כמו תמיד תמשיך ככה  אגב גם לי יש ערוץ,🙃
סרטון מטורף  כמו תמיד תמשיך ככה  אגב גם לי יש ערוץ,💥
כל כך הרבה תוכן ומלא עניין מרגישים שאתה משקיע בסרטון ולא נותן לצופה לרגע להשתעמם החשיבה והירידה לפרטים האלה הופכים אותך למקצוען הן בתוכן והן בגישה כלפי הצופה ,🙏
וואלה ראיתי הרבה סקירות של אנשים אבל באמת אתה עושה את זה ממש מגניב! כאילו ממש מעניין מסקרן באמת!,😇
שמע אתה רמה גבוהה המון בהצלחה וכיף להיות בין המנויים הראשונים לפני ה100k בקרוב,😏
אם כל זה שהסרטון מדהים הדבר הכי מדהים פה זה הדיקציה שלך זה משהו מטורף תותח תמשיך ככה תגיע רחוק,💪🏼
אם כל זה שהסרטון מדהים הדבר הכי מדהים פה זה הדיקציה שלך זה משהו מטורף תותח תמשיך ככה תגיע רחוק,🔥
סקירה נהדרת! אני כבר קניתי,😊
מטורף!!  סקירה מצויינת,🙏🏼
מטורף!!  סקירה מצויינת,💪🏼
מטורף!!  סקירה מצויינת,🔥
סרטון מטורף כרגיל,😄
תקשיב אין לי מילים אתה יוטיובר מטורף אין לי דרך לתאר אותך אני פשוט חולה עליך אתה משקיע ומתמיד בתוכן תמשיך ככה גם לי יש ערוץ ואני יודע כמה זה קשה להכין תוכן כזה מושקע ועדיין אתה עושה את זה אין עליך תמשיך ככה,😊
תקשיב אין לי מילים אתה יוטיובר מטורף אין לי דרך לתאר אותך אני פשוט חולה עליך אתה משקיע ומתמיד בתוכן תמשיך ככה גם לי יש ערוץ ואני יודע כמה זה קשה להכין תוכן כזה מושקע ועדיין אתה עושה את זה אין עליך תמשיך ככה,❤
תקשיב אין לי מילים אתה יוטיובר מטורף אין לי דרך לתאר אותך אני פשוט חולה עליך אתה משקיע ומתמיד בתוכן תמשיך ככה גם לי יש ערוץ ואני יודע כמה זה קשה להכין תוכן כזה מושקע ועדיין אתה עושה את זה אין עליך תמשיך ככה,🙏
תקשיב אין לי מילים אתה יוטיובר מטורף אין לי דרך לתאר אותך אני פשוט חולה עליך אתה משקיע ומתמיד בתוכן תמשיך ככה גם לי יש ערוץ ואני יודע כמה זה קשה להכין תוכן כזה מושקע ועדיין אתה עושה את זה אין עליך תמשיך ככה,💥
סרטון מטורף  וערוץ מטורף אגב גם לי יש ערוץ טכנולוגיה ,🙃
סרטון מטורף  וערוץ מטורף אגב גם לי יש ערוץ טכנולוגיה ,🔥
אני לא מאוהדי אפל ולכן הסיכום המהיר הזה בא לי בול,👍
אלוף! אחלה סיכום ובמהירות האור ,👏🏽
אחלה סרטון כרגילאבל אני לא יודע אם זה רק אצלי אבל שומעים פחות טוב מבכללי,😬
מטורף ים אוהב אותך מעריך מה שאתה עושב ביוטיובתודה רבה,🙏
אללה עוד סרטון מטורף של ים!  אלוף סרטון מדהים ועריכה פשוט מגניבה !! ,😍
אללה עוד סרטון מטורף של ים!  אלוף סרטון מדהים ועריכה פשוט מגניבה !! ,🦾
יצא מושלם!!,😍
היי ים אתה מלך ואתה חייב לקבל את התמיכה שמגיעה לך!!אני צופה חדש שלך ואני רואה את כל הסרטונים שלך והם פשוט מדהימים!  תודה אההה והעריכה פשוט מטורפת,❤
היי ים אתה מלך ואתה חייב לקבל את התמיכה שמגיעה לך!!אני צופה חדש שלך ואני רואה את כל הסרטונים שלך והם פשוט מדהימים!  תודה אההה והעריכה פשוט מטורפת,🔥
היי ים אתה מלך ואתה חייב לקבל את התמיכה שמגיעה לך!!אני צופה חדש שלך ואני רואה את כל הסרטונים שלך והם פשוט מדהימים!  תודה אההה והעריכה פשוט מטורפת,🙏🏼
כל הכבוד על הסרטון  ובכללי על הרמה הגבוה של הסרטונים שלך גם לי יש ערוץ ואני יודע כמה זה קשה להכין סירטונים ברמה כזאת ,👋
כל הכבוד על הסרטון  ובכללי על הרמה הגבוה של הסרטונים שלך גם לי יש ערוץ ואני יודע כמה זה קשה להכין סירטונים ברמה כזאת ,🥳
תותחחחחחח!!!תוכן ברמה הגבוהה ביותר כל פעם מפתיע מחדש,💪
אחלה סרטון ,🔥
אחלה טלפון אבל אני לא סובל את One uiסקירה מעולה ,🔥
תמשיך ככה אחי מגיע לך הרבה יותר תמיכה ,🧡
איזה מלך סקירות אש יש לך ,🔥
וואי וואי הלוואי עליי,😄
ים יא אגדה,🔥
קשה לי לראות אותך ב-287 סאבים! אתה רמה אחרת לגמריי!!,🤯
אחי אתה מלך  אתה יכול לעשות סרטון של הVR של אפל? הגב יש לי ערוץ של VR,👑
וואי וואי ורק שתדע ים הסקירות שלך עלו רמה אני עוד זוכר את הסקירות מהמרפסת,😅
הדבר היחיד שהכי נכון זה …הכובד,😳
או שאתה פשוט לא חזק חח סתם סתם,😂
בסדר תגיד תודה על מה שיש יש ילדים שאין להם אוכל ואתה מתלונן על אייפון 13 ,🙏
בסדר תגיד תודה על מה שיש יש ילדים שאין להם אוכל ואתה מתלונן על אייפון 13 ,😓
תיקנה את הפרו הרגיל,😁
נוקיה מחזיקה חודש ,🤣
מתי האייפון 13 פרו מקס,🤔
מתי האייפון 13 פרו מקס,😡
מתי האייפון 13 פרו מקס,😑
לי יש אחד כזה,🤩
אם שחר אומר מי אני שאתווכחעזוב שאני משתמש עם nokia c2,😁
אם שחר אומר מי אני שאתווכחעזוב שאני משתמש עם nokia c2,😂
גלקסי S22 אולטרה מספר  בסמארטפונים ,👍
גלקסי S22 אולטרה מספר  בסמארטפונים ,🥇
&quot;האחרון שיצא&quot;אני מתודרך אגב ראשון,😄
אין על סמסונג בעולם הפאלפון הכי טוב בעולם  ים המלך,❗
אין על סמסונג בעולם הפאלפון הכי טוב בעולם  ים המלך,👑
אין על סמסונג בעולם הפאלפון הכי טוב בעולם  ים המלך,‼️
אין על סמסונג בעולם הפאלפון הכי טוב בעולם  ים המלך,😍
אין על סמסונג בעולם הפאלפון הכי טוב בעולם  ים המלך,👀
שמע אם הצלחת להפריע לצביקה לאכול אתה בדרך הנכונה ,😜
תקשיב אין לי מה להגיד אתה פשוט תותח תוכן איכותי ומעולה אתה משקיע נורא בערוץ מעורר השראה יאלוף,🏇
שמחתי להתארח (ולאכול)! סרטון נהדר ותענוג סוף סוף להיפגש ,🥰
אתה משקיע ברמה אחרת מגיע לך הרבה יותר רשומים אח תמשיך ככה ,❤️
אתה משקיע בטירוףףף,🔥
נדירר,🔥
נדירר,❤️
פשוט מדהיםאתה אלוף אחי,❗
פשוט מדהיםאתה אלוף אחי,‼️
מדהים!,🔥
מדהים!,❤️
ראשון,🦾
סרטון נהדר ים! אוליי יותר מידיי קליקים אחי,😆
לפעמים אני בא לסרטונים רק בשביל העריכה,😆
אחלה סרטון מקצוען כמו תמיד,👑
מדהים,🔥
מדהים,❤️
מושלם,❤️
היי לכולם שמי יוקי צ׳אן ואני חדשה בעולם הגיימינג ואני מנסה את מזלי להתפרסם ביוטיוב ולהראות את ההתקדמות שלי במשחקים ! אשמח לעוקב ,🧡
סרטון אש ,🔥
איך הכרטיס מסך המפלצתי הזה נכנס אני לא יודע,😎
סרטון מטורף וסקירה מלך ,👑
סרטון מטורף וסקירה מלך ,🔥
חזקק אתה יכול לעשות סרטוני פורטניט? זה יכול להיות מגניב,😁
סקירה מטורפת,🔥
מדהיםם,❤️‍🔥
סרטון טוב,👍
יוטיובר לא מוערך מגיע לך הרבה יותר רואים שאתה משקיע,😀
אחלה סרטון ,👌🏼
קודם לייק ורק אז צופה ילד מוכשר כבר אמרתי תגיע רחוק אח נב אפל תמיד תישאר בעיני החברה הכי טובה יאח מה נעשה,😅
קודם לייק ורק אז צופה ילד מוכשר כבר אמרתי תגיע רחוק אח נב אפל תמיד תישאר בעיני החברה הכי טובה יאח מה נעשה,🔥
סרטון בטוח שעוד תגיע לאלפי צפיות,💯
סרטון בטוח שעוד תגיע לאלפי צפיות,💥
סרטון בטוח שעוד תגיע לאלפי צפיות,🔥
מכירים את זה שחבר שואל אתכם &quot;תגיד יש לך במקרה המלצה על סמארטפון חדש יחסית מחברה מוכרת מבלי שאצטרך לפשוט את הרגל&quot;? אז בדיוק בשביל רגעים כאלה המציאו את Yam Olisker YT שמכתיר בסרטון החדש שלו את ה-Samsung Galaxy M52 5G כ&quot;מלך החדש של מכשירי הביניים&quot;  מוסר השכל: כשיש לכם שאלה על סמארטפונים - הולכים לים    #תוכן #יוצריםתוכן,🌊
מכירים את זה שחבר שואל אתכם &quot;תגיד יש לך במקרה המלצה על סמארטפון חדש יחסית מחברה מוכרת מבלי שאצטרך לפשוט את הרגל&quot;? אז בדיוק בשביל רגעים כאלה המציאו את Yam Olisker YT שמכתיר בסרטון החדש שלו את ה-Samsung Galaxy M52 5G כ&quot;מלך החדש של מכשירי הביניים&quot;  מוסר השכל: כשיש לכם שאלה על סמארטפונים - הולכים לים    #תוכן #יוצריםתוכן,🏖
חברה מי שלא נרשם לערוץ של ים הוא פראייר,🙂
אם כבר דיברת על עמדות טעינה,😉
סרטון ברמה גבוהה מאוד,💪🏼
וואי איזה שרירים,🔥
אחלה סקירה,👌🏼
מושלםםם!!,❤️
היי ים יש לי שאלה קטנה לי יש אייפון 13 פרו 128 ג׳גהואני תוהה מה יותר טוב במידה וארצה לשווק את העסק שלי בסרטון דרך האייפוןהאם לצלם ב4k רגיל על 60p או לצלם ב1080p 30p ProRes?אשמח לאיזה הבהרה כי זה מאוד קשה להבין אינני צלם וחשוב לי לדעת מה יטיב עם העסק שלי כי איכות מושכת מאוד עין של אנשיםתודה על המענה ,🙏🏻
סרטון ערוך ומושקע עם הרבה מחשבה וצורת הגשה באינטליגנציה ברמה גבוהה תמשיך להפגיז באופן יחיד ומיוחד כמו שרק אתה יודע!,👍🏼
סרטון ערוך ומושקע עם הרבה מחשבה וצורת הגשה באינטליגנציה ברמה גבוהה תמשיך להפגיז באופן יחיד ומיוחד כמו שרק אתה יודע!,⭐
סרטון ערוך ומושקע עם הרבה מחשבה וצורת הגשה באינטליגנציה ברמה גבוהה תמשיך להפגיז באופן יחיד ומיוחד כמו שרק אתה יודע!,😉
ים יאלוף אוהב את ההסברים שלך קצרים ולעניין ,❤
סרטון מעולה אחי  זה מטורף לראות איך האייפונים החדשים מתחילים להתחרות עם המצלמות והרבה יוצרי תוכן מתחילים ליצור קליפים עם האייפון החדש כדי להראות ש Gear Doesn’t Matter אם אתה מכיר את הבמאי Cole Bennet ( עושה קליפים לראפרים הכי מפורסמים) אז אחד הקליפים האחרונים שלו צולם באייפון 13 והוא באמת הראה שהיצירתיות הרבה יותר חשובה מאיזה ציוד יש לך,🙏
תותח אח יקראיזו מצלמה יותר טובה לדעתך אייפון 13 פרו או 21 אולטרה?,🔥
וואוווו איזו עריכה תקשיב אתה משקיע בטירוףףףף מתי תעלה את הסקירה על האס 22 אולטרה?,🔥
מטורף שלך עוד סרטון באיכות פסיכית,💪🏼
מטורף שלך עוד סרטון באיכות פסיכית,❤️
מטורףףףף,💪🏼
עוד סרטון איכותי מאת ים,🔥
תחחדש נראה ,🔥
סרטון מועיל תודה,🙏🏻
זכור אותי שתגיע למאה אלף סאבים הא,😅
זכור אותי שתגיע למאה אלף סאבים הא,❤️
הופה ים אחלה סרטון,🔥
אחלה סרטון,👍
תתחדש! קנית מאסטרפיס ,👌
הכי איכותי בארץ,💯
מביכים את אינטל עם הנתונים האלה נחכה לדור 12,🤧
תותח,👌
סקירה ואו אתה יוטיובר תותח,✔️
סקירה ואו אתה יוטיובר תותח,🔥
סרטון מושלם! תודה רבה,👍🏻
סרטון מושלם! תודה רבה,🤩
אחלה סקירה! תודה רבה ,🙏🏽
טוב אתהאיך מפעילים את מצב 120 הרץ יש לי את ה13 פרו מקס? או זה מופעל אוטמט ?,❤️
למה לבן אבל? ,😏
סרטון ברמה ,🔥
איזה כיף לפתוח את השבוע עם סרטון,🔥
סרטון מטורף,💪🏽
סרטון מטורף,🔥
מאיפה הכסף אינעל דינקדרך אגב אחלה של סקירה,🔥
אלוף,👌
למי שרוצה לראות את התמונות שצולמו בעזרת האייפון 13 שמופיעות בסרטון באיכות המלאה: https://wwwinstagramcom/p/CU-BFhyoWEr/?utm_medium=copy_linkכל התמונות צולמו על ידי בעזרת האייפון 13 ,❗
למי שרוצה לראות את התמונות שצולמו בעזרת האייפון 13 שמופיעות בסרטון באיכות המלאה: https://wwwinstagramcom/p/CU-BFhyoWEr/?utm_medium=copy_linkכל התמונות צולמו על ידי בעזרת האייפון 13 ,😎
תותח אחי אחלה סקירה,👌
וואו תודה אחי ממש עוזר ,🔥
וואו תודה אחי ממש עוזר ,💕
הוא איתי בשכבה,🤲
אחלה סקירה ,❤️
סקירה מעולה,😀
תודה על הסקירה יא מלך ,👑
סרטון מעולה תמשיך ככה,👍🏽
וואו! סקירה מושלמת! ,❤️
אוהב מאוד את התוכן שלך גבר אבל זה רק אני או שהסאונד מוזר קצת הסרטון הזה?,🔥
מטורףהתוכן האיכותי בארץ,💪🏼
מטורףהתוכן האיכותי בארץ,🔥
אחלה סקירה  תודה רבה  לא ידעתי שה Cinematic Mode עובד רק ב 1080 ו 30fps ,🙏🏽
אחלה סקירה  תודה רבה  לא ידעתי שה Cinematic Mode עובד רק ב 1080 ו 30fps ,👌
אחלה סקירה  תודה רבה  לא ידעתי שה Cinematic Mode עובד רק ב 1080 ו 30fps ,🤦🏻
אחד הסוקרים הטובים שיש ביוטיוב מעריך מאוד,👍🏻
אחד הסוקרים הטובים שיש ביוטיוב מעריך מאוד,🔥
סרטון,🔥
סקירה מעולה!!! ,😍
סרטון ,🔥
זה לא הגודל זה האיכותסרטון ,🔥
רמה אחרת של סרטון !!! ,👍
סרטון מעולה! ,😍
יתותחח,❤️
אלוףףףףףףףףף!!!!!,😍
אלוףףףףףףףףף!!!!!,❤️
אלוף אחלה סרטון אבל לדעתי שנה הבאה הולך להיות שדרוג יותר טוב כי יהיה אייפון בלי נוץ׳,🔥
מה אתה אומר הסרטון הזה יהיה שווה שלא ישנת?,😴
אחלה סרטון,💪🏼
יאגדה ,❤️
פיצוץ,🏆
אפליקציות חזקות ביקר לי,💪
אחלה חולצה של FRIENDS ,👨‍👨‍👦‍👦
מה עם איימק??,😭
זה מזה יכול לעזור לי בלימודים יש כזה גם לסמסונג?,😂
יש לי את האייפד פרו m1 ואני מת לקנות אותו,😍
 מצויין!,👌🏻
סרטון ,🔥
אתה דומה לפריזי רק ש-לך יש שיער ג’ינג’י ,😅
אחלה סרטון,👍🏼
בראבו  על הסרטון וההסבר אהבתי!,👏
אתה מלך תעשה אולי סקירה על המצלמה עם העדשה fujifilm xs10 + 16-80 בבקשה יא מלך תבקש אפילו מהיבואן של פוגיפילם יא ,👑
מאיפה יש לך כסף לזה,😂
וואו! סרטון נדירררררמחכה לשרת דיסקורד כדי לתת ניטרווווו,🔥
אחלה סרטון,💪🏼
עשית חשק! אולי נקנה איזה 2? ,😅
מלךךךךךך שכנעת אותי לגמריייייי איך אפשר להודות לך אל כל התוכן המשובך שלך?? אני עכשיו בגרמניה ואין לי פה טלוויזיה אז אתמול בלילה עשיתי בינג׳ ים אוליסקררררר,❣️
סרטון מעולה,🔥
תותך,💥
כולם גאנגסטרים עד שההורים של ים מרשים לו להישאר עד מאוחר מת עליך אחי,🔥
סרטון מטורף,🔥
אני מעריץ ,🔥
אני מעריץ ,😜
אני מעריץ ,❤️
מזל טוב  מגיע לך! ערוץ מעולה ,👌
מזל טוב  מגיע לך! ערוץ מעולה ,👏🏽
כל הכבוד ים תמשיך עם העבודה הנהדרת ,👑
מזל טוב כל הכבוד יש לך סרטונים מטורפים ומדהימים אתה צריך להיות עם בערך 8000000,🥳
מת עליך מלך,😎
סרטון טוב ,🤟
לקחת במקרה את זה מדף עובדות באינסטגרם,😏
שימושי מאוד סרטון טיל תודה,🚀
מלך,💪🏼
כל הכבוד !!! וידאו מעולה אפשר לשאול איזה מיקרופון אתה ממליץ לאנדרואיד ?,😉
כל הכבוד !!! וידאו מעולה אפשר לשאול איזה מיקרופון אתה ממליץ לאנדרואיד ?,❤️
סרטון אש ,🔥
אש,📽
בדיקה 123 בדיקה,🎤
סרטון מעולה ים דיברת על כל מה שצריך לדעת,👌
אתה כל כך משתפר!!! אלוף,🔥
וואלה החכמתי ,😸
חזק,👌
מזל טוב אל 1000 מנויים ,🔥
תודה רבה על האנבוקסינג ים אוליסקר הצמיד החכם הזה מציל חיים! הצמיד התממשק לאפליקציית כללית אקטיב ול MiFit ולדעתי בצמידים החכמים הבאים הוא יתממשק לקופות החולים כדי לנתר את מצב בריאותך ויהיה אפשרות להדפיס אקו לב במקום שאנשים יסתובבו עם הולטר מיושן הטכנולוגיה הזו הולכת לשבור את שוק הרפואה בישראל ובעולם הצמיד החכם הבא שיומי סמארט בנד 7 מדברים על זה שהוא יגיע עם &quot;מד חום&quot; פנימי שיבדוק אם יש למשתמש חום או לא ויתריע על כך ובנוסף מנסים להכניס טכנולוגיה של מד סוכר ולחץ דם ברגע שטכנולוגיות אלו ישולמו ויוטמעו אנחנו נחווה שינוי קיצוני בתוחלת החיים אנשים יחיו הרבה יותר ממה שאנחנו מכיריםתודה רבה על הסרטוןברק ברקאי,👏
תודה רבה על האנבוקסינג ים אוליסקר הצמיד החכם הזה מציל חיים! הצמיד התממשק לאפליקציית כללית אקטיב ול MiFit ולדעתי בצמידים החכמים הבאים הוא יתממשק לקופות החולים כדי לנתר את מצב בריאותך ויהיה אפשרות להדפיס אקו לב במקום שאנשים יסתובבו עם הולטר מיושן הטכנולוגיה הזו הולכת לשבור את שוק הרפואה בישראל ובעולם הצמיד החכם הבא שיומי סמארט בנד 7 מדברים על זה שהוא יגיע עם &quot;מד חום&quot; פנימי שיבדוק אם יש למשתמש חום או לא ויתריע על כך ובנוסף מנסים להכניס טכנולוגיה של מד סוכר ולחץ דם ברגע שטכנולוגיות אלו ישולמו ויוטמעו אנחנו נחווה שינוי קיצוני בתוחלת החיים אנשים יחיו הרבה יותר ממה שאנחנו מכיריםתודה רבה על הסרטוןברק ברקאי,❤️
אשמח שתעשה סקירה על Honor Band 6,☺
סקירה יפה מאוד חבר,👍
ים תוכל סרטון הסבר איך לחבר את השעון לטלפון בבקשה  אני בטוח שעוד רוצים,🙏
יוו חיכיתי לסרטון הזה כ&quot;כ הרבה זמןןןן,😍
יוו חיכיתי לסרטון הזה כ&quot;כ הרבה זמןןןן,✌️
מרוב שהסרטון היה טוב חשבתי אתה אלון יא מלך סאב בין הראשונים שלך יא אלוף (זה אני מדבר איתך כל יום באינסטגרם חחחחח) ,❤️
