סוף סוף,👑
היי רק רציתי להגיד שממש נהנתי מהסרטון !!דרך אגב באתי מהערוץ של אלון גרעיני אמר שאתה אחלה של בחור אז באתי,😁
היי רק רציתי להגיד שממש נהנתי מהסרטון !!דרך אגב באתי מהערוץ של אלון גרעיני אמר שאתה אחלה של בחור אז באתי,❤
אתה מלךךךך,😍
אתה מלךךךך,❤️
זה רק אני או שזה נראה כאילו ים עשה קרחת?,❤️
סרטון טוב ,🔥
וואו איזו רמה!,🤯
תותח,😜
תותח,❤️
סליחה בלתי אפשרי לעקוב אחרי ההסבר שלך תסביר לאט יותר,⏳
סרטון מדהים אשמח אם תתנו לייק ותגובה לסרטון האחרוןתודה,🙏
סרטון מדהים אשמח אם תתנו לייק ותגובה לסרטון האחרוןתודה,😃
ואוו סרטון מעולה  אני ממליץ לך לעשות אולי גם על אייפון או אנדרואיד זה יכול להיות נחמד,👍
ואוו סרטון מעולה  אני ממליץ לך לעשות אולי גם על אייפון או אנדרואיד זה יכול להיות נחמד,🔥
אלוף,🔥
סרטון מעולה אחי ,😁
כל הכבוד,👍
כל הכבוד,🔥
תותח,💪
מה קורה אנשים ?אני מקווה שכולם בסדר בתקופה ההזוייה הזאת אשמח שתרשמו לי מה אתם חושבים על הסרטון ?והאם תרצו שאני אעשה לייב ? (כאילו האם תכנסו לראות אותו כשאני אעשה )תודה רבה לכם ותשמרו על עצמכם ,🥴
מה קורה אנשים ?אני מקווה שכולם בסדר בתקופה ההזוייה הזאת אשמח שתרשמו לי מה אתם חושבים על הסרטון ?והאם תרצו שאני אעשה לייב ? (כאילו האם תכנסו לראות אותו כשאני אעשה )תודה רבה לכם ותשמרו על עצמכם ,😁
מה קורה אנשים ?אני מקווה שכולם בסדר בתקופה ההזוייה הזאת אשמח שתרשמו לי מה אתם חושבים על הסרטון ?והאם תרצו שאני אעשה לייב ? (כאילו האם תכנסו לראות אותו כשאני אעשה )תודה רבה לכם ותשמרו על עצמכם ,🔥
מת עלייך הסקירות שלך מדהימות שתגיע ל100k,👑
איזה מלך!! מעריץ גדול,👑
איזה מלך!! מעריץ גדול,❤️
אייפד פרו אני קונה אותו השבוע תכף אני יגיד לכם עד כמה הוא טוב ,😃
אני צופה בזה דרך האייפד 129 ,😅
ממש טוב ריספקת,👏
ועוד אתה רק מתחיל מה יהיה בהמשך,💪🏻
ועוד אתה רק מתחיל מה יהיה בהמשך,🔥
אחלה סרטון מבין שאתה עדיין תלמיד לפי הקלסוס באייפד,😁
סרטון פשוט מדהים! רמה שכמעט לא רואים בארץ השוואה מדהימה ותוכן כלכך מקצועי כמעט ואין ביוטיוב בארץ פשוט להוריד את הכובע! הסבר מפורט ולעניין ורואים את ההשקעה שיש בסרטון בהצלחה עם הערוץ,💪
סרטון פשוט מדהים! רמה שכמעט לא רואים בארץ השוואה מדהימה ותוכן כלכך מקצועי כמעט ואין ביוטיוב בארץ פשוט להוריד את הכובע! הסבר מפורט ולעניין ורואים את ההשקעה שיש בסרטון בהצלחה עם הערוץ,🔥
וואו השתפרת כל כךךךך,👏
בן אדםםםםם אתה קולט שאלון גרעיני צופה בך??? ועוד פירגן לך בקומיונטי שלו,🤯
סרטן טוב ,🤟
מקצוען עוד תגיע רחוק ,🔝
באתי מאלון,😘
תותחבאתי מהפוסט של אלון גרעיני,🤙🏻
תותחבאתי מהפוסט של אלון גרעיני,🔥
אולי למוצר הבא תסקר מיתת גיימינג זה גם אם RGB,🔥
אני חייבת לדעת מאיפה קונים אחד כזה כי אני כבר שבוע ימים מחפשת ולא מוצאת בבקשה תגיד לי מאיפה קנית את שלך זה ממש יעזור לי,🙏🏻
אני חייבת לדעת מאיפה קונים אחד כזה כי אני כבר שבוע ימים מחפשת ולא מוצאת בבקשה תגיד לי מאיפה קנית את שלך זה ממש יעזור לי,❤️
סרטון מעולהוהייתי ממליץ פחות לצלם מלמטה כי יש הרבה אור וזה נראה מוזר לפי דעתי יותר עדיף מלמעלה ב45 מעלות אבל חוץ מזה הכל מעולה הסיקור שלך טוב הכל פשוט מעולה,👍
ערוץ קטן עם פוטנציאל גדול,❤
מלך,👑
מגניב אחלה של סקירה  אני בדיוק מתכנן לסקר את ה 65t שלהם אצלי,🔥
לא ראיתי את הסרטון כי היה חג סרטו כרגיל,🔥
תספורת ,🔥
מלך,👑
אהבתי תסרטון ,👏
אהבתי תסרטון ,💥
אני יגיד לך את האמת המיקרופונים של הלפטופ נשמעו יותר טוב איכשהו מהמיקרופון שלך (הסאונד נשמע קצת רובוטי) אולי זה רק עניין של הגדרות של המיקרופון שכדאי לסדר חוץ מזה סרטון מדהים,💪
השקעה מטורפת תמשיך ככה,🔥
מלך,👑
הערוץ הזה הולך להתפוצץ בקרוב ,💥
הערוץ הזה הולך להתפוצץ בקרוב ,🔥
תמשיך עם הסרטונים יתותח,💪🏽
תמשיך עם הסרטונים יתותח,❤️
אחלה סרטון! יש לי שאלהאיך יש לך את הכסף לקנות את כל המוצרים שאתה עושה עליהם סקירות? ,🤗
רמה גבוהה רואים שיש לך המון ידע ושאתה אוהב לעשות את הסרטונים האלהוכמה שהרמה גבוהה רק רוצה להגיד משהו קטן על הכתוביות שמופיעות על המסך כשאתה מסביר:1 צריך לשנות את הפונטים + להשקיע יותר בעיצוב של כל כתובית להוסיף צללים וקווים תוחמים משהו שיבליט אותם2 תנסה לשלב את הכתוביות במקום בפרימייר באפטר כדי שהם יזוזו לפי התנועת מצלמה/ שיהיו בול איפה שאתה רוצה ויתאימו לסביבת צילוםנראלי שאם תעשה את זה באמת זה רמה של הטופ חוץ מזה אתה תותח במה שאתה עושה ואני בטוח שתהיה אחד הגדולים אם תתמיד,🙌
ערוץ ברמה מאוד גבוהה מגיע לך הרבה יותר סאבים,👌
איזה סקירות!!!!!!!!!!!!!!!בעתיד תעשה סקירות על רחפנים?ימלךךךךךךך לייק 3,💚
תמשיך ככה ותצליח,🔥
אשמח שתעשה סקירות על מוצרי גיימינג,♥️
סרטון טוב אחי ,✌
אתה הערוץ המוביל הבא,😇
אתה הערוץ המוביל הבא,🤩
מקווה שאהבתם את הסרטון  (אל תשכחו להירשם לערוץ להפעיל את הפעמון  ולתת בלייק )אשמח לדעת אם יש מוצר טכנולוגיה ספציפי שהייתם רוצים שאני אסקור בערוץ ?! (תגיבו לתגובה שלי),👍
מקווה שאהבתם את הסרטון  (אל תשכחו להירשם לערוץ להפעיל את הפעמון  ולתת בלייק )אשמח לדעת אם יש מוצר טכנולוגיה ספציפי שהייתם רוצים שאני אסקור בערוץ ?! (תגיבו לתגובה שלי),🔔
מקווה שאהבתם את הסרטון  (אל תשכחו להירשם לערוץ להפעיל את הפעמון  ולתת בלייק )אשמח לדעת אם יש מוצר טכנולוגיה ספציפי שהייתם רוצים שאני אסקור בערוץ ?! (תגיבו לתגובה שלי),🔥
סרטון מעולה תמשיך ככה,👍
הגעתי מאלון תצליח אחי,😁
הגעתי מאלון תצליח אחי,🙏
הגעתי מאלון תצליח אחי,👍
הגעתי מאלון תצליח אחי,❤️
ימלךךך הגעתי מאלון תצמיד,😉
הגעתי מאלון,💪
אחי אתה פאקינג גאון!!,😻
תעשה סרטון שאלות ותשובות ,😁
היי באתי מאלון גרעיני וישר בסרטון הראשון רואים שאתה משקיע וזה ערוץ איכותי מקווה שתגדל כי באמת צריך אנשים כמוך ביוטיוב ישראל בהצלחה,👍
הגעתי מאלון גרעיני ,😉
הגעתי מאלון גרעיני ,😂
טיפ - אם אתה מתכנת והקובץ שלך כל כך ארוך כנראה הגיע הזמן לחלק לקבצים,😜
היי גם אני אוהב טכנולוגיה ולומד מדעי המחשב מעריך תאמת שאני התלבטתי בין העכבר שלך לAnywhere 3 ובסוף בחרתי בAnywhere כי דבר ראשון הוא זול יותר וגם קומפקטי יותר כי אני צריך אותו גם לדרכים שנראה לי שהיה יותר נוח וקל לתפעל אותו בכל מקום אבל בכללי אני קניתי את העכבר הזה רק בגלל הגלגלת והשימוש בין שלושה מחשבים כי יש לי נייד ונייח אז זה מטורף בכל מקרה רציתי להגיד לך שהסרטון פצצה איכות וידאו וסאונד ממש טובים וממש אהבתי את כל הרקע שלך יפה בטירוף קיצר תודה לך על הסרטון הזה מקווה שרק תצליח,💪
היי גם אני אוהב טכנולוגיה ולומד מדעי המחשב מעריך תאמת שאני התלבטתי בין העכבר שלך לAnywhere 3 ובסוף בחרתי בAnywhere כי דבר ראשון הוא זול יותר וגם קומפקטי יותר כי אני צריך אותו גם לדרכים שנראה לי שהיה יותר נוח וקל לתפעל אותו בכל מקום אבל בכללי אני קניתי את העכבר הזה רק בגלל הגלגלת והשימוש בין שלושה מחשבים כי יש לי נייד ונייח אז זה מטורף בכל מקרה רציתי להגיד לך שהסרטון פצצה איכות וידאו וסאונד ממש טובים וממש אהבתי את כל הרקע שלך יפה בטירוף קיצר תודה לך על הסרטון הזה מקווה שרק תצליח,🤯
קניתי לפני מספר ימים בזכותך(זה אני מהדיסקורד),🤫
קניתי לפני מספר ימים בזכותך(זה אני מהדיסקורד),😉
באתי מאלון גרעיני אחלה סרטון וערוץ,🔥
באתי מאלוןותשמע אתה אחלה גבר חבל שלא שמעתי עליך קודם ,🙃
באתי מאלוןותשמע אתה אחלה גבר חבל שלא שמעתי עליך קודם ,❣
באתי מאלון! אחלה סרטון אחי,👌
באתי מאלון שמתי לייק וסאב על הדרך ,😁
אתה יכול גם לעשות סרטוני גיימינג כמו פורטנייט ועוד אם תוכל אהיה אפשר להיות איתך בסרטון על משחק? ,🙏
תמשיך להפציץ!,💣
איכותי אתה תמשיך ככה,🎬
איכותי אתה תמשיך ככה,🔥
ברצינות סירטון מעולה אבל פיטי פטה7:11,🤣
כולם לעשות סאב עכשיו !!!!!! ערוץ יוטיוב ברמה גבוהה אתה מעולה תמשיך ככה,😄
